text,group
Sian tho  the cp no free on sunday,btohqsg
They v gd la  sometimes delay me will give free otak,btohqsg
I take liao wun report to CS,btohqsg
Usually I arrive earlier and it’s always ready,btohqsg
Haha  they look quite free   dunno  wait lor,btohqsg
All staff members at a Sheng Siong  supermarket outlet in Bukit Batok to be swabbed after employee tests positive for COVID-19. The store will be closed for two days.https://cna.asia/3yfD315,btohqsg
Haha he work from 7am to 12am one leh,btohqsg
I think his daily mileage smelly smelly 300km,btohqsg
3 stack 6-7pm..last order 654pm..traffic soon2,btohqsg
Lol for $18 bucks tour sg today,btohqsg
Cannot peng..off on friday..if really peng for sat and sun will really pancit,btohqsg
Me need super fast finger now,btohqsg
Wonder if lta will give chance this mth,btohqsg
Be careful when taking orders from tanyu. They place the fish with mala soup in a paper box. I dunno how not to spill the soup.,btohqsg
Dont waste time..go home rest liao..not much orders or empty liao..,btohqsg
Today during 12-1pm saw next week car orders out..fast see fast gone,btohqsg
Mine 450-460 full tank same price ..😂😂😂,btohqsg
BREAKING: All primary and secondary schools  as well as JCs and Millennia Institute  will shift to full home-based learning from May 19 to 28.https://str.sg/JvgTPre-schools and student care centres will remain open. Parents  however  are encouraged to keep their children at home given the spike in Covid-19 cases:https://str.sg/Jvgc,btohqsg
Night time order suddenly become zero,btohqsg
weird but yep  seems like no more orders for tonight  or very few.,btohqsg
Lucky early swipe 2 orders  low price but nearby,btohqsg
Little india  Chinatown  mat have late night food orders,btohqsg
Next week forecast high order..considering kids home base,btohqsg
My fren PHV all come do llm  bo passengers,btohqsg
Gg ...phv grab stack llm stack...tio complain llm order late tio ban..🙈🙈,btohqsg
Ya lo  scare this will extend again  haiz,btohqsg
I rather sent food..food dont talk backnor attitude..only staffs attitude,btohqsg
I saw a friend just now..doing full time grab..doing grabfood..2 stack order 26+12surge..no deduct comm..robertson quay to tpy/bishan,btohqsg
my grp got 1. 3 gf stack $38 + 18.then he stack 2 llm. $48. go home after tt.,btohqsg
Life is tough  gambateh bros nights,btohqsg
Dont forget to cashout before 2359,btohqsg
This pickup location is it all the COVID one?,btohqsg
Ah..okok i ask lalamove to cancel tmr,btohqsg
Y don't they call taxi.... So many things ?,btohqsg
wah u normally take jobs 6 days in advance?,btohqsg
I did 4jobs out of 3 for the mission  why is it shows only 2 completed?,btohqsg
Has been like that recently. U can either live chat n inform cs  or email to llm with screenshots of the jobs completed,btohqsg
cashout will take one week right?,btohqsg
i’ve been trying to log into my llm account but the app kept saying there’s no account with this number. any idea why?,btohqsg
No car jobs😲or too fast snapped up,btohqsg
Ya. Everyone is looking money 💰,btohqsg
You cannot complaint to army u also cannot complaint to ur mummy,btohqsg
Yea.. dun look for car jobs anymore,btohqsg
Enjoy life pple appreciate things lol,btohqsg
Given this covid is active  think no amount of vaccines will get us out of it,btohqsg
Just pray it wont mutate to deadly versions,btohqsg
WHO if u watch from the start of this till now,btohqsg
They always seems to have something to hide,btohqsg
From no sick no wear mask   to pls wear mask to wait for vaccinations to vaccinations r out but covid mutated,btohqsg
Taiwan so happy then now also ganna again,btohqsg
Sg removed them from safe country list,btohqsg
Go there to find girlfriend la,btohqsg
More than 1 stop superbike cannot move,btohqsg
What make and model is ur bike,btohqsg
But now our Muslim friends/stalls not on holiday anymore  will get more orders from them,btohqsg
Hari raya orders were quite underwhelming,btohqsg
All I see are cheap cheap bike orders😅,btohqsg
Yea LL  see lunch time how then..,btohqsg
Maybe my rating no good enough no high price jobs,btohqsg
View shd not be dependent on rating,btohqsg
Oic. That's even worse. Can see cannot eat🤣🤣🤣,btohqsg
How long u no do llm😂,btohqsg
they have definitely tweaked the way the orders refresh. it's slower and harder to tell if its low orders or too many riders.,btohqsg
Aso good lah too fast see until heart attack,btohqsg
could be that majority of the orders just didnt make it to our screens.,btohqsg
Car or bikeThere is priority ping for certain driver,btohqsg
Izit I just wash car this morning damn,btohqsg
I ask ah meh wash to9 haha,btohqsg
Hi if customer call no reply back can cancel order? Call and SMS dun wan reply,btohqsg
Hello isit me or it’s normal my app no ping tdy,btohqsg
Btw anybody encounter before arh ur llm account money got auto deducted 🤷🏼‍♂️,btohqsg
Waa die my app or acct got problem Liao,btohqsg
Maybe was due to cancelled order. Chat with CS,btohqsg
Knn  raining still All bike jobCannot filters?,btohqsg
U gt cheat code y need fliter,btohqsg
there's a lalahelper app in playstore. but you have to key in your llm password.,btohqsg
Give your ps to otherU want?,btohqsg
