text,group
Now sit home camp for aj for tmr onwards,btohqsg
Rmb to sit for theory test,btohqsg
Llm if cash out wen cn get,btohqsg
How to get this o bro,btohqsg
Is inside the grab hitch app?,btohqsg
Group sizes down from 5 to 2  dining-in suspended as Singapore tightens COVID-19 measureshttps://www.channelnewsasia.com/news/singapore/covid-19-phase-2-dining-in-work-from-home-tightened-measures-14808382,btohqsg
No dining out. Are food deliveries going to sky rocket?,btohqsg
Last time I applyDon't know need whatI don't bother,btohqsg
no bcoz the phv drivers got no work n will switch to food delivery. so evens out.,btohqsg
this round the shops are still open  last year many lost jobs so got a lot of excess riders.,btohqsg
If u came at 250pm just arrive take pic of the rest and put as loading..,btohqsg
From 3pm onwards u can claim waiting time..if u forgot  good luck,btohqsg
3 bikes to one car lol,btohqsg
What is phv?Everything still operating.Shops opened.Some public spaces reduce capacity.Work from home.,btohqsg
If advanced booking can stack up to 3?,btohqsg
Piang tdy 2 advance jobs kena cancel liao🙄,btohqsg
Tmr menu...slotting in to chiong tmr onwards,btohqsg
Long queue for time and get ready alot la la move orders,btohqsg
Item over size order cancel claim half fee,btohqsg
If on top one ok below the long square box jialat,btohqsg
I whack cos got +3 peak +$2 subsidy,btohqsg
U all really fast finger sia,btohqsg
Last stop bukit panjang just nice i can go home,btohqsg
I wanted to take esplanda initally but only 1 order +$6,btohqsg
Take note great world city weekend no grace period.,btohqsg
Nx one to stack was fairmont nearest but bo hua,btohqsg
3 bike orders are from same restaurant?,btohqsg
Not fast..just familliar with the area..tap see vendor take..,btohqsg
I got time to check lol,btohqsg
Like phase 1 is coming back,btohqsg
Overheard from office staff in lift   an indian from dort taken to hospital for test cos sick  while waiting for result the indian headed out took a cab n go airport attempting to get air ticket back to india,btohqsg
I see town alot of car orders lei..,btohqsg
I think can go out shopping,btohqsg
Happen is long queue at ntuc,btohqsg
Cannot dineNo ppl will go out,btohqsg
Can go out ..2 pax only,btohqsg
Go to Sheng Siong do Part Time😂,btohqsg
Got one more +6 but finger slow,btohqsg
Next year Sheng Shiong 15 months bonus again..haha,btohqsg
anybody collected durians from this shop,btohqsg
accepted order at 8.01  reached his place at 8.15,btohqsg
he promised his customer to deliver at 745,btohqsg
no order stacked in between tell him  he say he know... end up give bad review,btohqsg
24 new community COVID-19 cases reported in Singapore today  of which 13 are linked to the Changi Airport cluster.The day’s new case total of 52 is also the highest in more than 3 months.https://cna.asia/3ycXQ5i,btohqsg
whose e one in e wrong,btohqsg
arranged delivery at 8.01pm  tell me 8.02 closing shop,btohqsg
Then? This user give u bad review ?,btohqsg
Email cs for all the conversation,btohqsg
n my rating dropped damn a lot!!!,btohqsg
he say he know tt i didn stack jobs in the chat  and then in e ratings he say i go a lot of diff place,btohqsg
ya e cs is seriously i waited damn long,btohqsg
this is reali damn pek chek,btohqsg
is this even fair to us as drivers,btohqsg
something i hate abt lalamove is tt all e customers have bigger say than us... and e cs is totally non responsive,btohqsg
if we r stuck at e pickup or drop off  we can onli wait n do nothin,btohqsg
just purely deliver his 1 order throughout,btohqsg
even he acknowledge tt he know tt i didn take any other orders,btohqsg
you would have to fill up that form. some customers are just very horrible.,btohqsg
wat happened?? how come drop so much? will it affect e probability of jobs tt we get?,btohqsg
Ya  just explain to the cs and move on,btohqsg
Yeah hard to bid if many driver joined,btohqsg
I also from rating 5 to 2 suddenly,btohqsg
ive had one that gave 9 locations at very different locations to finish in 3 hours. and gave a 1 star rating when it's really just impossible to do so.,btohqsg
Yeah  take the balance jobs lor,btohqsg
this order is stupid  he ordered for delivery at 8.01  his customer expects to be delivered at 7.45,btohqsg
Yeah  me too  10 drops completed for 4 hours customer never day ty   cb,btohqsg
isit e person who should manage his customers instead of me?,btohqsg
so how’s ur hit rate for the jobs now,btohqsg
So far ok la  I complete 3 jobs yesterday,btohqsg
well. its always a game of blame. and we are at the bottom of it all. just move on.,btohqsg
This llm I part time part time,btohqsg
He talk is easy and ask him to come do and he think our car is 🚀🚀,btohqsg
If can take then take lo,btohqsg
he should just deliver himself to c whether if it is manageable,btohqsg
n his location is collect from toa payoh  drop at casuarina  sembawang and jurong west,btohqsg
I seen customer is fucker lazy and dun know that we will do for living for our table of food,btohqsg
Today i kena tuas to changi 45 bucks.half way through there customer call and say they give me wrong document.i u turn and take the right document and they tip me another 20 dollars,btohqsg
I need to do at least 3 trip 2 hours,btohqsg
Ok la  2 way also 1 hours,btohqsg
After changi then need to return to tuas,btohqsg
For me I wan sia  haha,btohqsg
I dun +20 n car rates,btohqsg
But likely i will stack lolol,btohqsg
Then now i kena at pioneer crescent to changi 33dollars.callfor pick up at 4.40.reach their warehouse item not reach yet.customer say nevermind just wait i pay u extra..,btohqsg
if u dun have any other orders on hand then should b fine right,btohqsg
I just now start at11.nowonly do 2 jobs.2 jobs already 80dollar.plusthis one $33 plus plus.okla,btohqsg
I dont know how to do stack orders.because i afraid i cannot commit,btohqsg
For old birds with experience with stack orders i salute you guys,btohqsg
U do more few months also become old bird  I also new bird with 2 weeks  haha,btohqsg
I took a wrong AJ..lan lan have to cxl my 7pm tmr ..Zzz...,btohqsg
I would rather do outskirts of singapore rather than town area..very scary with the parking prices,btohqsg
Friday Motorcycle Orders Flash Surcharge! Earn additional $5 for each motorcycle performed today from 5.30pm to 7pm.,btohqsg
Knn i bid liao then give,btohqsg
I could have gotten $15 more,btohqsg
Bid liao don't have one arh,btohqsg
Feel happy lol the orders she nv put in one order so i can clear mission by 3,btohqsg
Peak surcharge change to $5 lo,btohqsg
Not all orders have +5...wait lo,btohqsg
Bike orders more worth to do,btohqsg
Tts all for me today  going home to my kids~ drive safe pple and have a great weekend  stack stack and safe smooth drive,btohqsg
Haha  I scare also  fit nice nice,btohqsg
Tmr schedule liao...near2 car order take and do to peng steering for 19 ordrr tier,btohqsg
1130Marina boulevard to binjalMarina boulevard to sixt avenue..Take from same restaurat..go go stack,btohqsg
I start at 1pm..so go take..the majestic restaurant v fast out order..,btohqsg
Stop at road side and dash take lift go up 4th floor...quick turnaround,btohqsg
U reach 1130 the food ready liao..,btohqsg
U park at the road side  hazard light chiong to the lift go up,btohqsg
Pin drop is where u make a quick stop,btohqsg
Wtf customer cancelled. But put driver cancelled?,btohqsg
What happen my rating is 3 ?😞,btohqsg
Due to 1 star ratingBetter write in and contest,btohqsg
For food delivery if the note never mentioned the delivery timing  so is it must reach within 1 hr?,btohqsg
I think becos i late and the restaurant kept calling me  then I go to wrong way,btohqsg
Mean no way to write in?,btohqsg
How to increase back to rating ?,btohqsg
I think u got suspended? Below 4 stars cannot work,btohqsg
Can I still able to accept job?,btohqsg
I never got below 4 stars,btohqsg
No harm tryingSay u went wrong way,btohqsg
Go appeal better3 star will always lose bidding,btohqsg
How to appeal? Live chat or call?,btohqsg
Do both ways email and live chat,btohqsg
No need to work anymoreGo cancel accountAnd reopen again hahaHopefully give u back 5 stara,btohqsg
U will get suspended n will received for going for refreshments course,btohqsg
Unless more people giving u 5 🌟then your rating will go up. Do more pick start tomorrow,btohqsg
OK  waiting for their message to inform...,btohqsg
U will not getting any order on that day u will know your acc suspended,btohqsg
LLM cancel  customer cancel or u ask to cancel still put as driver cancell,btohqsg
Did 2 years u will become like me 😆,btohqsg
Juz hit 1yr.. nowhere near half of that,btohqsg
Normal go for refreshments course then can continue again,btohqsg
U keep doing rating go up u won't get suspended,btohqsg
My rating drop to 4.7 now go up back 4.9,btohqsg
Yes more people gave u 5 star 🌟your rating will slowly go up,btohqsg
The alcohol @ sim Lane they won't allow you to take two of their booking ah,btohqsg
You need to deliver within an hour,btohqsg
U call and ask CSO adjust?,btohqsg
Ppl cant help it if aunties like him 😛,btohqsg
How do you claim? I kenna before order oversized. I reached vendor. Then vendor called me I told vendor his order is oversized. Then he cancelled it. When I reached vendor I tried to call Lalamove and also live chat via app but all cannot contact. Sometimes Lalamove is like impossible to contact. Then how?,btohqsg
His super bike thats why he chiong all e way,btohqsg
Tdy alot of pple cheong go out eat... Last day😂,btohqsg
Bobian  only 2 ppls can go out together tmr onwards,btohqsg
Im not later i order lalamove food ok,btohqsg
Hi guys  if accepted job for bike  raining still proceed with the job or can request cancel?,btohqsg
Bro u cancel due to rain is invalid cancellation which will lead to suspension,btohqsg
I'm sis...haha  so raining also must choing?,btohqsg
U do grab roo panda better haha no offense those app can cancel like crazy,btohqsg
No need risk low ratings oso,btohqsg
Got limitations but llm is the most strict of all apps,btohqsg
I did gf and roo beforeGot cancel but never lead to suspensionsOnly i do llm will get suspended,btohqsg
Gf can msg cust. Will send late due to rain. Most of the cust understand de. Somemore grab no timing to send,btohqsg
They can meet in the house cannot meh? Maximum 2 ppl in the houseThe govt already tot of ppl who pak toh,btohqsg
No need to worry this if you are forever alone#me🥲,btohqsg
the moment one student gets covid school goes hbl,btohqsg
Me charm  got 2 kids  how to being them out with my wife I also donno,btohqsg
the difference now is that most shops are still open. if they force-close we're effectively in circuit breaker.,btohqsg
Ya  one hold one then using whatsapp,btohqsg
If u do roo u will get ban so count urself lucky hah,btohqsg
Guys anyone know how long will CS will be available on average waiting time?,btohqsg
Sibei long wait no one respond,btohqsg
How customer know we stacking ?,btohqsg
Lalamove app not working for anyone else?,btohqsg
My profile  wallet and jobs all empty,btohqsg
I cannot enter app but order still pop out notification,btohqsg
No more high surcharge for Orchard jobs😂,btohqsg
Happened to me just now too but now working fine,btohqsg
I got job in next 30mins,btohqsg
The city sq mall.... Management slap own face,btohqsg
Can't see address.. how to go?,btohqsg
This dk light how many stick,btohqsg
Walao eh   want chiong then down,btohqsg
I tot my acc kana suspended,btohqsg
When they out mission under the mission tab,btohqsg
+1..gg ..lucky no morning job..jon statts 1250,btohqsg
Wake up early wanna chiongApp down..ccb,btohqsg
Lucky I not dg job now,btohqsg
Wah u still can go in...,btohqsg
I got 7 jobs schedule from 1250-630,btohqsg
When we get the sticker money?,btohqsg
App ok liao go go go!,btohqsg
Ya..yest off..today and tmr chiong mission no timing.Take short2 car trip order lo..lol,btohqsg
Raining at hougang area..waiting for rain surge...😂😂,btohqsg
I still need 23 job for mission😂,btohqsg
I took an order bike +2 $15.90Took the same order car $15.30..Double check the order same rest to same drop offRest double book ..wtf..lol,btohqsg
Double book throw out make sure 1 will get taken,btohqsg
Then taken liao cancel the other 1.,btohqsg
If i throw out now..become i come i lose out..,btohqsg
That day I kena the double book. I took the car 1. Then call in they say already got driver pick up liao. They double book. Then cancelled 🙄,btohqsg
His superbike can fetch cargo and take car job one,btohqsg
I got both bike and car double book order...so secure job..lol...,btohqsg
Off location..but if use phone gps LL..,btohqsg
They won't adjust . Need more people give more 5 🌟then will slowly go up de,btohqsg
Cb  customer condo life under maintenance  climb to 5th floor  never say ty  still ask me y slow  within 50 mins wat,btohqsg
This is how u claim half fee if over size,btohqsg
Lol read somewhere take stairs can charge. Maybe for van only. Not sure,btohqsg
They thought my petrol ⛽free one ah?,btohqsg
Wa no more hitching allowed from tmr,btohqsg
Don't forget to type also u want claim half fee 😉,btohqsg
Today order all fast finger sia,btohqsg
Order slow ...most prob people chiong eat outside ..tmr onwards most prob pick up,btohqsg
Cui...kena outbid left right centre..4.78 rating also cui,btohqsg
any suggest rider motor park at plq,btohqsg
Hey guys... COVID-19 is back again and its extra important for us to make sure we are protected esp with the surge in demands since people cannot dine in now.. There is this exclusive deal from TRIBE by Income thatcovers COVID-19 or vaccine related issues‼️ You can also get:🔹 Daily cash payouts when you are hospitalised or on long-term MC due to illness or injury (worth up to $125 a day)🔹 FREE 3 months insurance subscription to protect your income.🔹 FREE health screening by Speedoc from the comfort of your home (worth $55)❗Promo code:REC3MTimes are tough for us now  so good to have a backup plan to pay bills even if we can’t work!Subscribe now athttp://bit.ly/RP-prelaunchtgto get the deal. Promo limited to only the first 1 000 redemptions.Don't miss out! Any questions  feel free to PM!,btohqsg
Anybody app not showing any orders?,btohqsg
20mim also cannot make itPark katong open cp there,btohqsg
Ya nevermind i got orders already hahaha,btohqsg
This guy put 100 dollars tips then cancelled.. So sad. 😂,btohqsg
Lol I think he typo add one more zero,btohqsg
This amount. U ask me send to pulau u in I also will go. Hahaha,btohqsg
Just saw a LLM MPV bang a car kachng at pasir ris.,btohqsg
Imperial treasure at guoco tower...sat also can come out order late..,btohqsg
615pm..still waiting..and i got 2 more stack to go..knn,btohqsg
System issue ar..screenshot and email lo,btohqsg
NVM  do more 1 trip lo,btohqsg
from tmrw only dine in not allow right eat below blk or outside can right,btohqsg
She can give her cb to fuck,btohqsg
do this job  cover petrol cover car rent and cover salary for the day. straight away go back shake leg after job.,btohqsg
Ive seen some guys using another app ontop of lala app.Any idea what that is?,btohqsg
I myself can take job and schedule myself...,btohqsg
Need to know and familliarise with area roads etc...some shopping centre is avoid,btohqsg
U look 👀me so up 😆,btohqsg
Mine also  always quota full... Or  in waiting list  then job gone. What version shall I install 🤔,btohqsg
Ya i restart already a lot times. Thanks Sir Haidir.,btohqsg
Any riders arrested for delivery drugs/ controlled substance before?,btohqsg
Because I just delivered something illegal,btohqsg
I touch the package and it feels something like a knicley duster with a knife,btohqsg
By right not supposed to touch if sealed,btohqsg
Still lack 3 to clear mission lol,btohqsg
My fren even kena check at roadblock b4  the officer feel the package  then open up really contraband cigsHe only needed to take statement,btohqsg
We just sender  should ok rite,btohqsg
The problem is the live chat was like dead. No response.,btohqsg
Who free to take this order? I cant do and i cant cancel without even suspended  i will paylah/now u full $14   help a brother out,btohqsg
U wan help a brother out? Steady one i 110% cant do,btohqsg
Got one hdb opposite of bus interchange  NOT the one opposite jurong point carpark  minute parking  just tt got to cross road but no issue cheaper rates,btohqsg
I tot jurong point got free 1 hr parking? Don't have liao ah,btohqsg
Or can park at the macdonalds opp,btohqsg
Tt car park now got security cam catch liao too many motors there previously,btohqsg
No have  weekends $2.57   weekdays $1++,btohqsg
Send me details ba.. I help u,btohqsg
I at east if nope I can help bro,btohqsg
Burger lobster cab park at the road there ..no need go carpark,btohqsg
Nvm love to park there super no cars lol,btohqsg
No lack of lots n got pple greet me lolol,btohqsg
Btw beware when taking from the coconut club..rude staff..waited for 15mins order still not out..inform them i got to go ..got stack order.,btohqsg
Rude staff call me fucker..lucky i patience..if not sure kena f by me,btohqsg
They think they very up 1,btohqsg
I was already in my car..one of the staff tell me off say i go off they will reassign,btohqsg
One of the driver told me..i bochap ar..no worth my time,btohqsg
Some ppl very lousy at handling stress one  many f&b staff get very rude when it's busy,btohqsg
But scolding vulgarities is too much in my opinion,btohqsg
Oh definitelyI wasnt trying to defend themI think they should learn to get a grip lol,btohqsg
They shudnt be in the service line if theh cant afford stress and peak..i was in the f&b management..if she eas my staff i would ask her to resign..,btohqsg
Shock ar..if tio younger me..she sure get it from me,btohqsg
Cause i have another order if not i sure confront her,btohqsg
Not worth...attitude so bad..ard early to mid 20s,btohqsg
Waste my time..lucky my other order was nearby..,btohqsg
Theres at least 7 drivers from LLM waiting for orders..12 1215 orders,btohqsg
1230 stil order not out..really wtf,btohqsg
tot they would have learnt from the influx of orders that come in when ban on dining out. Shld have experience after cb,btohqsg
Long time no clear mission lol,btohqsg
Need 3 more order ..now pending 5,btohqsg
Do 2 now  1 evvery hour,btohqsg
I did 16 in 2 days lol,btohqsg
Yah  if not shit will do more. I need 6 more😂,btohqsg
guys if change from car to bike the deposit will be 75 to 25 right,btohqsg
I just joined then i realise car not much job,btohqsg
Car plenty...soon..loon for next week see,btohqsg
Then next time go coconut club makan  ask the fucker serve u back bro,btohqsg
The bitch at coconut club is always slamming close the counter doors after u tell her Ur order number,btohqsg
I think next week start car order will boom,btohqsg
She dun seem to prepack according to order time. She only start to pack when u tell her Ur order number,btohqsg
Got her photo? Snap one n share here  I was there sometimes to bring my customer go makan before,btohqsg
I ask her to serve me next time  haha,btohqsg
So if u want to leech money from this crap place  livechat CS tell them u waiting  30min later the order still won't come out unless u go tell the bitch Ur order number,btohqsg
So I dunno the order time is for show to her or wad,btohqsg
Ba ba chinese guy with a tattoo at her leg..,btohqsg
Whats so great abt the upmarket nasi lemak?,btohqsg
To call ppl vulgarities is over the line srsly,btohqsg
This gravy restaurant  always put collect now but food not ready,btohqsg
Fellow bros & sis  avoid this indian gravy restaurant. Katong outlet says he booked lalamove cab need to follow. Tg outlet says delivery within 15mins  although order was late for over 10mins. Prior i called say all ready,btohqsg
Along the way bombed me calls and msg,btohqsg
Take 10-15min to arrive at restaurant  still the food not ready,btohqsg
In the end gave me bad rating,btohqsg
I block this restaurant in my app alr,btohqsg
Not racist  but ahneh restaurants really quite a pain to deal with,btohqsg
Normally i see little india i ignore alr. This one happens to be at tg so i took,btohqsg
Hahaha  agree but hard cause llm won't bother,btohqsg
Haha LLM themselves is a pain to deal with,btohqsg
Go to your order history select the order  top right hand corner  'help'>'block user',btohqsg
Why ppl here so free talking. Not working like me😂,btohqsg
Should write in to straits times. Write in to LLM is as good as not writing,btohqsg
No orders mah..pick now order also gone in a flash,btohqsg
Raffles hotel still 30min free parking?,btohqsg
Most prob..i at mandarin orchard..ghost town,btohqsg
Orders are like cb period v fast gone,btohqsg
PHV drivers come snatch orders liao ma,btohqsg
We should all ban all indian restaurants let them feel the pain,btohqsg
If kena by me and I will said him back 😤,btohqsg
One of their order enough to put your entire week's rating to the drain. Spoil entire night earnings to wait for cs singsong,btohqsg
Hahaha  not all Indian restaurant la bro  tampines saffrons nope bad the boss,btohqsg
"Maybe u kancheong hear wrongly. She said "" Fuck me uncle"" not fucker",btohqsg
Hahahahahahahaha  cb  u damn funny bro,btohqsg
230pm order215pm order can take..5mins drive..$14.95 easy job,btohqsg
Today cbc orders got district surchargeBike order worth to take plus the peak additional 4-5 inside,btohqsg
I think very fast snatched up,btohqsg
2 more order to mission 1st tier..shag,btohqsg
Hey guys... COVID-19 is back again and its extra important for us to make sure we are protected esp with the surge in demands since people cannot dine in now.. There is this exclusive deal from TRIBE by Income thatcovers COVID-19 or vaccine related issues‼️ You can also get:🔹 Daily cash payouts when you are hospitalised or on long-term MC due to illness or injury (worth up to $125 a day)🔹 FREE 3 months insurance subscription to protect your income.🔹 FREE health screening by Speedoc from the comfort of your home (worth $55)❗Promo code:REC3MTimes are tough for us now  so good to have a backup plan to pay bills even if we can’t work!Subscribe now athttp://bit.ly/RP-prelaunchtgto get the deal. Promo limited to only the first 1 000 redemptions.Don't miss out! Any questions  feel free to PM!,btohqsg
Opp the smoking point..the single zig zag...quick dash up..the lift to gallery around the corner,btohqsg
can park at the south beach residence drop off point,btohqsg
I took mine at mandarin orchard,btohqsg
mandarin orchard that back alley parking,btohqsg
South beach i skip..the guard are anal..i once need to deliver to duo residence..mafan like shit..need to go the delivery entrance with is also the hotel delivery area..,btohqsg
recently i just park there to grab wild honey order. hmm maybe not at perk hour,btohqsg
Parking confirm tio..cause its a maze and guard escort you to the lobby of the residence..lol,btohqsg
Maybe ba  but i saw 2 super car parked there. Just follow them lol,btohqsg
Actually I see city hall  raffles  orchard  all I scare ....... Not familiar  only somerset 313 nia,btohqsg
Lol.. I last 2 mission.. But cannot get a single job for past 1.5hrs,btohqsg
Finally manage to get my last elusive pick now order,btohqsg
Suddenly all reserve players come play together,btohqsg
Pick now orders gone like flash,btohqsg
Usually that one can be there no one take one,btohqsg
Sunday 3pm pick now orders all gone,btohqsg
Sad sia really what out what take liao,btohqsg
Ya  I want think 1 second then gone,btohqsg
I think most rest no ready for delivery..only 2 days to prep,btohqsg
I see area ngam car order i press liao..ma tu liao,btohqsg
Bike order I also take liao. As long as near near short distance😅😂,btohqsg
Today my orders within 15km radius..short and fast order,btohqsg
Dinner orders starting to slowly come out. Car orders  kns I take bike orders then start cmg out😂,btohqsg
Yah my next 3 orders all also like that,btohqsg
Now just need 2 more from 7pm onwards to hit mission🙏,btohqsg
Just now chat with roo n grab riders  they say tdy see alot new faces😂,btohqsg
Morning when I take order  also chat with 2 llm new drivers. All cmg out liao,btohqsg
All new drivers out also just now..3-4drivers..chit chat..1 of them rating 4.3..cannot see much orders vs mine,btohqsg
I see pick now car order ..so many drivers bid..,btohqsg
I drive ard telok ayer area..usual cafes/bistro most of them close..last week was bustling till no parking,btohqsg
Crazy  the orders gone like crazy,btohqsg
1/2 of my 11 orders within 5km..,btohqsg
Really kenot think now  order come out 0.5 seconds gone,btohqsg
Took the binjai Park to jurong kechil too early,btohqsg
Just saw the Dover 610 come out go to BP n cck. 26 +4,btohqsg
Bor bian tryg to finish mission,btohqsg
Wa cow wont kpkb meh stack?i thot they anal and monitor one,btohqsg
paya lebar square infront taxi stand summon,btohqsg
Park ard these area ..for mandarin orchard pick up...lift on left side,btohqsg
All bike order now like car price for town area...,btohqsg
Peak $3 district surcharge $2..on par with car pricing,btohqsg
Wuhoo..4.7 go up 4.8 rating today,btohqsg
Guys remember to wear masks n wash/sanitise hands,btohqsg
Flying soon...Boat quay robertson quay city hall to bright hill  caldecott  lentor,btohqsg
The 38 new COVID-19 community cases in Singapore marks the highest number of community cases in over a year.https://cna.asia/2Qlw5Xd,btohqsg
Sch might be closed by this week,btohqsg
9 drivers waiting at waa cow😅,btohqsg
Lol from v2 chiong to jurong n back to town,btohqsg
Y ? First time sia me   haha,btohqsg
Theyre gd  I like their orders. A fan,btohqsg
I see  haha  scare me sia  I tot they aiskrim,btohqsg
I ady here  haha   I stay nearby,btohqsg
Today traffic is so good :),btohqsg
Mizzy the chicken wing not nice,btohqsg
Mizzy corner at tamp 601B is it?,btohqsg
Love to pick up from mizzy.,btohqsg
