text,group
Walao. I busy walking  check GPS all this. Where got time still google,btohqsg
This one must put alot le.. high le not eat liao faintef,btohqsg
I maybe SEE Liao  still dunno leh,btohqsg
Lols.. see the comments is impt..,btohqsg
Go n borrow wheelchair put in car. When reach blk. Go up in wheelchair . This ppl see liao sure heart soft🤣🤣😂😂,btohqsg
Lol. I only got 2 kah. No car bro...,btohqsg
Throw in $50? I can pang gang go home,btohqsg
Get a partner with car . U be actor😂😂,btohqsg
Lols.. i dont think pple will give 50 la,btohqsg
I Kena most 10 bucks only,btohqsg
Got 10 alredy v lucky hor,btohqsg
Ya very good liao sg no tipping culture,btohqsg
N all the tips I get so far from hdb,btohqsg
Duno why private prop residents so giam lol,btohqsg
SG the svc charge and tax enough le. U still want tipping culture meh. When u paying customer. Hahaha,btohqsg
They accumulate their wealth to stay wealthy lo,btohqsg
Landed ones r more niao. Mine 90% from condo,btohqsg
But hor. Condo ones seem more understanding if late a bit. Than HDB lol,btohqsg
Most tips I get is when I fast deliver,btohqsg
Those I not so fast reach like nvr give,btohqsg
That's why my tip 10c lo,btohqsg
I fastest also is 10min nia. Where can compete w motor  vroom there 3-4min,btohqsg
Next time cash order just say no change,btohqsg
My late cash order  jiu shi slowly flipping notes to find 80c give me,btohqsg
I pekcek wait liao  dig 20c from my pouch inside my bag give her.,btohqsg
Still searching for orders meh 😅,btohqsg
Today how many hours and orders?,btohqsg
Just come back from sis place..niece bday,btohqsg
No la..buy..msw grade b $16per kg..5kg worth eat till wanna puke..lol,btohqsg
5kg abt $79 ..with husk ..damn big flesh small seed..eat till jelak,btohqsg
its not slow the orders moved too fast,btohqsg
i swipe right then gone le,btohqsg
I still have 12 more orders to hit my mission,btohqsg
but today i managed to chill at ecp haha,btohqsg
deliver meat to bbq people then stuck there,btohqsg
Somemore tmr can only start at 6pm,btohqsg
i tot only 2 people but i see so many lol,btohqsg
also there i see all crowds like no body business,btohqsg
Wah this sure come out news if too crowded,btohqsg
Must find partner already go dating,btohqsg
but abit sad la just only 5,btohqsg
what is the world turning to,btohqsg
Better be safe then sorry now,btohqsg
Too scary already this covid case,btohqsg
maybe its the end of the world liao,btohqsg
Next time can go punggol white bee hoon collect your order.. 🤣 🤣,btohqsg
i wonder if order too big what to do ah,btohqsg
Busy is busy   busy = money,btohqsg
Don't worry  after u get vaccine  like got screen protector,btohqsg
Those order need pay parking worth?,btohqsg
Grab can claim long wait and big itmes,btohqsg
All wake up so early tan jiak sia,btohqsg
Can't sleep then do lalamove lo,btohqsg
Can pass time can earn money can exercise,btohqsg
I tot u wake up help ur mum wash toilet bowl,btohqsg
Order llm walker then u tagTelegram Christina limor ask@Serenesng老娘 tabao to u,btohqsg
Cannot make it. Lol. Too heavy  the white beehoon 🤣,btohqsg
Ar? I tot u know where I stay ?,btohqsg
U wake up so early go market arh? Got use llm bag bo,btohqsg
Today market sure crowded. Don't go!!,btohqsg
Cuz they buying food for tomorrow onwards cook,btohqsg
@Serenesngbtw  this shop going closed by end of this month  go support support if u nearby  I like to go there kopi one  the kopi tou shou friendly n he can make a good kopi,btohqsg
Ya  crazy  all go crazy buy fish  like cny,btohqsg
Hahaha. Fishery port close  everybody snatch fish,btohqsg
Ya  knn  I go market just now  price increase 20 to 30%,btohqsg
Have to cover for a while ma. Demand high  sure increase de. Later today maybe up even more,btohqsg
I always buy whole salmon fish around 3 to 4 kg cost $70++,btohqsg
4 kg can jiak Gu gu,btohqsg
Ya buy lo  lan lan   my small lady boss like to jiak fish,btohqsg
Jiak fish good . Brain better,btohqsg
Ya  have to train her brain,btohqsg
Don't kana cheated by guys next time,btohqsg
3 three kids like fish since young. I no like fish no wonder brain no good🤣🤣,btohqsg
Later her baba ma become murderer,btohqsg
Cause her lao beh me kana cheat Xiao mei mei last time ma   scare karma  then aiskrim,btohqsg
So satki   i always get bullied n cheated by girls,btohqsg
Not good bro  I regret liao  haha,btohqsg
Ya. Go catch monkeys been there at 5am,btohqsg
Buy whole fish wht u can do with the head leh...,btohqsg
Too late man.. is a cycle,btohqsg
Bo la  not east side  inside,btohqsg
So good i haven eaten yet,btohqsg
Curry or black bean  fish head good  collagen， jiak liao neh big big,btohqsg
Nowadays gals very swee bian . No say who cheat who... 各有所需🤣,btohqsg
Ya   u donno my childhood story..... Haiz   I kana bully by char bo u also donno,btohqsg
Macam ok leh  knn   drive simi llm  sell chui kuih la bro,btohqsg
Sg only like food can do... Go mall is to eat . Not shopping mainly these dayd,btohqsg
Cos online shopping more cheap then retail store. Retail store need to pay rental (Number one killer)  overhead and utilities cost.,btohqsg
Haiz  u donno .... Those lala girls bring me go toilet play my kukubird   make my childhood very dark,btohqsg
Need I ask Bangla help u break ma bro  haha,btohqsg
@Serenesngis not east side  west side  north side.... Is inside ur heart ❤️,btohqsg
Then buy cucumber better  cheap  u kaki diy duk ka cheng,btohqsg
Weird I at east all west order now at west all east order,btohqsg
Since when LLM no play trick ?,btohqsg
LLM can do la only if their app not so messy. See till eyes spoil.,btohqsg
Tdy no driver ah? Alot job +$,btohqsg
Yah. Stupid wan. Just keep going. Want to come back read  gone liao. Actually should be like Grab using location base. Reject or not  is up to user.,btohqsg
Cos I not working . Alot bros can earn mo😂😂😜,btohqsg
I heard their app used to be good ... Duno wat happen . Maybe cut cost outsource it to abnn,btohqsg
Cheaper  better  faster. Fast until cannot see sh1t. Swipe liao  so difficult to cancel.,btohqsg
Amazon cannot continue shift not like last time .. can do 12 hrs on weekend.,btohqsg
Yah  but can swipe for block job early. Then seep seep do  seep seep wait $ come in on Thurs. 😂,btohqsg
Hope dun seep seep Kena dasani🤣🤣,btohqsg
I kana before. 2 carton 1.5 ltr x 2 carton 500 ml. One location  heng. Abnn staying condo.,btohqsg
U haven't Kena those 10 carton type,btohqsg
Last time they still havent split van n car. Car 10 carton aso take,btohqsg
Cos I do weekend only. 😂😂😂,btohqsg
Stack till u cannot see driver thru window🤣🤣,btohqsg
I see. I only know recently got group buy wan. Imagine 5 carton of Kleenex toilet roll at 20 rolls per pack de.,btohqsg
Now scary leh. TP wait outside Benoi or Toh Guan to spot those drivers stack very high until cannot see thru window.,btohqsg
I rem 2017 or 2018 when Amazon first started. Even taxi secretly come do. But later ban. Now I duno.,btohqsg
Now PHV still do. Taxi  never see. Hahaha,btohqsg
Seems like everyone busy tanjiak. Left 2 of us tan Bo jiak🤣🤣😂,btohqsg
We both lepak one corner. 😂,btohqsg
Maybe next week  I chiong LLM. Payday liao  buy FP equipment and start new journey. 😂,btohqsg
Haven't lah. Broke liao. $65 cannot 生出来.,btohqsg
Lol. U use car or bike,btohqsg
Register car. I no bike lah. 😂Bike forum have lah. 😂,btohqsg
Car do fp or wat gf ABIT bohua,btohqsg
If still must pay parking duno earn watCharity🤣🤣,btohqsg
Same mah. LLM also pay parking.,btohqsg
Think I need go bicycle .. 😜😜,btohqsg
LLM like Grab Hitch. Good is can do more than 2. Then manual swipe for jobs. Simi sai  only between pax and driver.,btohqsg
I wonder what's the rates for bicycle and walker,btohqsg
https://www.channelnewsasia.com/news/cnainsider/free-delivery-bulk-discounts-singapore-rise-community-group-buys-15240638#.YPOk2f43-yI.telegramNot just free delivery and bulk discounts: The rise of community group buys in Singapore,btohqsg
Greats is laying on bed don't need do,btohqsg
Old housing estate bo group buy le,btohqsg
My trolley better. Got chair. Hahaha,btohqsg
Christina Lim how old one? 🤔,btohqsg
O.o dun inflate my age leh,btohqsg
40 is boob size   40 D,btohqsg
Simi platform for the group buy,btohqsg
40d very big leh . If real one drop to navel liao,btohqsg
Kns  I praise u leh  airport not good,btohqsg
Wow.. u discount yr age sia,btohqsg
Saw fp n gf alot xiao mei mei . I not surprise if 18.,btohqsg
Punggol here got housewives viet-bu as gf.,btohqsg
Sg a lot vietbu married over. My fren married one... All zhng till swee swee. Duno got part time bo🤣😍,btohqsg
Whatapp group buy got good lobang ma?,btohqsg
Friday  kana 1 Webuy order from Bukit batok Lor mee to Sengkang. inside total 16 bowl  plus seperated sauce and ingredient.,btohqsg
Webuy I got buy things. Hahaha. The host here now use shoppercliq also,btohqsg
U want to buy their part time ?,btohqsg
But they can see our bike order also so the price same right,btohqsg
Convenient leh. The shoppercliq. But our order all exposed.,btohqsg
Webuy big bro noe for group buy,btohqsg
I paiseh order a lot sia,btohqsg
Sian today pump petrol see the price roll eyes,btohqsg
Shoppercliq my fren work inside lo,btohqsg
Last time my wife also be host for webuy,btohqsg
Now 2000 esso price of vpower,btohqsg
2 shop kana closed shop  bo orders hahaha,btohqsg
I think will up to $3,btohqsg
Group buy snacks for today 🤣,btohqsg
Go see Himart/Combinesg/H&Z. Got cheaper than Webuy de. Lol,btohqsg
haha. 3 big bag and 1 small. when reach owner house at 11am  still sleeping,btohqsg
I only do for those I want eat,btohqsg
Lol. Later I tio ban for sharing groupbuy here. Hahaha,btohqsg
U can go do deliverires gor yr areama,btohqsg
Take the LLM order u mean?,btohqsg
Or I gagi go take n charge delivery?,btohqsg
Some order too big  suan le,btohqsg
60 pkts of white beehoon  I let car/van take lol,btohqsg
From punggol come back Clementi. Bohua,btohqsg
And I order lunch  need 7 early 8 early go until there. I rather sleep,btohqsg
Like this owner. Still sleeping when food reach. LOL,btohqsg
I intro u another kopi nice de.. also is ESR Bizpark but not the 1 u go.. is another ESR,btohqsg
Host lo  but sien  busy for weekend collection,btohqsg
Last week my fren help me group buy 1kg cherry $18 nia,btohqsg
Cannot fren wife cannot ride... I got principles🤣🤣😂,btohqsg
But less money for the guy,btohqsg
Can la heard one month can 8k. Split by 2 stil have 4k... Not bad aso everyday can hug together🤣🤣,btohqsg
Aiyah jus work yourselfGo home earlyMake love more often,btohqsg
Then got more babies for Sg,btohqsg
U work longer hoursEqual to less making love,btohqsg
Think work 12 hrs everyday  . Go home just want zzz... Didi aso want zzz,btohqsg
Bobian  this society like that bro,btohqsg
Important for our family enuf ady,btohqsg
Yes  agree. I drove PHV also same.,btohqsg
Aiya  my work drive phv on month 9k,btohqsg
His gf also say him driver nia  then go open legs for others guy,btohqsg
So whatever u busy ..... homework got to do .....,btohqsg
He on the road everyday at least 13 hours n above  gugu nua,btohqsg
Don't worry  u r a good guy,btohqsg
Then u should chut new Mercedes next cny. Make their mouth drop to the floor🤣🤣,btohqsg
Like my boss said . He buy those exp cars not to haolian. But to make his enemy angry🤣🤣,btohqsg
Rent one month for cny lor. Get a s class or 7 series🤣🤣😂😂😜,btohqsg
Cars speak for itself. Yr relative see u also must look up🤣🤣,btohqsg
I ask u work to find gf for ur bro,btohqsg
Can go to my fren car shop,btohqsg
That's y ask him rent one month make his relative angry🤣🤣,btohqsg
Find the biggest Merc or bme,btohqsg
Aiya   don't fxxk care others bro,btohqsg
Important is u n ur family,btohqsg
Join here to know u all n get those info for llm I also happy,btohqsg
U sound like my boss. He aso buay gum with his relative. Whatever car his relative buy he will buy bigger n more exp🤣🤣,btohqsg
Ya  he drive hard to earn money  buy branded bag  save hard for bto,btohqsg
I just laugh laugh and walk away nia   I bo ji,btohqsg
Alone so good Sia. U rent out yr HDB go Thailand can be a little king with many wives🤣🤣,btohqsg
If itchy Thailand aso got grabfood u can do lol,btohqsg
Alot of my cousin aso never married. Married liao aso divorced,btohqsg
If can choose I might stay single . Not so stress got 3 sons to feed🤣🤣,btohqsg
Scared liao. That time Kena con wife say one try daughter. In the end all pop got gugubird ones,btohqsg
My side all give sons mostly... Ball inside no female sperm🤣😍,btohqsg
I dunno how the orders can vanish within 1 sec,btohqsg
Like barely can open see location gone le,btohqsg
Yeah that one also far far,btohqsg
But sometimes sentosa tempting but bike leh,btohqsg
When at north see west order west see east order lol,btohqsg
Now home liao short break later try again,btohqsg
Actually I'm curious about those multiple stops,btohqsg
Some until 7 to 8 stops,btohqsg
But I wonder if anyone took before,btohqsg
I barely see job today. 👏👏👏,btohqsg
The last thing small dragon can do to redeem himself is to ban smoking hahah I hate smoking,btohqsg
My acct nothing much to get,btohqsg
No need to go for testing,btohqsg
Time for me to stop joking,btohqsg
I aso Cheong out makan. Faster b4 hell gate close again,btohqsg
Monday shud be good for llm,btohqsg
Gf quiet? On the road alot green army wor,btohqsg
Monday got $3 holiday surcharge liao,btohqsg
Today llm so slow sia.. fedup,btohqsg
Only just now 10+ to 12+ alot of jobs,btohqsg
Maybe evening all go out eat  earlier weather too hot no want go out😂,btohqsg
Basket from 2pm until now I only do 2 orders leh,btohqsg
Oddle Mandarin = 噢迪. Aka Audi.. 😂,btohqsg
Fresh fish and seafood stalls ordered to stop operating; stallholders to undergo COVID-19 test - CNAhttps://www.channelnewsasia.com/news/singapore/covid-19-nea-fresh-fish-seafood-stalls-operations-testing-moh-15243990,btohqsg
👍This 1 hang very long No1 take😂,btohqsg
Yah  everyday I need to change t-shirt mid day😂,btohqsg
Change shirt still OK. Don't change wife😂,btohqsg
Anyone delivered for this place before? I tried calling both restaurant & customer  no one pick up. Just wondering if this is legit?,btohqsg
I asked cos last week i took one banana apollo restaurant job at 6th avenue  called to confirm pickup time  the person gave me timing.. When i arrived it was picked up by another person then restaurant told me they don't use mobile number for restaurant contact.,btohqsg
Told LLM  they tried calling but no answer then told me go report police for fraud🙄,btohqsg
Appreciate if anyone can advice the macpherson mall outlet.,btohqsg
I checked website  no such cafe,btohqsg
But I thought credit order. CS say inform them  can still proceed to pickup pt?,btohqsg
Then just cancel say ghost customer,btohqsg
To my understanding of Macpherson Mall  only those pub at ground floor is operating.,btohqsg
So could b another fraud case again? 😅How to know which order to take sia 🤣🤣,btohqsg
That place reno before. Then NTUC moved in on 3rd floor for maybe a year or two. Then it moved out. Till now  no tenant.,btohqsg
Haha.. Okok good idea. I dont feel right also.. Sianz .. Thought can get something before i head home 🙄,btohqsg
Since is Oddle  it should have the restoran name ?,btohqsg
I last time see oddle  I just take. Lol. Cuz the payment is oddle and LLM. If restaurant is MIA  is oddle problem also. They should know their listed restaurant not in operation. Lol,btohqsg
I was thinking too. I head over n see now.. Might as well since i m here. 😅Thks everyone.. Update shortly,btohqsg
Online grocery platform. So they no pickup the contact no. de,btohqsg
If u go there nothing  tell me. Cuz my sister doing groupbuy for this place. Lol! Fake place then don't give them business liao. Lol,btohqsg
Aiyoh okok.. Can.. Going there fr circuit rd now,btohqsg
Their frozen items not cheap also leh. I feel la,btohqsg
Recipient at Kovan called me back.. I asked if genuine she said yes.. Haha.. Said she is a return customer. I just arrived  asked security  he said yes there's this place on level 3..heng ah... 😅,btohqsg
Haha. Ya... At least its real..,btohqsg
Thk u everyone who responded to my call for advice 🙏😊,btohqsg
Can park along the kerb.. There's a loading/unloading lot for car so that's whr i parked. The Shinsen lady told me can just park along the kerb regardless car or bikes  hardly any traffic 😅,btohqsg
This place is very very low traffic. Think currently use for Covid-19 isolation,btohqsg
Anyone taking Clementi mall jobs  take note. Crowd control,btohqsg
Anyway  Clementi mall usually dinner time only Ootoya got order. Lol. So good luck going in,btohqsg
This place was all along a hotel at a secluded location. The mall beside traffic lagi low. Nobody go there to shop de.,btohqsg
U say for isolation... I thought isolation place is strictly no entry for non isolation ppl?,btohqsg
JUST IN: Singapore reports 92 new Covid-19 cases.Locally transmitted cases: 88Imported cases: 437 of the locally transmitted cases are linked to the Jurong Fishery Port cluster. 23 linked to the KTV cluster.Stay in the know:str.sg,btohqsg
This is coming fast n furious 🤦‍♀️,btohqsg
My brother's customer.. say kena Covid positive because of bus/MRT with another Covid positive.😱,btohqsg
Should just lockdown if public tpt also dangerous,btohqsg
I curious the 92 cases got vacinnate boh...,btohqsg
Can use to measure how good the protection is,btohqsg
Only protect u from deadly outcome,btohqsg
Bus mrt very dangerous. My kids school recently more n more parents send kids to school in car,btohqsg
Think they got to ban all dining in another week🤣🤣,btohqsg
But PAP kept telling us is safe.,btohqsg
Of cos if they tell u not safe. The economy will be dead. ... Noone go out,btohqsg
Anyone's frens looking for job? Rotidiam Baker  interested  pm me,btohqsg
With experience  without experience also can,btohqsg
Haha.. Ya lah.. Good for us😉,btohqsg
Got 3 quota for China worker  Spass,btohqsg
PR n Singaporean most welcome 👍👍,btohqsg
This is the wa Nan bu tiok covid one arh,btohqsg
Ya  u donno who tiok ma,btohqsg
Wow... i dunno le.. pple pay for me always de,btohqsg
Just to confirm AJ only max is 10,btohqsg
Anyone's frens looking for job? Rotidiam Baker  with/without experience both ok  got 3 quota for China SpassReferral fee $300 once the worker complete 3 months workingInterested  pm me,btohqsg
More than that I think  my last AJ can took up to 13 liao,btohqsg
OK. Thanks. Cos my coming sat already taken 7 AJ. Scare,btohqsg
Btw  fyi  mom ban all the workers from msia/Vietnam/Myanmar for F&B   so coming few months more waiting time for your llm food orders,btohqsg
If ur fren working in job intro industry as agent can pm me too,btohqsg
Referral fee $300 no horse run one,btohqsg
Now sell liulian aso must sell a bit body,btohqsg
i suspect u very long liao,btohqsg
guys asking u to be private delivery guy for them,btohqsg
Hi guys  just asking.. lalamove got incentive? I dont see any tab got imcentive,btohqsg
jiak jiak jiak  jiak ba biu  xim qi ho bo? jiak jiak jiak   jiak ba biu  lai 跳 ah gogo,btohqsg
Live chat CS or go ubi flip table,btohqsg
I just join last 2 days.. my mission is empty,btohqsg
Bo dabao good food for ur kids arh,btohqsg
Why no chiong tips up to $10,btohqsg
Christinacan help groupbuy my bro chui kuih ma,btohqsg
To9 all cheong out dinner   scary,btohqsg
so many times u see me sell order cos kids lol,btohqsg
Bring kids along. Confirm high Chan get more tips,btohqsg
not gonna take tt risk and not tt desperate lol,btohqsg
True aso now cobid cases spiking up liao,btohqsg
"Next time I try bandage my one arm go send c  got ""pitiful "" tips boh",btohqsg
Simi direction. Wat Tok u ah?,btohqsg
I dun care u woman or man. I like all of u as one😘😘,btohqsg
Why these days nobody show their magnificent pay here  to inspire bruthas n sistas here.,btohqsg
Phv no need show off . Their rental petrol n 20 percent comission will suck them dry dry🤣,btohqsg
Not this. PHV is to show  shortest distance with the highest fare.,btohqsg
So Wats the shortest n highest u Kena b4,btohqsg
$10 gross fare. Distance around 50m. Cos  super heavy rain.,btohqsg
Tio lah. Another one was Teban Garden to Changi Airport. $40 gross.,btohqsg
I tried before 1.2km cost $12 for rydeflash,btohqsg
+1.Surge during heavy rain peak hours is crazy. I usually drive Fri and Sat night. Cos lesser traffic to bother. Only CTE. Always have jam and accident at any time of the day.,btohqsg
Fetch ppl better than send food,btohqsg
Yah  but I so far so good.,btohqsg
Must pray.. u careful other chew Cheng Kia bang u aso Lan lan,btohqsg
Rydeflash unlimited trip for non PDVL,btohqsg
I thought Ryde also 2 ?,btohqsg
During the cb  I go drive ryde  one days earn 100 easier,btohqsg
But the fare better than grab hitch la,btohqsg
U have to drive for morning 6am to 9am,btohqsg
I thought also 2 for non PDVL..?,btohqsg
I see gh Ryde fare I no heart start engine,btohqsg
And got to know which place can go which kenot,btohqsg
Somemo now cobid. Not worth at all,btohqsg
Now ride aeroplane one aso go drive grab sell liulian. 🤣🤣😂,btohqsg
Garmen say  got vaccine got protect,btohqsg
Like LLM loh. Stack also got to communicate to all.,btohqsg
They aso say no need mask last time lol,btohqsg
My cousin hubby pilot now living off😜 cousin,btohqsg
Today Sunday leh . Noone over 200?😱,btohqsg
No thunderstorm or 长命雨 like last week.,btohqsg
Or all eat oddle till pok guy liao. Must save a bit🤣,btohqsg
Thunderstorm motor kakis will curse n swear... Who dare go out,btohqsg
Drive car aso not easy send,btohqsg
Drive car easy to send. Cos mainly walking distance  but need to do many u-turn to reach. 😂,btohqsg
For peeps who going mall which got crowd control..can skip que show ur PU order to the people manning the que.,btohqsg
Delivery people got priorty to enter..join the crowd is waste time,btohqsg
Most important the food u getting got no queue. If a lot green shirt there waiting u aso LL,btohqsg
10kkj loh. Got one central kitchen.,btohqsg
looks like all ban llbird lol,btohqsg
I can't find another app that can gimme Bette fuel discount,btohqsg
Lalabird is good only if they upgrade their current messy app,btohqsg
Once upgrade.. it's better than wat gf fp,btohqsg
yes really messy wit rubbish filter look like no use at all,btohqsg
Where got filter. Up till now my app filter also nvr appear🤬,btohqsg
have no have got no diffrent baby,btohqsg
Your phone. See spoil or not🤣,btohqsg
wah this one alot diffrent lol,btohqsg
Just saw your msg.this order is not a cafe.they mostly selling chilled stuff.I take their order before.can do,btohqsg
The ntuc got ppl take and doalready.isa pub call mx bar now,btohqsg
Need to wait 1week or 2 will have de,btohqsg
Today afternoon order damn slow.and swipe 5time get 0job,btohqsg
Heng able to hit the mission for this week,btohqsg
Is it evryone gets it or only those with stickers?,btohqsg
3week gold mission all hit both tier,btohqsg
Need to be rated 4.5star above,btohqsg
But if u don do think they will not give u liao,btohqsg
Cos some brother here also don have,btohqsg
I see.. so rating do play apart,btohqsg
Ok noted.. coz i see the job coming my eyes roll like jackpot.. 🤦‍♂,btohqsg
Lol Shag de lo.42order then Sunday left 9 will cry if not order on evening,btohqsg
How u complete both sia. I can only hit the 1st tier,btohqsg
This wk still only do 36,btohqsg
Per day I must finish 10-12 order,btohqsg
Hmm maybe u need a day just wait for same area order at evening,btohqsg
Cannot be any order also do right? Not worth it for petrol,btohqsg
Mine highest is 17order 22 dp,btohqsg
Some time u see motor job can do de,btohqsg
Paing la cos one day I do 6order then need to cover back,btohqsg
Tdy I also cheong for first tier. Do 5 545 6 630 7 730,btohqsg
After that got cousin bday lunch 😂,btohqsg
Haha then u got your rest,btohqsg
But I see jobs is go all over the place,btohqsg
At 4 I still left with 6job left,btohqsg
Actually I just aim the 32  so tdy is wanted relax abit  end up also just do,btohqsg
Yah  need to have the right jobs n time come out,btohqsg
That 1 I leave to fate😂,btohqsg
Motor can cover the extra money,btohqsg
Norm I cannot do the 42 cos of thursday,btohqsg
If u all take airport job very fast one,btohqsg
But only to Simei tamp n Pasir Ris,btohqsg
Cos from airport come out u only need 10-15min reach Liao,btohqsg
And can stack if u heng,btohqsg
This is precisely the thing  luck is needed😂,btohqsg
Like today I stack 4.35-5 and expo 5.05,btohqsg
Then 5.30 oddle order I ask mine with take,btohqsg
Lol 6pick her up sent 6.10,btohqsg
Need to heng kena those .05 .15 etc type,btohqsg
I met one van driver at airport the other day.he stay Pasir ris,btohqsg
So like Liao he will stick at town,btohqsg
I don like to go town,btohqsg
Like me..i stay hougang do town..😂😂😂,btohqsg
Cos I dunno which cp can go n where the shop etc,btohqsg
Town order price good but parking also good,btohqsg
Town jobs will need to run abit sometimes😂,btohqsg
Go there always kana lj parking,btohqsg
I try not to take malls..,btohqsg
I always walk very fast one,btohqsg
I can walk fast but sometimes bor bian need run,btohqsg
Cos sat Sunday my boy got tuition,btohqsg
Got choice one..lol..close 1 eye see order know which is which,btohqsg
Learn from experience lor  try liao then know,btohqsg
Like today do noon tong Kee at sk $11-16%-1.4 parking,btohqsg
N the Blk only opposite nia,btohqsg
I told mine son if I know tio parking I park there walk take n sent over,btohqsg
Sometime scare what u know when u park far.the order big n heavy,btohqsg
I only this wk got deducted cashcard at hdb cp,btohqsg
Cos after I drop off  I rest n smoke at cp for awhile😂,btohqsg
