text,group
This is in place but nowadays traffic police don't summon people for this  about 10 years ago  driving along AYE near Clement  stopped by TP for going too slow on 2nd lane  was driving around 70km/h in the afternoon. No warning  just issue summon  kena $70.00 plus 4 points,btohqsg
Subaru’s VX and Tribeca are pretty problematic from friends who used to drive these model. Not much complaining from people who drives Forrester  except fuel consumption.,btohqsg
Forester is kinda powerful for it price   maybe that why the fc,btohqsg
Petrol expensive mah 😙 some people want to drive slow thinking everyone also same. Especially hybrid taxis. I also realise they are aware they hogging. Because if u want to overtake them. U see their car lean into your lane  shows they are looking at the mirrors,btohqsg
These people sibei selfish hor. They never think the people behind might be rushing wife to hospital to give birth  rushing for meetings  parents fall down at home. At least be aware of people are faster behind and just move out and let people pass,btohqsg
ya drive so slow   same speed as middle lane  just move 1 side la  why so selfish and block ppl,btohqsg
it is os hard to over take  because the speed limit is too low  and the overtaking lane car is always travelling at the same speed as the middle lane,btohqsg
Jason just uploaded this. Love it. And I still prefer 190e over E30 😛https://youtu.be/cQhaNbqx0Q8I just love car rivalry,btohqsg
It was so sad when WRX and EVO rivalry is no more…,btohqsg
This is classic  I love this too,btohqsg
Somehow I am happy we didn't get this Mitsubishi clot 😅Our clot still look more like CS3,btohqsg
This already happened to office copier machines - auto-order toner when supplies are low. Not surprised if this will happen too,btohqsg
Wa that one cui but is by usage plans right,btohqsg
Wa no wonder i should start renting printers now hahahahaha,btohqsg
Anyone driving a Hyundai Ioniq(hybrid or ev) ?How’s the FC ?Heard it’s 23l/KM,btohqsg
Tiagong the EV of Hyundai Better dun buy. Ev suppose to also be quite spacious but the Hyundai EV Kona Ioniq so cramp LOL. Sua la. Drive for PHV?,btohqsg
Maybe in a very controlled lab environment? In real life  things are different.,btohqsg
How come this Colt uses lancer EX front?😄,btohqsg
The reason why Russian tanks stalled. 🙈,btohqsg
It was a facelift that we didn't get (thankfully) since Attrage was heavily marketed here instead,btohqsg
Hi I have same issue  what is the solution? The vep tag is with my old car,btohqsg
Go update VEP in Msia website  the TAG needs to be replaced (I think)  but now COVID  can't do it yet.,btohqsg
What are the best new or second hand 1.5T car in sg?,btohqsg
must see what are the requirements of your next car,btohqsg
Fast high hp and with turbo,btohqsg
i thought you say older you get  HP dont matter?,btohqsg
Can consider CLA or A class if you want a conti car,btohqsg
Swift sports solid too for the price and good power,btohqsg
Want fast and fun  got to be 3 pedals man. 🤤,btohqsg
mazda RX7 is 1.3and BMW I8 is 1.5! 👍🏼,btohqsg
If not it will be 2.0T with DCT liao,btohqsg
Honda civic 1.5T VTEC is pretty powerful,btohqsg
A lot of options for 1.5 turbos that are fast as such,btohqsg
The back space seems cramp for that kind of price.,btohqsg
You would have to consider what kind of car you want; hatchback  sedan  coupe  etc. And price range,btohqsg
2.0T fast will be AMG A45s!,btohqsg
Or yolo Yaris GR also can. 1.6T haha,btohqsg
Again depends on how much you want to spend and what you're requirements are. The price range really spread out,btohqsg
Hahah I am looking at swift sport 1.4M   accord and civic 1.5 T,btohqsg
New ah? Accord and civic quite ex now with COE,btohqsg
Can try V40 T2  stage 1 190hp which is pretty powerful,btohqsg
Colt Version R 1.5T with a 5 speed.,btohqsg
V40 I saw just concern on the maintenance,btohqsg
I saw new BMW 116i got offer price now at 138k or something you can take a look,btohqsg
ah.. my experience with a S60 from the same generation pretty okay.. parts might be slightly more expensive but then again  Volvos seldom breakdown.,btohqsg
Can the owner of this Mercedes please stand up,btohqsg
they are the same in that era. light  fast and small,btohqsg
i know where this car is. gonna ask him if he wants to sell,btohqsg
inside is fabric checkered style seats,btohqsg
paying 138k for a 3 cylinder front wheel drive car? that aint bmw hallmark,btohqsg
It's still a entry level bmw with 1.5L twin turbo  which was what the original question ask for,btohqsg
why not consider a proper used car or bmw,btohqsg
Some people prefer new cars  so why not,btohqsg
with good power. rear wheel bmw,btohqsg
"a ""new"" car becomes old after buying it",btohqsg
Lol whatever rocks your boat  just giving options,btohqsg
Most driver now just look for brand   give them an a1 over altis they choose a1,btohqsg
Alot of myths abt 3cylinder cars. Personal feel is the vibration tends to be higher as compared to 4,btohqsg
it is like choose between a brand NEW bezza and a good used car  the inexperienced ones will choose NEW,btohqsg
Whats a good used bezza kar to intro,btohqsg
for sure it is more difficult to balance 3 cylinders. it is considered entry model.,btohqsg
you dont buy bezza at all. used or new.,btohqsg
you buy a proper 4 cylinder engine car like a toyota honda or mazda,btohqsg
or bmw if you dont mind the ownership costs,btohqsg
if you are a beginner and do not want the headache  get a good used japanese car.,btohqsg
Only like japanese girls not cars 🫣,btohqsg
Enjoy petrol cars as much as one can now. Once 2040  many become scrap metals unless keep like vintage cars. 😅,btohqsg
a bmw has many issues - sensor faults ,btohqsg
What about those with repair done with receipts to proof that these wear n tear are replaced,btohqsg
the question now is - when will new faults appear? and need replacements. if you understand bmw well  then ok.,btohqsg
Isnt all used car e same. Wear and tear bound to happen and subject to sensor faults also,btohqsg
electronic sensors  o2 sensor  abs sensors  oil sensor etc,btohqsg
Theres no bulletproof car that can last forever. Maybe a mazerati lol 🤔,btohqsg
yes a mazda lasts a very time - without faults. dont laugh. it is ture,btohqsg
How u define better? U done stress test against all e brands alrdy?,btohqsg
Most cars last longer than 10-yrs. if not you don’t see many renew coe instead of getting new. 😅,btohqsg
i have owned both bmws and mazda and toyota and i know. in my 4 years of toyota vios  i replaced a fan motor  and a water pump. they are not expenisve,btohqsg
better means you dont spend time in workshops doing parts replacements. faults  sensors i alrerady mentioned.,btohqsg
Me noob. Wanna buy used car. Need to learn frm the experts like u 😏,btohqsg
i have a december 2015 mazda and i checked all the bills  and the guy hasnt spent anything on parts other than regular servicing,btohqsg
Then the new problems are caused by that owner,btohqsg
this two comparisons is good enough to iluustrate to you about reliability,btohqsg
i am the new owner. i bought it second hand this year. i am third owner and after driving nearly 10000km absolutely troubletree,btohqsg
I wonder anyone did a comparison of AD workshop prices over the years,btohqsg
Singaporean Volkswagen GTI driver enters a roundabout at full speed  hits a MPV and scoots off in Johor BahruWant to speed then go Sepang Circuit lah  bodoh kambing!➡️ React with 🤮 if you have experienced reckless Singaporean drivers in Malaysia before!➡️ React with 🤬 if this Volkswagen GTI driver deserves a good scolding!Read the full story👉🏻https://bit.ly/3wgVzWE,btohqsg
AD always higher than ws.. their so call “premium” service and bs quality checks,btohqsg
what problems are you talking about? i said there are no problems.,btohqsg
that sounds like you are worrying too much. like you think gearbox oil needs to be changed because you think it ought to,btohqsg
then why dont you change engine oil every week? that kind of analogy,btohqsg
Change at recommended interval is sufficient,btohqsg
did you read long term users what they say about the car and reliability?,btohqsg
So how long before u change out your engine oil,btohqsg
I seen people driving till 15k-20k before changing or once a year,btohqsg
Maximum 15 000kmOil filter only last 15 000km,btohqsg
10 000 – 15 000kmThe regular service interval for oil filters is generally 10 000 – 15 000km or six months to one year  depending on whichever comes first. Sakura Filters Australia says it is best to consult your log book service manual for correct service intervals.,btohqsg
The Bosch Long Life Oil Filter is built to last for 10 000 miles on vehicles that use synthetic and semi-synthetic motor oils.,btohqsg
Oil Change Rules:Car models from 2008 or a few years after should get it changed every 5 000-7 500 miles. Cars made several years after 2008 should be safe to get it changed every 7 500-10 000 miles. If you drive aggressively you might want to change it sooner rather than later.https://hondakingsport.com›,btohqsg
https://fb.watch/cUni3evB4q/SG plate A45 Malaysia accident.Remind me of the Bugis Red Ferrari Accident....😢,btohqsg
Prepare 5 000 for repairs.It adds upStill cheaper than new car.Different about $20-30k more for new car,btohqsg
many sinkies like to go to jalan serampang,btohqsg
Gearbox ATF better change 20 000My DCT freed change 20 0000If follow manual 40 000  think gearbox piang already 😂ATF oil not expensive.. some place $60 Amsoil ATF capautowerk. I service last Feb.Gearbox repair expensive1 week down time  no car also headache.,btohqsg
gearbox fluids last a long time,btohqsg
Freed club. Most change at 20 000,btohqsg
But many still ask when buying cars if servicing done with AD? 😅,btohqsg
I would like to ask for Estima CVT  how many km to change CVT fluid? (My workshop told me every 20kkm).,btohqsg
dr. gearebox guy told me no need to change often. says lasts a long time. when i had mine changed there he told me,btohqsg
Sometimes dont service with AD no warranty,btohqsg
Yes. Just change. 20 000kmCVT fluid not expensive.You follow DR Gearbox tiktok.You see how many CVT they overhaul.😱Altis/estima./Alphard...,btohqsg
you must. if you care for your car,btohqsg
What about those PI cars? 😅,btohqsg
Manual 40k.If you high usage. 4 -10hr driving. You change 20k 😅If you drive go work and home.Twice per day.40kBe kiasu is ok with ATF fluid😅,btohqsg
