text,group
I know  don’t have that expectation,btohqsg
The foam level is similar when you shower yourself.,btohqsg
i have this. brand is kartcher. i find it lousy. the bottle is too small. when used with the pressure jet  it finishes in no time,btohqsg
Do you have access to those hdb jets ?,btohqsg
This one not use with pressure jet. This one hand pump. Need hand job.,btohqsg
If you do buy those cheap attachments,btohqsg
But this one is bottle itself… not the spray attachment,btohqsg
Works perfectly well and it’s small,btohqsg
yes/. hand pump. but i think after a while wont use anymore. because it is slow,btohqsg
even waterless wash will be faster lol,btohqsg
you guys dont send cars to car wash?,btohqsg
these days i also become lazy to use the pressure jet. it is just spur of moment thing to buy. but that kartcher is very very useful when you want to do spring cleraning say chinese new year washing.,btohqsg
I only send to the car wash I trusted. Petrol station ones usually CMI,btohqsg
so indirectly i found the greater use... lol,btohqsg
These days  I’m lazy to even wash car… being more than a month haven’t washed,btohqsg
yea hdb wash also use pressure jet LOL,btohqsg
Next week send my car for yearly coating,btohqsg
Ya… hopefully change it back to new car look,btohqsg
My Fav so far is Island car wash. Will purposely cruise along Eunos instead of PIE to go there if I need them to wash.,btohqsg
i get stone chips. i think this cannot be prevented right? ca goes fast,btohqsg
Yea I wanted to go Malaysia for a proper car detailing before my restoration.,btohqsg
I dunno leh… hopefully they can help me clear small scratches,btohqsg
where do you intend to do restoratrion? trhere is a famous one in JB that specialized in old cars,btohqsg
If they can’t  then I delay doing it,btohqsg
does your speedo still work? how many km now,btohqsg
you are going to get a new car  why bother to do,btohqsg
speedo works. Fuel gauge no.v 😂,btohqsg
I mean new car look after coating maintenance…  not getting new car,btohqsg
repair the fuel gauge la. search internet to get part to replace. make it complete repair,btohqsg
Going back workshop. Fuel gauge change le but still not accurate LOL,btohqsg
that's the idea. can go to jb to refuel cheap,btohqsg
need to locate my passport first. 😭,btohqsg
past 2 years dunno where it is collecting dust,btohqsg
mount austin has a specialist doing classic nissan cars restorations,btohqsg
LoL.. can't imagine how sad you'd be if have to scrap it one day,btohqsg
Hope Proton will be back in Singapore  their new models are good,btohqsg
New ones? My friend bought one inspira,btohqsg
X50 can’t meet demand. Some wait for one year.,btohqsg
After geeky took over things improved,btohqsg
I have this. Not really the fan spray though. More like squirt balls of foam. If that make sense.,btohqsg
That is a coupe of decades ago. Those old school proton can last!,btohqsg
Now with so many new ev   getting so competitive in sg market,btohqsg
Even vw only sold 133 unit lolhttps://www.lta.gov.sg/content/dam/ltagov/who_we_are/statistics_and_publications/statistics/pdf/M03-Car_Regn_by_make.pdf,btohqsg
Can see mg   byd and tesla gaining pace in Thier market share   now proton come is like hhehehe,btohqsg
📢sgCarMart NEW CAR LOBANG📢Kia Stinger 2.0-litre GT Line (A)🇰🇷💵 At just$221 999for a limited time only!💵 Or book it from as low as$136 999in addition to your choice of COE price! (Based on available COE price options)👉🏻 Impressive 2.0-litre turbocharged engine👉🏻 Wireless Apple CarPlay and Android Auto👉🏻 New Kia Advanced Driving Assistance Systems  including Surround View Monitor and Blind-spot View Monitor👉🏻 Head-up display comes as standard*T&Cs apply⛔️ Promotion ends on 19th May 2022 ⛔️➡️ Hotline: 6866 1666➡️ View the promohere👀,btohqsg
Ya stinger never had a chance to sit on 1 before   maybe go test drive,btohqsg
Really? Volvo quality improved under the Chinese? Saw some Vloggers giving bad reviews on XC90,btohqsg
The interior quality really good  can't deny. Test drove the xc60 t5 last year and it was really smooth.,btohqsg
My ex colleague owned the previous version XC60  maintenance cost on average was $1k whenever it’s in the workshop after warranty. Decided to switch to Subaru Forester.,btohqsg
Reviews on performance or interior quality? I just like the styling under geely,btohqsg
"Volvo reliability is pretty solid from a volvo owner for the past 20+ years.. newer volvo are defo abit less ""tank like"" but are still as reliable as ever",btohqsg
That will be before it’s under Geely,btohqsg
I know of someone who repaired the Volvo DCT 3 times each time costing 2-3k. It’s a 7 year old xc70,btohqsg
The older gen Volvo and Mercedes are damn solid beast.,btohqsg
Volvo at that time used the Ford DCT which was undoubtedly unreliable... Post 2012  Volvo has not been plagued with any serious issues,btohqsg
These days  they build cars to breakdown so manufacturers can sell spare parts when breakdown?,btohqsg
Still using the DCT as it was following the P2 platform,btohqsg
P3 and SPA platform are solid without any major issues,btohqsg
Ioniq 5 is nice wait for that,btohqsg
Interesting  because I've heard horror stories of Forester maintanence too,btohqsg
Just depends on how you maintain the car and drive as well I think,btohqsg
Heard of a Forester owner who did around 65 to 70k in a few years and his gearbox died. Needed to change the whole unit. Another one who's aircon completely shut off,btohqsg
Yeah man agreed... boxers are known to be slightly less reliable when preventive maintenance is not done,btohqsg
"Not covered in warranty either because they ""missed a service at the agent"" but always service at the agent",btohqsg
Can put up my lexus here for sale?,btohqsg
any Sienta hybrid driver drove up to genting before ? enough power to reach the top ?,btohqsg
Then eat happened to the COEs that people bidded  how can so little car sold when COE issued were so much more?,btohqsg
Nowadays car are so efficient  that why I always said the speed limit is too outdated   in actual fact nowadays cars are way too powerful haha,btohqsg
haha back to the good ol times when the ford model T was sufficient,btohqsg
This is not included as new COEs issued... These are under PQP which is based on 3 months average,btohqsg
but our sienta hybrid is not that powerful. 😅 just to ask any bro here have experience driving up and share their views 😊,btohqsg
I thought u asking how come so little car is been purchased and where did the coe go to ? So I assumed it should went to cars that renew coe,btohqsg
Is more then enough I can confirm at most your rpm is at 3000 all the way,btohqsg
No  the renewal of COE is not included in the issuance of new COE... New COE is based on the numbers of car scrapped and LTA's allowance for vehicle growth.,btohqsg
Or maybe the data is onlyFor ad only have to read the fine prints,btohqsg
even with 1 driver and 4 adults on boards ? 😅,btohqsg
Agree  cars are powerful and stable to maintain slightly higher speeds but are the drivers trained and capable enough to manage them? Food for thought. Btw I'm all for a speed limit increase but just another point of view,btohqsg
Shouldn't be any issue to go up as I used to drive a 600cc car up there but certain part of the uphill slope need to use 3 gear,btohqsg
cool 😎 🆒️ 😎any passengers onboard,btohqsg
Should be fine sir! Genting not as steep as the Top Gear stunt dam! Sienta should work out  enjoy your trip!,btohqsg
Actually a lot of accident is due to frustration and cars moving too slow   most of the time I also get wander off as the traffic is really too slow   I can even look at the other lane   and other cars,btohqsg
genting is no kick to toyota they are solid machine 😎,btohqsg
Case in point right there  if you're getting bored while driving because traffic is slow. Probably shouldn't be driving at that point. Driving is all about patience and focus. Both of which are required more and more as the speed increases,btohqsg
Sir  if you driving  please look ahead. Dont get distracted and let your mind float away.#DriveSlowDriveSafe,btohqsg
actually I drove up KL last weekend and along the way I don't find similar model along the NSHW which makes me worry is this model suitable in Malaysia 😅,btohqsg
coming long weekend  aiming to drive up genting with 5pax on board 😎,btohqsg
Ya I understand but is really too slow   just look at at traffic light interval at turning right   how slow the cars move and how long the traffic light interval is . I hope the traffic light interval be like 50% faster and put in timer   so driver can concentrate and move off faster then taking own sweet time   some time a green turn right arrow only 3-4 cars past thru and got to wait another 5 minutes,btohqsg
The timer is actually counter productive because it'll make people see got few seconds left and speed up to beat the light which can be the cause of a crash again. Just depends on different drivers and what they're comfortable doing  all about patience again. Sometimes drivers may not have visibility of oncoming traffic on a blank arrow so they wait  which is understandable. Traffic light timings really depend on traffic conditions as well  timing changes throughout the day!,btohqsg
Agree with your point about the waiting though  sometimes can be annoying if you're rushing somewhere but I guess we just have to deal with it because all people using the roads 🤗🤗,btohqsg
i agree with you Mr Arnav. Patience is a virture. Those few minutes spend may prevent a potentially fatal accident. Thks for your insight😋😋,btohqsg
If u notice most of the driver are not focusing on road while waiting for green light   some are in park gear   and when the light turn green   they have to take engage back to drive   and this lead to chain effect of mass delay,btohqsg
With timer at least they can be more prepared,btohqsg
While in Seattle I notice how fast the traffic light interval is   and the traffic is smoother   our traffic light interval really is unnesscary too long,btohqsg
That's true  but I guess that is just our local driver nature at times. A short honk is usually enough to wake them up from their TikTok/Facebook scrolling sessions.,btohqsg
If you look at the American intersection system you might also see how much bigger their roads are and how spaced out people are. Really cannot compare  different driving dynamics altogether,btohqsg
I mean on the small road   u press the green man button within 10 plus second it will be green man,btohqsg
When traffic is light having fast interval is really making traffic smoother   then to pile up a long stretch of cars  and the car that had had the pole start is a slow and road hogger the traffic jam is even worse,btohqsg
Road hogging issue is actually getting worst and cars behind them built up frustration and can lead to accident,btohqsg
Slow moving off   slow acceleration  maintain low speed,btohqsg
They think they are safe driver   but cars behind them is really frustrated   that why u see so many tail gating,btohqsg
what if they old people haha give chance luh,btohqsg
I don’t tail gate   I just endure with the frustration and over take if condition allow,btohqsg
I would say as long as the person isn't too slow like under 35 in a 50. It's still ok because you don't know what their skill level is plus if they have older people in the back who need a smoother ride etc. And going off lines  not every car has high torque to go off quick and people don't floor it everywhere I guess. Tailgating is what leads to the accident actually not the slow moving car in front. If the cars behind can maintain distance  you will be safe and then overtake the car when you have a chance,btohqsg
Mr Simple Guy  I am also inclined to agree with you. Road Hogging has been a very serious issue as of late. Too many road users believe that lane 1 is to travel at the speed limit which is a common ❌MISCONCEPTION❌.This kind of behaviour makes expressway INEFFICIENT  really inconsiderate. I am sure more needs to be done to educate road users on road ettiquete.,btohqsg
Yes one of the way to tackle road hogging is increase speed limit to 110 km,btohqsg
Is it safe? or should we all use TESLA AUTOPILOT to drive?,btohqsg
Most of the country are also at 110 km   Singapore road infrastructure is so good but limit is at 80-90   with modern Car technology and the amount of cars   80-90 is just way too slow,btohqsg
And then what  we will have people driving at 110 in lane 1 and others who still want to go faster,btohqsg
I hear home loan rates now up 1% this year,btohqsg
What do we do then  just an endless cycle at that point  what's needed is road etiquette for this case and the concept of giving way,btohqsg
Will hit 3%by this year easily,btohqsg
Gonna put a lot of pressure. Expect coe the o fall,btohqsg
Our country is not give way but to speed up,btohqsg
I also heard the PM Lee said that recession is coming   hence there might be no reason to implement the 110kmh speed limit as this will cause people to burn more petrol hence effecting economy once again.,btohqsg
excatly sadly like this hard to increase limit haha,btohqsg
Cars now a days driving at 110Km is also below 2 k rpm,btohqsg
if limit is 110 and people dont give way its a recipe for accidents,btohqsg
I am inclined to agree with you Mr Arnav. What measure do you think can be implemented? SkilsFuture lesson on road etiquette?,btohqsg
Just driver behavior  increasing speed limit will not solve it,btohqsg
I propose penalize the road joggers till they change to slow lane to become habits,btohqsg
Nope the middleLane won’t travel that fast,btohqsg
And it is easy to cut,btohqsg
if they are people pushing 100 nowadays hard to say uh boss,btohqsg
This is a very good idea. Maybe can propose to Government,btohqsg
Haha. So true. They think you want to chase them,btohqsg
No wonder so many people selling,btohqsg
U did not notice that now hard to overtake is because overtaking lane is the same speeed as the lorry in the middle lane ?,btohqsg
They think giving way is lesser behavior,btohqsg
Will write to my MP. thks. Rgrds.,btohqsg
If overtaking lane is at 110 it is easy to overtake the middle lane,btohqsg
The whole issue is that people will continue to stick to lane 1 and drive at the speed limit instead of giving way,btohqsg
Noted on the support given. Will do the same with me MP too. Best regards.,btohqsg
You increase to 110  people want to go 130 in lane 1  endless cycle,btohqsg
But it is easy to over take   and don’t need to over take at 1110,btohqsg
end up singapore will become autobahn haha,btohqsg
Dont we all love CTE to be our next NSHW?,btohqsg
but cannot control people mah some people confirm leg itchy will overtake above 110 :(,btohqsg
U look at Malaysia also is at 110 most sg driver enjoy driving there,btohqsg
If overtaking lane is 110  middle lane is also 110,btohqsg
Actually Subaru Forester is very solid car and reliable. They’ve won many awards in reliability in America. I tested this car many many years ago on behalf of a buyer who wanted to buy. Suspension feel is great. I wonder why not reliable today,btohqsg
most sg drivers enjoy cos they go above 110 hahahaha,btohqsg
Cause 80-90 is really too low,btohqsg
Is it because many years ago?,btohqsg
Beg to differ  can see lorries and hiace driving at 110 at many times,btohqsg
This I never see 99% of the time,btohqsg
Most of them is 70-80 plus,btohqsg
Malaysia highways relatively empty  especially the ones most SG drivers are on. Singapore is a smaller country less room more cars,btohqsg
I have seen way too many EJ engine blowing up  not sure about you tho,btohqsg
More cars using the same stretches everyday also,btohqsg
I see alot of cars at ecp going at 200,btohqsg
Yes. At least ten years ago. It was very good. Wrx Forrestor all solid machines,btohqsg
With higher speed can reduce the congestion at peak period,btohqsg
yes i agree wrx is solid car,btohqsg
My friend had a wrx and he let me drive for a while it’s very comfortable to drive. Good daily driver,btohqsg
did you like the fuel consumption?,btohqsg
The suspension feelIs very good. Rock solid build too,btohqsg
If everyone at higher speeds  all moving together mate,btohqsg
The issue is giving way and driving etiquette not speeds,btohqsg
cannot control some people who will cut in and out mah,btohqsg
agree with this good point mr arnav!,btohqsg
I think you buy wrx you don’t calculate fuel consumption one,btohqsg
One who wants to road hog will continue to do so at 110  one who wants to drive fast in lane 1 will continue to do so,btohqsg
I don’t know. I didn’t  drive long enough. But it’s good enough to leave me positive impression. He says it’s damn good on the wet,btohqsg
ah yes all subarus good in wet regardless of engine cos of the symmetrical awd,btohqsg
Driving etiquette is hard   most of the taxi and coe cars drive like gangster road hogger,btohqsg
Yes absolutely. We got to have education.,btohqsg
handling really miles ahead of other cars,btohqsg
yep  calculate number of head gaskets needed,btohqsg
Education don’t work for every 1,btohqsg
Yupp  and that's what needs to be improved. Speed limit increase for everyone  same issue will stick around,btohqsg
precisely  if singaporeans got no driving etiquette  increasing speed limit will be dangerous,btohqsg
Maybe we can use such chat to promote day to day education to new drivers entering as well ?,btohqsg
Just need to inculcate the right driving rules from the start  road etiquette more than hill climbs,btohqsg
I was driving a 156 Alfa and I chased him to 180 plus. And that’s where he pulls away easily when I am running out of steam at 220 plus,btohqsg
The salesman tell me the rear view mirror don’t need too big too. Coz your handling so good plus speed you will be leaving everyone behind,btohqsg
Need to have driving etiquette course on how to use signal light...,btohqsg
they say no need big rear view mirror cos workshop got nothing to see too,btohqsg
There is never a blanket solution for all  different people  different mood  different skills  different cars,btohqsg
Why u drive so fast lol,btohqsg
That's why  need to deal with the issues  all paying road tax,btohqsg
all jokes and banter  i do love a good subie too btw when its road ready,btohqsg
And not change Lane dangerously without signaling. Only when can't cut  then signal light on...,btohqsg
Ya some time just too mad with road hogger I got a video of how a car block me !,btohqsg
180 plus not that fast ok north south highways.,btohqsg
I use Mazda to do this often too,btohqsg
I give way to faster car,btohqsg
Yeahh  just need to flash them and try to move forward! No choice,btohqsg
my friend ignatius managed to hit 240 on nshw in 2010  he drive tat gtr with v6,btohqsg
You are a good man sir. 👍,btohqsg
need more drivers like you on the road!,btohqsg
maybe his leg feeling extra heavy haha,btohqsg
I always do. Even in m3 I give way to myvy. I think he’s in a hurry,btohqsg
wow! m3 driver! cool solid car,btohqsg
U flash them they hog more come I show you,btohqsg
Got to have good tires when driving fast  Clear and open roads,btohqsg
e92 m3? heard the NA V8 very powerful,btohqsg
But I dare not do 300. Many YouTubers do 320 330. My top speed I ever tried is 255,btohqsg
Yes. That’s the one. Yeah glorious sound.,btohqsg
you really winner own my dream car,btohqsg
It’s a touring machine. Or do 250 in 6th so that engine revv stays high,btohqsg
Then overtake from left very politely and safely,btohqsg
More and more junctions doing away with discretionary right turn. Taking longer time for both road users and pedestrians,btohqsg
I've been trying the new tourador tyres and it's performing well.,btohqsg
I recently like Yokohama. Sidewalls very strong and stable.,btohqsg
Less than 6 km a liter. Ouch,btohqsg
Can share picture of your beautiful ride Mr Win?,btohqsg
wrx average 7 sometimes haha with boxer 4,btohqsg
my friend jing xun drives a e63 i heard how is the driving experience like sir?@Jingxunn,btohqsg
I've been reading and many people are saying tyres are all the same. That is why many new brand can perform better than branded ones hence I've chosen tourador.  Maybe one day you can try.,btohqsg
My friend tell me got discount if you put decal one. Is it true?,btohqsg
Yes yes! This is very good initiative from the company. I share many of my friends go try already. All very happy.,btohqsg
heard the sticker hold down the windshield better  can provide better aerodynamic,btohqsg
Some would say it is unsafe,btohqsg
Sure. This is the bmw m5 class. Large engine powerful torque abs power,btohqsg
m3 better leh i feel more loved by all in singapore 😍,btohqsg
@winman16share share! Would love to see your ride!,btohqsg
Actually engine loves it when you revv long at bear redline. Blasts put carbons. And becomes very efficient,btohqsg
Highway running engine usually is very good,btohqsg
good mann  cant be an NA V8 from the E92.. love to have one but scared of rod bearings,btohqsg
M3 is 2 door. Not practical,btohqsg
i love e63 man! 5.5l v8 cannot be topped bro!,btohqsg
Anything practical if you say no to a few people 😂😂,btohqsg
I believe he is referring to the very new brand tesla in Singapore. The ceo is Elon musk very talented young man.,btohqsg
Rod bearings issue is commonly discussed but I didn’t do it. I think those drivers didn’t heat up engine oil properly first. Why? Because the v8 takes a real long time to heat up. 8.8 liters of oil,btohqsg
So if oil is not properly warmed up and you whacked the engine bearings failure,btohqsg
I’m my case it takes nearly 5 minutes to achieve “OK” temperature status,btohqsg
And it takes 10W60 thick oil. Even worse right. Takes longer time to travel,btohqsg
But once oil is hot yeah revv all you want. That’s why suitable for track use,btohqsg
Elon not young and tesla is 10Plus years le just young in sg,btohqsg
drive safe everyone! going to join my friends to go rounding now! slow legal cruise! my WRX warm up finish alr!,btohqsg
My apologies  I'm very new to this electrical vehicle information. Back then we only have hybrid at best.,btohqsg
see you at t5 later mr a45!@Theocdguy,btohqsg
I want to go wash car prepare for next shift now,btohqsg
@arnavgulianijoining us tonight in your gt4? 😙,btohqsg
Drive safe drive safe. I go fetch my dog also then need to prepare for night shift,btohqsg
Warm up my car battery now first,btohqsg
Thanks for the wonderful night. Will be warming up my wiper fluid before meeting my friends at changi terminal 5.,btohqsg
Yes my grand scenic 4 wheel!,btohqsg
don’t pretend la. i like to hear your flat 6 roar haha,btohqsg
I wish I can. Bmw doesn’t recommend this probably it cannot withstand high temperature when use on track. I mean the viscosity may not be enough,btohqsg
No wonder your nick Winner. Coz always on track.,btohqsg
Do newer turbo engines use thinner oils? It’s better actually for cold start,btohqsg
This one maybe I check in with cycle and carriage before sharing this information as I'm not aware 😅. I'm just a driver,btohqsg
Shell brand I hear they’re using,btohqsg
I want to try Motul leh,btohqsg
Motul is very good 👍  but need change every 6000km. Not good for my mazda 3 cause I now do part time PHV very high mileage.,btohqsg
How about you for your 3,btohqsg
wah daytime phvnighttime orchard gudang in a45 goodman!,btohqsg
times are tough! stay strong my fellow comrade!,btohqsg
Am considering to do grabfood as well. Times are indeed tough with recession and many stocks all dropping.,btohqsg
I heard Mazda Automatic Transmission Fluid (ATF FZ) SKYACTIV lifetime one. No need to change.,btohqsg
I also do grab food. Selection very good and yummy.,btohqsg
I've yet to try. Maybe one day I'll try when times are better.,btohqsg
Where got so good one? Can I change to their brand too?,btohqsg
Bmw brand engine oil. I think they probably work with Castrol,btohqsg
that’s great  what’s your mode of transport?,btohqsg
i know of a buddy who does grab with a GTI lovely fella,btohqsg
There’s a Reddit forum American users use 7 years doing 200000 miles without changing. But asked if need to change. He says trans as smooth as day 1,btohqsg
Swedish Volvo and Chinese Volvo very different leh,btohqsg
Spark plugs Trans fluids last a long long time,btohqsg
if you are talking about SPA generation  definitely have... but i am currently driving chinese volvo and its still upholds its legacy,btohqsg
Many do grab because they’re bored. Who knows can meet passengers who can talk cars!,btohqsg
Same la. Chinese leave this to Swedish,btohqsg
Before this chinese was a belgian volvo  same like sweden and chinese also pretty solid,btohqsg
This is perhaps the only mass market brand i have not tried.,btohqsg
You will face fierce competition with ebikers. With raising fuel and drop in demand in takeaway food due to reopening  it may not be wise,btohqsg
E30 m3 done mostly by hand. Those were the days when robots are not heavily used yet.,btohqsg
Can check if car sharing app cars can go in jb?,btohqsg
Even if can  in case reallyLost.. I think u have to pay so much for it,btohqsg
Might as well rent in JB,btohqsg
I drive Kia .. I still prefer Toyota Camry  and I still like the lines of it although some jaguars are cool.,btohqsg
Should 😷have extended the COE :(,btohqsg
Lane 1 supposed to be an overtaking lane and normal driving should be on 2nd lane and maintain at speed limit... I have several Incidents  the car in front of me just driving at 70km/h in KPE on lane one and without turning on the lights  cars in lane 2 were driving around 70+km/h  flashed the guy  but driver seem oblivious to this and just maintain the speed. Frustrated?,btohqsg
Me waiting for this as my car is in the final year  thought to just renewing COE,btohqsg
