text,group
Na just reminded me of my prof who cancelled an outing 1 hour before the scheduled time.. and the outing wasn't even in NTU,btohqsg
She cancelled and was like come to NTU for lessons instead,btohqsg
reminds me of my cher who cancelled lesson when i was on my way to sch,btohqsg
Omg got this aunty beside me on mrt,btohqsg
Bruh moment and the outing was the other side of sg,btohqsg
Why cannot be a girl my age💀💀💀,btohqsg
Same oso kind of otherside of sg for me,btohqsg
There are plenty of fishes in the sea. But once u turn 18 be aware the smaller fishes carry a jail sentence.,btohqsg
fml my roaming data used up alr,btohqsg
now im on free wifi lol,btohqsg
Can u deposit cash thru atm?,btohqsg
need to find the appropriate ATM only,btohqsg
any1 using simba know how to top up roaming?,btohqsg
They gave me a non aircon room for hall,btohqsg
im amazed the sergeant didnt just charge him,btohqsg
Simi catch just put a blanket over it or your underwear over it during inspection,btohqsg
Turn on the exhaust can just put at the corner and ensure your block no snitches,btohqsg
But inspection is like sudden one what  no?,btohqsg
Fuck no lmao u think dis one NS isit,btohqsg
Inspect got a window one and they will give notice before they inspect,btohqsg
Also good to have a friend in main com for that,btohqsg
It's a certainty lmao if not dis one is next one,btohqsg
Bloody dumb shit if wanna pon at least do it correctly lmao,btohqsg
