text,group
Stuck under bridge raining motorbike cannot go,btohqsg
Is it going to rain again?,btohqsg
Not me leh. Just happened to rain whenever he washes his car.,btohqsg
Lol. Ghim moh just suddenly heavy again,btohqsg
Superb heavy on and off ~~,btohqsg
you still losing your soccer bets?,btohqsg
My brother still in IMH trying to escape,btohqsg
Cut one off  two will ariseHail hydra,btohqsg
Quick qth for the car pplAny products tt can help prevent car windscreen from misting up?,btohqsg
Night time drive always fog up,btohqsg
Cos I driving Gojek. So I use the from outside air come in tt setting.,btohqsg
Then I keep use my wipers lol,btohqsg
The gps works or got take to wrong place before?,btohqsg
Depends. I trust it to get me from point to point,btohqsg
How about u hire me as a human gps,btohqsg
How abt u go bother someone else,btohqsg
My friend told me windscreen coating works.But cos I got put the anti IR n heat film. Dunno will affect anot,btohqsg
Oh. Ya. What am I thinking,btohqsg
Then I go try the coating thingy.Hydrophobic also,btohqsg
Very nice way of asking him to fk off lol,btohqsg
Sure. Open to trying it out,btohqsg
U need Ic for what 😏😏,btohqsg
Time to go for a hair cut,btohqsg
I just cut last week hahaha,btohqsg
But mine is those barber shop.,btohqsg
No style de just cut short lol,btohqsg
All these got wear hair net meh!,btohqsg
Hi all  I just got my 1st jab of vaccine and the nurse injected me with a preloaded syringe,btohqsg
Just wanna warn you all  don't accept that  as you won't know for sure what liquid is inside the syringe,btohqsg
Scared kena sabo by crazy nurse,btohqsg
Senja cashew cc vax centre. By Thomson medical,btohqsg
SGH hep C outbreak happened before due to lapse in medical protocol.,btohqsg
Anybody have CCTV outside ur house?,btohqsg
Wait u steal him away from me how??,btohqsg
Why u liddat post my hand give ppl see,btohqsg
Nvm la The other Vins can work harder for me now,btohqsg
So i'll be waitinf by the road side,btohqsg
U better be some spider monkey,btohqsg
Thanks for always making me feel so wanted,btohqsg
Nvm I can understand can le,btohqsg
btw do y'all know you can tap on this emoticon and feel the heart beat????,btohqsg
pm got hearts coming out also,btohqsg
I thought like Pm see the hearts fly,btohqsg
Listen to my heartbeat (it's beating for you)~~~,btohqsg
끝났다는 걸 아직도 몰라 왜 이러는지 이해가 안가,btohqsg
hahah i just now say alr,btohqsg
Noooooo my one week flew by literally,btohqsg
the Halloween emoticon got sound also,btohqsg
Ur tattoo big bigI can only afford to tattoo my eyebrows,btohqsg
Wait for u hug me sleep,btohqsg
then have to sell his crx,btohqsg
Always gud de  as long as no irritating kids,btohqsg
I wonder who else received pm from you,btohqsg
Need cut ur KKJ so u can be friends with Mike 😊,btohqsg
my one too small liao...1mm only,btohqsg
I'm telling my daughter this in a couple of years time,btohqsg
Nvm laBetter than him disturbing us,btohqsg
I used to tell herDo you know that happened to cartoon characters when you switch the channels?THEY DIE!,btohqsg
Ooh he delete his chats le,btohqsg
Because you are not Baby Boo,btohqsg
tia gong u very ham de leh,btohqsg
Eh I very curious about ur job leh,btohqsg
Do they give u a menu,btohqsg
Den u just cook according to recipe,btohqsg
Or u likeI dunno how to cook curry chickenThen I just anyhow hantum only,btohqsg
Look like smell like curry chicken can Liao,btohqsg
think got a recipe to follow ba,btohqsg
lol  doubt... the ppl eating there can taste the diff =X,btohqsg
Cuz u know some tze char place,btohqsg
Like taken over by those PRC cooks,btohqsg
The food look likeBut don’t taste like what it’s supposed to taste,btohqsg
they make it base on PRC tastebuds,btohqsg
i help u write good feedback latger,btohqsg
you first day know him meh,btohqsg
So easy ah then who feed me,btohqsg
Cannot liddat must be independent woman!,btohqsg
lololol  i got reminded of someone when u say this,btohqsg
no  not in this grp  in merlion main de  lol the seller,btohqsg
But some days…. Just wanna be a dependent,btohqsg
Can depend on u ma? Samvin ❤️,btohqsg
Got don’t need make like sotong already very cute,btohqsg
I think u 2 saying different things,btohqsg
Too many to keep track le!,btohqsg
The only one that says good morning to me. And the only one that matters most.,btohqsg
Other ppl busy with work mah,btohqsg
Im hungry and can’t work anymore,btohqsg
Whats up with the crazy sun tdy,btohqsg
Hahhha like periodic table kind of chemistry..Anyway the question is  we have a blue powdery substance growing on a metal surface (metal unknown) when in contact with glycol / water. Want to know is it all kinds of metal will have this? Or just copper / iron etc.?,btohqsg
Never listen in class tsk tsk,btohqsg
Y r we having science lesson nao.,btohqsg
Partner. How can u join the dark side,btohqsg
I believe thats the result of the chemical reacting withbthe acid,btohqsg
OMG THE SUN TODAY ON MAX MODE SIBO,btohqsg
Later late noon jiu rain le la,btohqsg
But then copper oxide is black,btohqsg
We highly suspect its copper sulphate.The metal looks like stainless steel but we can't confirm  trying to find out what kind of metal causes the copper sulphate formation.,btohqsg
Looks kinda like this  blue powder,btohqsg
Copper is also present in stainless steel.,btohqsg
This want I prefer cold storage de,btohqsg
Last time ntuc got sell too,btohqsg
But cold storage want can buy smoke duck,btohqsg
I very long never buy from ntuc,btohqsg
Salad nice n the smoke duck,btohqsg
Maybe i go cold storage check if i pass by,btohqsg
Then closing time they zap the price half selling 2.50,btohqsg
Cold storage smoked duck is ♥️!!!,btohqsg
The cold storage got the charsiew chicken hen naise lo,btohqsg
Honey glazed naiser than black pepper,btohqsg
Xmas is coming! Can buy the whole chicken ~~,btohqsg
I like go westmall and plaza sing de cold storage  they always got alot charsiew chicken~~,btohqsg
Smoked duck is novena and tanglin de got alot,btohqsg
Wrap naise naise n put there,btohqsg
I left hse 1145  nao I reaching wrk plc~~,btohqsg
Bcuz Marilyn Manson is his 偶像？,btohqsg
Bright like the aura from celestial court,btohqsg
🌭 BreadTalk 🌭🟢 FREE Sausage Bun🟡 Min. spend of $10 with NETS🟡 1 redemption per customer per day🟣 Ends 3 DecLearn more:https://bit.ly/3HHxiy8@sgcheapo#food,btohqsg
This weather abit sot plug jiak mlxg,btohqsg
Aft so long I see ur name,btohqsg
I am blinded by the lights...,btohqsg
I meant I’m going for a smoke break~,btohqsg
I crave for tiong bahru lor meeee,btohqsg
Sorry it was just a jokeCuz the cup writeY lemon,btohqsg
Haha I like suan suan stuff !,btohqsg
This person never see my scissors before tho hahaha,btohqsg
It’s okWe all same age here de,btohqsg
the korean chio bu neh neh very dua liap one,btohqsg
🥘 Hot Pot Addiction 🥘🟢 FREE HOTPOT🟡 5 pax required🟡 Mon-Fri🟣 Ends 28 NovLearn more:https://bit.ly/3nCzjmX@sgcheapo#food,btohqsg
Which part u wanna see?All I have,btohqsg
Hi Jeanna. Good morning belated. Was damm buzy. Read this after 500 over messages came through.,btohqsg
Oh WahHahahahaGood noon to you 😊,btohqsg
Y dun u play with me?,btohqsg
Sail liao la u haven’t even jio her out yet!!!,btohqsg
I thought he say wanna come out part 2,btohqsg
Ask ur lao gong sing for u,btohqsg
Got movie! Haha I never watch~~,btohqsg
Listen to him sing enough le,btohqsg
Yeah He ownself direct ownself act,btohqsg
Some vins never talk de leh,btohqsg
Rock de friend VinI dunno is who wor,btohqsg
Yes? Wat can i help u?,btohqsg
Who is ur friend Vin?I need to do inventory count,btohqsg
My face still the same ah,btohqsg
Ohh need to change something interesting,btohqsg
Next mth then change..this month remain like tat,btohqsg
hahaha wth bro.. ur dp. LOL,btohqsg
Scared the paint splash dao my door also,btohqsg
U wan bring me go ah?But ur birthday next month wor,btohqsg
U know there sometimes got some siao kia,btohqsg
I waiting for someone to say about her,btohqsg
Got laSometimes they will sayThis girl waste timeThis girl uglyOr what,btohqsg
Once in a while will have de,btohqsg
So mean to say someone ugly tho,btohqsg
Can just comment. That person dun look nice,btohqsg
U try lo. How to comment in a better way,btohqsg
This is a monetary purchase mah,btohqsg
I don’t think it’s wrong to comment on that,btohqsg
Not say u commenting ur friend,btohqsg
My friend say I am ugly. I am fine also..,btohqsg
End of day.Beauty is in the eyes of the beholder.Everyone got different definition.Whatever sails their boats can le,btohqsg
FR u wanna read and believe or not also ur Taiji,btohqsg
Just like foodSome people say nice some people find bo ho jiak,btohqsg
BiT what business to u? I don’t even mean bad when I say that  n u here barking away as though it is about u. Trying to score point ah?,btohqsg
what are we talking about now,btohqsg
all my friends say i yandao,btohqsg
oops ps ps i better siam this,btohqsg
i dunno context one better siam,btohqsg
i ask you ah Why does ah lian throw butter out of the window?,btohqsg
cos chicken lay eggs and chicken is a mutated bird,btohqsg
do u know that chickens are malay?,btohqsg
I APOLOGISE FIRSTTTTTTTTTTTTTJUST A JOKE.....Because they are too lazy to fly.,btohqsg
how do you name a chinese baby,btohqsg
get a bunch of coins and throw it down the stairs,btohqsg
how do you PAUSE an indian,btohqsg
if you know what i mean,btohqsg
Next year bring me go acupuncture ok,btohqsg
next year is in 1.5 months bro,btohqsg
No they upgrade the insurance plan,btohqsg
Think my hand can tahan till next year,btohqsg
Now pain but not so pain,btohqsg
🥤 Starbucks 🥤🟢 25% OFF STARBUCKS STOREWIDE🟡 All purchases up to $300 per customer🟣 Ends 28 NovLearn more:https://bit.ly/3oSEvT4@sgcheapo#drinks,btohqsg
But at least I could move my arm,btohqsg
Got sashimi on top of rice,btohqsg
then what u think u feel about urself,btohqsg
for me guys  just change ur hairstyle  do some hair colour if it will make better  take care of ur skin,btohqsg
one of few things to check,btohqsg
for me thought i not handsome then people say i handsome,btohqsg
WellzEven if ure the handsomestLike Chris HemsworthAlso got people say not handsome one la,btohqsg
Be comfortable in your own skin,btohqsg
Confidence really adds a lot of points though,btohqsg
But easy to sayI’m not exactly confident of myself either,btohqsg
lol for me not need mask,btohqsg
That day I was at jewel,btohqsg
same ah my eyes not nice,btohqsg
And I was asking my friend ahWhat’s the point? Take selfie with mask?,btohqsg
later can jio us next time😂,btohqsg
Why she always so moody 😢,btohqsg
Ur loklok photo always remind me i haven jiak loklok 😭,btohqsg
Wait is it the same place we went!!,btohqsg
Wait for others to jio hehehe,btohqsg
Hahahaha no la not so hungry tonight,btohqsg
Wasn’t planned actuallyJust walk till hereThen jiak lol,btohqsg
Need drive like PeroduaThen considered safe,btohqsg
Mm! I want the coconut one,btohqsg
Wbh eat with many then nice! I wanna share wings ~,btohqsg
Drink straight from coconut fruit better?,btohqsg
I wan the cherry blossom and buckwheat one though,btohqsg
Hei Good morning. It sure is a beautiful day.,btohqsg
Hey baby! I think I wanna…….,btohqsg
I thought u gonna finish the line 🤣,btohqsg
Hahaha early morn so lovey dovey 💕,btohqsg
Morn Jeanna~~ office day today 😭,btohqsg
Lol u telling someone who goes office everyday since Covid started,btohqsg
Dunno what to eat for breakfast,btohqsg
Go office munch on bread ~~ u!,btohqsg
I eat bread too today 😊,btohqsg
Helps the contain the sperm in ur ball sacks,btohqsg
Ehhh why early morning talk until sperm thing,btohqsg
Y? U only can talk at night?U must be boring in bed,btohqsg
So u won’t xiao chong nao,btohqsg
We all do… just too expensive,btohqsg
how u know u try already later u always find me,btohqsg
Two vins come out le!!@Jeannable‘s harem,btohqsg
I going back in my coffin,btohqsg
But last night was cooling though,btohqsg
Else how we know ppl will go back for more,btohqsg
lol  was hiding in aircon room,btohqsg
No no no not for u all,btohqsg
ok  this made me laugh out today ahhaha,btohqsg
we need a poll for this,btohqsg
I guess.. he was the wrong kah wai,btohqsg
Sad no one got that joke,btohqsg
confirm  cos we 2 siao langs,btohqsg
Hi I am kahwai still single can I date someone single,btohqsg
Who do u want to date,btohqsg
If u date guys got problem already,btohqsg
a few times jiu not shy le,btohqsg
u too slow.. wanna intro to u de,btohqsg
progressive action ...which is good sign,btohqsg
1st come put more effort then close to the winning side,btohqsg
No girl to date and let me know sad,btohqsg
Did I see a successful ship!,btohqsg
i also want work full shift liao...got massage leh,btohqsg
Must I grow kkj now hahaha,btohqsg
She say want grow kkj then I say no,btohqsg
If she grow then less one girl in the world already,btohqsg
Why u expose to everyone here 🤣,btohqsg
Nobody likes a despo guy pls,btohqsg
I searched for laser eyes LoL,btohqsg
be successful in your career and life  be good to parents  naturally will come to u 👍,btohqsg
[Makan Thai Food] Authentic Thai Food that you can't miss which can be found located at Bukit Panjang. Skip the Queue with online orders to Dine in or Takeaway. Staying too far? Order for delivery!Order OnlineHttps://mythaipotsenja.skipqoo.appLocation:Senja Gateway  Blk 635C Senja Road  Singapore 673635Opening hours:Mon-Sun: 12PM - 9.30PMInformation as of date of post#makanthai#skipqoo#singaporefood#singapore#sgfood#sgfoodies#sgfoodie#sgeats#foodporn#sgfoodporn#singaporefoodie#foodie#food#foodphotography#foodsg#sgfoodtrend#sgfoodlover#sgfoodblogger#sgfooddiary#foodgasm#sgfoodhunt#singaporeeats#eatoutsg#exploresingapore#exploresg,btohqsg
Nao days ppl dun use tg for job scam already???,btohqsg
I jus received a call from dk wad job agency,btohqsg
I dun use job apps wor,btohqsg
No ah here all friend can chat right,btohqsg
My agent is from tg de  current job oso from the tg ad in sg job gc de,btohqsg
lol  tt day my friend receive a call from some dating agency ask her want matchmake anot.,btohqsg
u should say i dn wan... but i wan money.. got kang tao bo,btohqsg
Me scold ppl = 小朋友骂人 lo,btohqsg
Bluff u I no money get xia,btohqsg
Shld I buy OPPO Reno 6 pro,btohqsg
Can use is can use  jus not enuff memory and the batt die hen fast,btohqsg
No ah I want got future,btohqsg
u wait for next year new oppo flagship sua,btohqsg
My manager say I talk liddat she scare raise her voice to talk  怕吓到我,btohqsg
