text,group
♡i find that i really like wearing cheongsam,btohqsg
Wa my hse downstairs kpt blasting andy lau songs,btohqsg
Happy  chineese new year to u guys😊,btohqsg
So I like garlic heh! Liddat we 一起吃飯多合諧~ 不會搶！ 哈哈哈哈哈,btohqsg
i wear red army t shirt at home lol,btohqsg
This type cheongsam is bit tight fitting,btohqsg
I bought cotton on bod de clothes lo... Try tat time okie  actually the girl say can wear out uh... Now it's like sibei long  I need to wear at home ..,btohqsg
Orhhh my dad stays there oso...,btohqsg
Got sleeve... Like over over size nao lo,btohqsg
Y did I buy XL... 🤣,btohqsg
I deep fried in pork lard,btohqsg
But only able to wear during CNY,btohqsg
U wear like that go bainian ah,btohqsg
It's mena to be over size but nao it's over-over size,btohqsg
Yes hot die me n hard to walk,btohqsg
i give you d.... you pose with it k. confirm become xxn,btohqsg
Wah okok think i have those too,btohqsg
No la  I buy XL... Once again  my sis ask me y buy pyjamas.... 😭,btohqsg
she will ask you to sponsor,btohqsg
can but she wont dare to wear,btohqsg
L is got fit dao hen naise le.. but XL de naiser print,btohqsg
will fall apart the moment she walk out,btohqsg
proper kimono 1 day rental 2.5k-ish,btohqsg
haven't add all the other stuff like the veil all,btohqsg
ya damn exp. a lot of ppl mistaken yukata for kimono also,btohqsg
Yukata is more for summer n lighter,btohqsg
Also many wear wrong side also,btohqsg
proper kimono dressing need to take class get certified one,btohqsg
not just the layers  need to put the thing at the back to straighten all also haha,btohqsg
I heard cannot wear b*a inside also 🤔,btohqsg
@daddysgoodgirllYour BF run away from home again,btohqsg
actually if go those hot spring area  the hotels there provide yukatas,btohqsg
can bah  at least from my experience is got wear inside,btohqsg
oh wait the hotel i went to in tokyo also got provide,btohqsg
hotels mostly depends but ryokan should have,btohqsg
i think so. in tokyo cant wear out also,btohqsg
went to Ueno park during the festival all the chio jp mm in yukata,btohqsg
time to arrange go tgt kek,btohqsg
Wear n do the bon odori dance,btohqsg
i went Ueno but didnt see anyone in yukata,btohqsg
the areas around the ryokan can,btohqsg
Last time i go i stay near Ueno,btohqsg
or go to hakone area there all hot springs more acceptable Ahahaha,btohqsg
Harajuku is the Harajuku fashion street,btohqsg
hahahaha I more weeaboo so akihabara more impt to me lolol,btohqsg
but yeah went to harajuku as well,btohqsg
Ur eyes red from contact lens le,btohqsg
harajuku fashion is not cosplay 🙂,btohqsg
my fav place in all of Japan tbh,btohqsg
tell me.. u like guy or girl.. u got wife or husband,btohqsg
@whatthefishzzdid you try to extend your life?,btohqsg
yes! I think 4 of us bought like 8 eggs,btohqsg
it's from the hot spring water,btohqsg
put in the Ramen damn good,btohqsg
Then turn black? Spoil liao la,btohqsg
only the shell turned black la toot,btohqsg
The crepe stall is in front of this building,btohqsg
maybe the smell there masked it,btohqsg
fk I legit miss Japan now,btohqsg
this one is in the middle de,btohqsg
Thanks for ur compliment. There r many pretty ladies here too 😜,btohqsg
Omg glass so cold till got frost,btohqsg
wah meiji very expensive to book.,btohqsg
Ahhhh omg the beer go down.. feels so gooddd,btohqsg
fk off at least get the God right,btohqsg
go there during school holidays before school start to collect the beans!,btohqsg
There the melon pan is nice too,btohqsg
is u.. 😢 not her... i aim u since i in this gc..,btohqsg
I lost all my japan pictures,btohqsg
I wonder what is this building,btohqsg
ohh i see inari shrine inside,btohqsg
Hp totally ded. If fix.. $300,btohqsg
actually inside not very cold  each snow dome got a big hot pot inside,btohqsg
I will go back one day for sure... with or without pic,btohqsg
this is the hot pot inside,btohqsg
This one is got event one right,btohqsg
yeah throw the beans must catch for good luck,btohqsg
the express to hakone then this boat is the 1km above sea level lake right?,btohqsg
Wahhh all the photos   miss japan,btohqsg
but actually all their choices also v nice lol,btohqsg
really . everything  first time is shy😳,btohqsg
hakone my fav place in all of jp ;(,btohqsg
my hakone photos not in this phone though,btohqsg
u used the hakone pass right? den can unlimited bus rides there,btohqsg
did you go to the coffee/tea/wine hot spring?,btohqsg
Who just delete that hey hey photo ah notti,btohqsg
learn lor  if u know Mandarin u got an advantage over others who take it as a 2nd language,btohqsg
yeah quite out of the way  I think it's like 6 stops from the main area,btohqsg
oh u went during which season? mine all white white cuz I visited during winter haha,btohqsg
ohh end autumn to start winter,btohqsg
I like the cold air there lei hahaha,btohqsg
hahahaha I love cold weather  -3 degrees go downstairs in shorts and a long sleeve t-shirt with slippers to smoke,btohqsg
That time go tokyo my friend still tell me not cold n i did not bring cold weather clothinf,btohqsg
My friend borrow my glove n i m.cold,btohqsg
muji all those cheaper than sg tho,btohqsg
ya cold air is OK  is when got wind den u feel the chills lol,btohqsg
Ah I see   i no see muji but oioi,btohqsg
even buy at the airport also cheaper than buy in sg ba,btohqsg
jr pass can buy hakone pass at a discount at that time,btohqsg
https://www.yunessun.com/global/en/spa/if you ever go back to hakone must try haha,btohqsg
yup yup  but if you are a jr pass holder can get the hakone pass at an offer,btohqsg
U don’t keep posting. Later@duapaosiansave your photos,btohqsg
ehh sorry . i not this kind of person😢,btohqsg
5k for 2 weeks quite budget sia,btohqsg
YOU TITI WANT USE MY PHOTO TO PUT AT YOUR DOOR,btohqsg
yahhh i also waiting for them open wanna go jpn soon ):,btohqsg
Ya so not surprise if u save@ZermineLeephotos loh!!!,btohqsg
Yeah sia... finally not those thin and little pieces one.,btohqsg
Yum! I always cut them into thick & fry till crispy,btohqsg
Hahaha i scare melt  too much layer i guess,btohqsg
Why melt? U don’t bring fan w you?At most touch up again loh,btohqsg
I think u pm him straight. More direct for@duapaosian,btohqsg
I tot u sleep lol must tag u once awhile. Making Sure you’re awake,btohqsg
I Bluetooth driver yes. My phone connected via Bluetooth,btohqsg
Next time my whole car cloud based. When need will use quantum tech n teleport to me,btohqsg
I sound like someone sia lol,btohqsg
teleportation is not what its made out to be though,btohqsg
Nice… veins…. Can I take bloood from u,btohqsg
Wa faster go sit w her,btohqsg
you're just killing yourself in 1 spot  cloning yourself in another  then implanting your memories in the clone,btohqsg
Bring forward. I help u take today,btohqsg
I got the needles n cannulas,btohqsg
Eh I’m active all the while.. just that I had been camping@Alvinyzw,btohqsg
HAHAHAH I’m trying to tag u on every reply,btohqsg
Too big to carry around lols,btohqsg
Anyone looking for round2 place to drink tonight? Pmpm hehe 🍻,btohqsg
He don’t need me to tag.,btohqsg
Read in mandarin then funny. English not funny le,btohqsg
got mic can liao dont need speaker,btohqsg
Yo I think ur hamster seems sick. Machiam no appetite to eat.Today I need to do overtime. Help me take care firstOk. I just fed him some rat medicine / poison. Hopefully it’s ok.The joke is in the word 老鼠药。 it literally translates to rat medicine but it actually means rat poison,btohqsg
Just helping a fellow potato bro out,btohqsg
should not have dropped Mandarin as a mother tongue hahaha,btohqsg
I'll pass.. hahahaha not need in my day to day life,btohqsg
I never drop la but I fail all the way,btohqsg
Sec 5 I never even buy the exercise book,btohqsg
you ask me spon de leh,btohqsg
I can speak it well enough to pass as a singaporean  but I can't read or write cuz I didn't even take it as a mother tongue,btohqsg
took Bible studies in lieu of a second language :/,btohqsg
Then after that I re learn myself through songs,btohqsg
U don’t seem very holy tho. Wahahah,btohqsg
was a free grade since was practically brought up in a Christian environment,btohqsg
Woi. I can hear u from Alexandra,btohqsg
it's the christians themselves which put me off christianity,btohqsg
christians good leh they very notti,btohqsg
Just those that are over the top,btohqsg
dont need judgemental holier than thou people in my life but yes i agree HAHA,btohqsg
Last time my friend dated this Christian girl.. every time ask him go her place to perform… sexorcism,btohqsg
oh you'll be surprised  it seems like they repress it too much that they need an outlet,btohqsg
I might have another case at 7pm at Tampines,btohqsg
That one is not hamster la,btohqsg
Oh he nailed her all right,btohqsg
Ya. I’m waiting for the dr to answer. Cos 2200 got another nurse visit.He wan me go or he wan wait for the 2200 go n do what’s needed,btohqsg
im on the way maybe can meet u at clementi?,btohqsg
"to be fair  people who are willing to believe that there is a supernatural undead carpenter are more inclined to believe anything you tell them  i.e ""why did you sleep with my sister?!"" - ""satan made me do it""",btohqsg
so you come up with one or i spon?,btohqsg
Wts why you got $80 promo code sia,btohqsg
Last wk our dtf oso use the code,btohqsg
U still haben bring me to kintan! Xxlb lbhh!,btohqsg
Actually I feel like ordering isteak de lei,btohqsg
Isteak naise ma?? Anyone jiak before??,btohqsg
Heart heart de promo code alot  she see till haben come back sia.... 🤭,btohqsg
opposite me in the train got 2 xxr...tall and ham sia,btohqsg
I saw got 450grmas de ribeye sia!,btohqsg
Wahhh~~ kids nao days 發育得很好 😁,btohqsg
🦆 Peach Garden 🦆🟢 77% OFF Roasted Crispy Peking Duck🟡 Min. 2 pax🟡 3pm - 5pm🟣 Ends 15 FebLearn more:https://bit.ly/3rozUdU@sgcheapo#food,btohqsg
Tis one like can go lei...,btohqsg
no time feed him meds today,btohqsg
He still can wheel with his hands? Break the hands also?,btohqsg
I watch YouTube review. Looks good,btohqsg
for those with uniform fetish la,btohqsg
Simi uniform? McDonald not counted leh.,btohqsg
Others I dk. I only know you,btohqsg
Got what uniform u want lols,btohqsg
I got sec sch ones jc ones flight attendant ones,btohqsg
Yesterday weather so hot i stay at home reading notes,btohqsg
Got 2 version there   old n new,btohqsg
The green one also silk air uniform?,btohqsg
army  navy  airforce. the rest i may or may not have 🙃,btohqsg
Flight attendant also can be kawaii,btohqsg
orh next time i keep quiet,btohqsg
i go photoshop dildos into your pics,btohqsg
Why admin no ban this word,btohqsg
I can do many type need my service?,btohqsg
its okay. i have weird standards so no need,btohqsg
Orhh what’s your standard? Share lai tingting,btohqsg
Ya hor ya hor!! Okie next week !,btohqsg
U dress like that and so part time?,btohqsg
Got ah girl go army uniform ?,btohqsg
No really do for one full month,btohqsg
U dress that and go do delivery?,btohqsg
you wave your 'xnb' to act,btohqsg
I wan watch 四海！！ And My best friend's breakfast!,btohqsg
Wait for u to pass me xnbXNB hor,btohqsg
you wait. i go order one for you,btohqsg
Don’t need. Go HDL ask for one,btohqsg
U never go HDL before right,btohqsg
Dust want go in also difficult,btohqsg
anyways got any good food recommendations in town?,btohqsg
No lah i dun wear makeup to do delivery one   sweat all melt liao later customer chua sai thought 7th month 😂😂😂,btohqsg
Ur make up already like 7 month,btohqsg
I need some suggestions like nowwww,btohqsg
Mai any how bruh me ty,btohqsg
I now cincai jiak and go out liao,btohqsg
Bugis got many good food too,btohqsg
I full liao don't need eat liao,btohqsg
Too hungry. Jiak half way liao,btohqsg
There goes 2000 pax of tissue profits,btohqsg
Lol. I work my hands to the bones to bring her these fine goods,btohqsg
2023 : lets go jb makan. Wah mai la wait tio rob,btohqsg
So cute the zhao cai mao,btohqsg
Last yr de. I still have 5-6pc left,btohqsg
Apparently looks like is same mask,btohqsg
Jeanna! Can the pyrex pot use on induction ?,btohqsg
Hmmmmmmm later I try see see,btohqsg
I saw people selling the points on fb sia,btohqsg
I used on my induction for hotpot,btohqsg
I'm so glad tis meal only 1dollar,btohqsg
hehe i tried. can be used on my dining table!,btohqsg
When we eat not tat warm le  still 爆漿的！,btohqsg
Fuyoh. When it’s hot  better Xiao xin your lips,btohqsg
I like to tear it up first!!!,btohqsg
He confirm will order tis de.. idky he so like tis bun,btohqsg
I haven’t jiak lor mee in awhile,btohqsg
My 2nd round all need access card de,btohqsg
Most are secret place to chiong 😂,btohqsg
your dream my life. hahahah because see the food you post  looks so yummy,btohqsg
ohh so kimly's ah.. theirs not bad de. last time i always order from grab hahahah,btohqsg
fuyohhh. they like to deh alot de,btohqsg
u want also can say. hahaha!!! xian mu ah?,btohqsg
Last time I know a lot of girls also. But they dunno me,btohqsg
I talk in front of u hor,btohqsg
no. i heart pain my 贝,btohqsg
Should make him wait longer then,btohqsg
no. is the camera man pro. the model also hamsum,btohqsg
Sorry la I read late 😩,btohqsg
u nv play wif me i very friendly one,btohqsg
lucky got pandan leaf for the taste just now,btohqsg
i feel holy and light now,btohqsg
i now wanna go eat donno what to eat,btohqsg
why sia.. i notice u always bully me.. im so weak and hurt😢,btohqsg
Next time bring u go k,btohqsg
I go there too sometimesBut the aircon damn cold sia,btohqsg
Too cold for me Need to bring jacket there,btohqsg
The Illuma in front one also 24 hours,btohqsg
Mac 24 hr is drive through,btohqsg
I dun even know what is it called nowBugis Plus?,btohqsg
Many plc de xingwang no more 24/7 le,btohqsg
Now tekka mall is called what,btohqsg
No longer the Verge alsoDunno called what now,btohqsg
"""opp Albert court tat mall  u keep u know rite?"" Den grab uncle will know le",btohqsg
Bu hui hou hui mei xuan zhe wooooooo,btohqsg
Oh is it?End up still called Tekka?,btohqsg
Loser songLose the girl leThen ask her dun regret,btohqsg
I guess it was on the verge of being empty.,btohqsg
"I will be ""I forever wun hou hui  cuz u were nvr my choice~""",btohqsg
So they needed to tekka more tenants,btohqsg
I rem last time nearby got the halal kopitiam got naise tzechar... Near rex threatre,btohqsg
Last time I after school always eat there sia,btohqsg
Dun rem the name le  but I rem is halal de...,btohqsg
I guess.. its friday the 13...,btohqsg
All the Malay will blame the Chinese,btohqsg
Maybe this time can see you at middle road,btohqsg
This time buy toto 2 3 4 5 13,btohqsg
Today no step on dog shit.. no bird poop on me,btohqsg
Means tdy nvr sell enuff tissue ppr,btohqsg
Sold... spent all the profits alrdy,btohqsg
Eh why like sound a bit sexual,btohqsg
If it helps too tio 4d. Whatever works,btohqsg
Hen sexual... Nbz I watching black mirror... So many episodes got r21 scenes,btohqsg
How is spitting on someone sexual,btohqsg
My favourite was the fuck the pig one,btohqsg
I was so disturbed by it,btohqsg
Like that all the old ah pek at kopitiam,btohqsg
S2 not as gud as S1 I feel,btohqsg
Ohhh hmmm true spit very sexual,btohqsg
Im watching S2 nao... Just finish the Waldo episode,btohqsg
I sked I won’t ever touch bacon ever again,btohqsg
I scared u wanna find live pigs can’t find,btohqsg
Black mirror gonna get hot again,btohqsg
I watched le!! It's better than Hellbound but not as gud as Sweet home... To me la .,btohqsg
Alice in Borderland oso gt R21 scene,btohqsg
Ain't we preparing for 15k daily?,btohqsg
I wanna ask!!! Wad food is naise at MEC?,btohqsg
Vin really got setup his projector le??,btohqsg
U got eat none noodle food uh? Chops lei??,btohqsg
Ohhh I saw my nearby got delivery lei  wan try someday,btohqsg
I tink fam is order alot grab till grab give him free food  I wanna be like him!,btohqsg
White cold brew means got milk rite?,btohqsg
Ur next mission is white cold brew le,btohqsg
Haha nope. Dint even know got such a thing,btohqsg
I see distance not hen far lei,btohqsg
Tis bt timah plaza I lik hen long nvr go le~~~,btohqsg
It's ah bao de nai  u dun bluff,btohqsg
U go hug ah bao slp,btohqsg
Later u cannot go out of the door,btohqsg
Stop eating food  eat more med,btohqsg
I gng google where 114 JE is... I only know where 114 teck whye is,btohqsg
we can go tog! u bring another charbo along . faster choose now,btohqsg
U no Jio  how u know dun have la,btohqsg
U Mus pm Dem to show ur 誠意,btohqsg
cannot direct pm so fast. later they thought is some BTs,btohqsg
so go where eat good :(,btohqsg
Pasta is life uh for u,btohqsg
This boy skip all to the pig sia!,btohqsg
i wan go eat.. can u bring me?,btohqsg
I tink most guys prefer noodles to rice....,btohqsg
Me is fat! Walking fatsboink boink~,btohqsg
The cheesy crab baked linguine naise ma?,btohqsg
And the beef pie with mash n double cheese??,btohqsg
Tts why I need put insulin. If not I really need chop leg,btohqsg
So naise???? At there is how much uh? The delivery I know confirm up price de,btohqsg
