text,group
Hi Naruto fan. Do you like boruto? Lolol,btohqsg
I read it as “do you feel bonita?”,btohqsg
Ur eyes really need a good checkup,btohqsg
Maybe can consider an appt at gleneagles,btohqsg
I wan to buy annual leave,btohqsg
Buy a specs for your dotter.,btohqsg
So many high ranking ones got caught,btohqsg
Good luck to Hamas if the generals are harmed.,btohqsg
Hearsay is 1 death per collapse civilian building.,btohqsg
The settler occupation is not entirely right... Their targeting of civilians and hiding their weapons cache in places of worship and hospitals is ok...? That's double standards,btohqsg
"At least ü don't start the message as ""I read it as …""",btohqsg
Metal build Kampfer. Looks damn sexy man.,btohqsg
Gundam amazing barbatos rex is my cup of tea. Lol,btohqsg
If more like justice the magenta red,btohqsg
Why not. Red paint liao speed will x3,btohqsg
Put a sazabi head on that,btohqsg
2nd hand undergarments are easier to sell,btohqsg
I got one at the corner of my desk,btohqsg
u sold yours before i guess?,btohqsg
army bird have been trying to sell his,btohqsg
given u have tennis elbow  can try,btohqsg
gary need to buy meh? thought he'd just help himself,btohqsg
Good morning everyoneAnyone know where to eat lobster 🦞 tail there fresh and good ?Thank you .,btohqsg
I am going for a short toilet break before having lunch.,btohqsg
I have finish my short toilet break and going to eat lunch now.,btohqsg
I've finish my lunch. Now I going to take a quick nap till 1pm and resume my work.,btohqsg
I just Finish my nap  back to work.!,btohqsg
Coz i see one person only keep reporting what to eat in words.,btohqsg
My parents got standby. I think i pretty can take Western food,btohqsg
🍶 Matsukiya 🍶🟢 30% OFF ALL Sake🟡 Min. spend of $100🟣 Ends 31 OctLearn more:https://link.sgcheapo.com/yLucBO@sgcheapo#matsukiya#drinksFor Advertising :https://t.me/sgcheapo_adminFacebook :https://fb.me/sgcheapoTelegram :https://t.me/sgcheapo,btohqsg
Drink till drop. Got people drag u back to hotel 😂😂,btohqsg
but army bird have no heart,btohqsg
his heart is made from flowers,btohqsg
no clue who is that haha,btohqsg
Erm.. I believe is you all also keep promoting him lor 😁,btohqsg
coz too many guys fall for him already,btohqsg
I continue to be my tofu.,btohqsg
wait he ask u to be in his video,btohqsg
Oooh. Didn't know he got such hobby,btohqsg
my eyes are still scar-red from what i watched,btohqsg
Anyone can recommend where to exchange money at good rate?,btohqsg
What currency and how much u wan to change?,btohqsg
Huh need to know de meh?,btohqsg
If u tell me $1k and below,btohqsg
I tell u chin cai change,btohqsg
Where exactly? You got more details?,btohqsg
Give me 5 mins i find address.,btohqsg
This website also last time ü share with me one.😂,btohqsg
This shop rate 0.01 cents more.,btohqsg
Sure haha  I think my collection is stickers 🤣 not Starbucks tumbler/ mugs haha,btohqsg
