text,group
Bought this just now for $16 😬,btohqsg
I wanna see your next gf,btohqsg
I'll build an ai sex doll for you,btohqsg
Talk only or need other function,btohqsg
I dunno why I took so long to think of this idea,btohqsg
I need to take some measurements,btohqsg
Can bend here bend there 😁,btohqsg
Depends how awake anyone is to achieve,btohqsg
I am not the recipient of said pumping,btohqsg
Pm air for his customisable AI partner models,btohqsg
Integrate AI partner into his ebook,btohqsg
anyone here happen to have bto yishun groove spring?,btohqsg
Want to buy? Offer starting at 900K for 4room,btohqsg
Can let me know which group that is thanks,btohqsg
wtf how come so ex sia,btohqsg
that's what i asking  why so ex,btohqsg
Not active nvm can give me the link to it just trying my luck to ask something,btohqsg
It's not even that price point she anyhow bomb and its a bto not even ready how to sell,btohqsg
I wanted to see by any chance anyone there got photo of the toilet porcelain tiles sample taken photo of it,btohqsg
I realise I miss out taking the photos,btohqsg
I thought nowadays got BTO WhatsApp group one,btohqsg
I am 1000% confident I am better!,btohqsg
Fully functional too! And have adjustable length  from small to big to bigger!,btohqsg
I go gym then send u,btohqsg
Good business idea  no cost lol,btohqsg
What makes you think got people buy?,btohqsg
Only women got this market. And maybe Titus Low,btohqsg
He got sell his bird bird toy and pipi lol,btohqsg
Head too small  body too big,btohqsg
But many girls like him I think haha,btohqsg
Oh ya lol that time when preg he like got another girl or something ma,btohqsg
I think puyi? Or something can’t remember,btohqsg
It’s not got another girl la,btohqsg
It’s work related & a content that the wife doesn’t know,btohqsg
But tbh which girl can accept hahaha,btohqsg
Puiyi brought the entire crew to sg leh,btohqsg
For not informing the wife upfront,btohqsg
But Cheryl also in the fault also for blasting,btohqsg
