text,group
I not happy with it now haha,btohqsg
So far i have 4 eating gatherings 😅,btohqsg
U go away  u extreme one. Lol,btohqsg
Then I stopped and rebounded all,btohqsg
What's your fasting and A1C score?,btohqsg
My friend in this group she can attest i m fat :(,btohqsg
Yes i need to train harder,btohqsg
My company is having buffet gathering on 5/12 n my frds want to eat steamboat next day,btohqsg
If u fat.. we all can step aside🤣,btohqsg
that’s why focus on sustainability  at a pace you can meet your goal but you dun have to suffer so bad till you will give up half way,btohqsg
U also see me before ma,btohqsg
Shit I lost the slip sia.,btohqsg
I nvr see ur belly. I dunno 🤣,btohqsg
I see ur photos u look ok la!,btohqsg
My target was beyonce before i met my bf,btohqsg
My target not possible to achieve,btohqsg
Now my target is to be healthier coz i see my bp reading i angry,btohqsg
So after U met ur bf become beyond target,btohqsg
Getting fat / slim is not about that one or two meals. So don't need to worry if your average monthly diet is still strong.,btohqsg
One or two won't kill U.JUST WHACK,btohqsg
I know but i don’t want to eat too much,btohqsg
