text,group
Okie. We go jb buy fake one,btohqsg
At least ppl step won't feel pain,btohqsg
Is Santarina a female Santa  or is it a Latino Santa,btohqsg
I seen fake Canon cameras in batam,btohqsg
How do we know that ? It sounds like a Mexicana Santa to me,btohqsg
number 1  ni zai na li?,btohqsg
later i come step ur shoe,btohqsg
step hard one is the massage center la.,btohqsg
that one is want your life type,btohqsg
👟 Adidas 👟🟢 UP TO 50% OFF + EXTRA 40% OFF Adidas🟡 Buy 3 for extra 40% off🟡 10% off vouchers available all day🟡 Spend $50 for a chance to win $70🟣 Ends 1 JunShop Now :https://bit.ly/3PQJ25j@sgcheapo#clothing#fitnessFor advertising  please contact@sgCheapo_adminon Telegram.,btohqsg
How does it go on top though?,btohqsg
the prius continued to bulldoze thru?,btohqsg
But Prius backside very big leh,btohqsg
How to mount such a big backside,btohqsg
prius not reverse bang the harrier leh,btohqsg
Too close then not crash and bonnet flatten mehHow come will go up? Like go slope up like that lol,btohqsg
Sorry ah Maybe I dun drive so I dun understand,btohqsg
The harrier is higher then the pirus.,btohqsg
Front car high  behind car lower.,btohqsg
He must have forgotten he was driving car not airplane and pressed the ejection button,btohqsg
Nowadays driving on the road is challenging. Many people take license already forgot all the rules.😂,btohqsg
no choice. nowadays signal lights are optional and cost a bomb to install.,btohqsg
he looks quite handsome and honest,btohqsg
ok.. later i go koufu eat the thai food then fr u,btohqsg
damn i feel like eating smelly tofu and the deep fried intestines,btohqsg
used to be walkable for me too,btohqsg
macpherson there got nice kway chup,btohqsg
Ü mean the famous prawn noodle opposite?,btohqsg
i dont think opposite it got any food eatery,btohqsg
yup a lot beside kway chup,btohqsg
Ok i think i know where liao,btohqsg
Or the axe brand oil building.,btohqsg
I think  owner change. After the renovation.,btohqsg
The seafood restaurant move to next door.,btohqsg
But hardly go there. Everytime just pass by only.😂,btohqsg
Along that stretch got 3 pet shop.,btohqsg
📸 Golden Village 📸🟢 FREE Selfie Studio Session🟡 w/ purchase of any 2 movie tickets🟣 Ends 30 JunLearn more:https://bit.ly/3t7EZYL@sgcheapo#entertainmentFor advertising  please contact@sgCheapo_adminon Telegram.,btohqsg
i buy from u 1 dola,btohqsg
apparently the standard now to get girl's number instead of asking ....,btohqsg
is to transfer money to them wrongly and ask them paynow bk,btohqsg
Hi  what is your paynow number for me to test?,btohqsg
cannot cannot later I every 5 minutes heart attack,btohqsg
Too romantic  keep giving you surprises.,btohqsg
Never see u at CV 😢,btohqsg
Tellme.ma.. I go stalk u 😳,btohqsg
At least say hello 👋 to you,btohqsg
send roses so u can vroom vroom into@thicclittlegirlheart,btohqsg
i pratical one i send chrysanthemum one,btohqsg
at least can cook chrysanthemum tea,btohqsg
bandung not so popular for diy,btohqsg
