text,group
cosplay style onesie enough la.. don't traumatize the poor labubus can,btohqsg
or they cosplay the crane machine 🤣,btohqsg
or chain the crane machine to their leg for 3 mths hahahah,btohqsg
don't torture the crane machine can.. uncle needs it to earn $$ one.. the crane machine already kena tipped over by them liao.. still wanna torture the machine some more,btohqsg
dress the 3 boys as labubu and send them around to all the hospitals' children's wards :D,btohqsg
4 hours per location  2 locations in a day  one time around the whole island,btohqsg
For those labubu things is it even worth it lolol smh,btohqsg
Maybe kena send to boys home,btohqsg
The men all evil too! Not only woman 🤣,btohqsg
What sleeping pill are you currently one?,btohqsg
Zopiclone. My mom has some extra so I've been using them periodically. Ran out of it le.,btohqsg
This one can report? The ingredient literally says sugar in English  and glucose fructose in chinese  but the importer dare to label the thing A grade. Not just this bottle  but all the bottle label this.,btohqsg
I drank 2 bottles Nia. Damn happy when I drank it.,btohqsg
Then realise no wonder I so happy,btohqsg
No wonder high in sugar rush,btohqsg
What food to recommend at suntec? Not too exp de.. probably less than $30per pax,btohqsg
Zopiclone only for short term use.You have depression?,btohqsg
No  from mama shop below my house,btohqsg
his mom's zopiclone bro. not his,btohqsg
Probably have depression  but I never go diagnose it. I scared cannot apply certain jobs after diagnosis,btohqsg
Oh. I thought it's he and his mum take the same pill,btohqsg
he sapu to take :D not prescribed to him,btohqsg
Go polyclinic if have depression.Their med n counsellor gd,btohqsg
Bro. Brain is just like any other organs. It can get sick and can recover.,btohqsg
There is no reason to reject your job application if you have made full recovery,btohqsg
No need to declare have depression bah when apply job,btohqsg
Cuz I consider sign on SPF or ICA mah  then those job require you to declare one. I NS SPF  so I roughly know the process abit.,btohqsg
If you mental health history  then high chance will reject cuz unfit to bear arms.,btohqsg
Even more important to get your body and mind in the right place to ensure personal and public safety.,btohqsg
Ever thot of go exercise to tired urself out? Can slp better?,btohqsg
Got exercise de. Cycling lor. Which is keeping my mood in check also.,btohqsg
@SongAzureBecause the alternative medication I was going to suggest for insomnia might worsen depression.,btohqsg
Ah I see. Then I better go get it checked. Medication conflict later hahahaha,btohqsg
Even i taking gaba.. wkends i dont take,btohqsg
Wah abit late reading this  but I think should be ok. I take every 2-3days @ 1/2 -1/3 pill each time.,btohqsg
For your insomnia  just try cetirizine.Most importantly  have a good sleep hygiene for long term solution.,btohqsg
I think ask him see doctor better,btohqsg
Wah  I think this one good. I have allergies also. Kill 2 birds with one stone,btohqsg
What is gd for us  may not be gd for everyone,btohqsg
Maybe your allergies keeping you awake. See a doc to properly diagnose the cause of insomnia.,btohqsg
我有相思病 need see which doctor 🙈,btohqsg
Enough to distract you from xiang si girl,btohqsg
See the nearest female doc who forgot to button up fully. 😔,btohqsg
I 相思 my future gf whom I have yet to meet 🤣🤣🤣🤣,btohqsg
I think you too lonely that's why,btohqsg
But i going office gym later,btohqsg
I thinking wanna go club not tonight hahahahahah,btohqsg
I damn long never go club,btohqsg
Same that’s why on and off must go see see,btohqsg
But zouk annoying sia they see mood one  sometime tattoo can go in sometime cannot,btohqsg
got once I pay go in Liao at counter drinking then bouncer come in ask me I working here or performer ? I say no ah I customer then he say tattoo cannot come in,btohqsg
Then he say nvm ask me wait here,btohqsg
Then he go awhile come back say nvm nvm,btohqsg
U ask him .. ur boss say tattoo cannot come in?,btohqsg
Their staff no tattoo de meh? 🤣,btohqsg
That’s why maybe staff or performers can lol,btohqsg
If me  i will feedback to their web..,btohqsg
ah I only go once a few months so I never bother,btohqsg
Your tats on which part of body? Maybe face one cannot.,btohqsg
No la lol just one arm sleeve,btohqsg
I look so guai guai one,btohqsg
Just like at mrt  the police always check on those with tattoo,btohqsg
But ok la 3 times all still got go in,btohqsg
2 times is my friend just pass me their jacket,btohqsg
The last time i went club was 2016?,btohqsg
Actually I think they scared mata come. That's y don't encourage patrons with tats to come in,btohqsg
it’s time to go again bro lol,btohqsg
Zouk get checked by mata very frequently,btohqsg
it’s time to shine again ~~~ zouk still ok,btohqsg
pub go do what huh lol I mean I hardly go so I dun really know,btohqsg
I went to f1 club at batam earlier this year,btohqsg
Drink and play games and sing lor,btohqsg
After zouk move to cq  i no go 🤣,btohqsg
ah okok  I usually 2 people go de so not as excited 🤣,btohqsg
ikr I miss the building that sell cheap alcohol,btohqsg
They sell one bottle like 30-40 ? I forgot,btohqsg
I almost want to go but uncle with me....,btohqsg
Then everyone park at one corner drink finding then go in,btohqsg
Bring your uncle go ~ 🤣,btohqsg
Can not.. bring him I can't enjoy,btohqsg
Definitely more happening than singapore ba,btohqsg
A club in Toronto we past by,btohqsg
Paik’s noodle I like their jajangmyeonTamoya udon & tempuraBig fish small fish cafeAston’sMonster curryMamma Mia,btohqsg
After 1am everyone go to the dance floor liao,btohqsg
I see their posters  wah so exciting,btohqsg
The waiter also quite good service,btohqsg
He gave us wifi to use,btohqsg
Was thinking this place can't be local 🤣,btohqsg
so far clubs in singapore I dunno lei  the nice nice ones all like gone Liao,btohqsg
Then nowadays the drip and cherry all like bad reviews,btohqsg
so left good old zouk 🙈,btohqsg
Just wanna go a pub  chill with a pint and sing,btohqsg
This club at my hotel there,btohqsg
Old liao  all the clubs you know all close liao,btohqsg
These clubs to happening  too old to tahan liao,btohqsg
Drink finish go back room rest,btohqsg
Can tah all u want bahahahaha,btohqsg
Oversea I only went to Japan and Taiwan club before,btohqsg
My friend’s friend keep 10 sec me,btohqsg
The drinks at there not cheap,btohqsg
He really want you to sleep early,btohqsg
1 bottle sgd 200 and above,btohqsg
That one is singapore club price Liao eh,btohqsg
Probably cos they import in ba,btohqsg
but Thailand later got bird bird one,btohqsg
1 tower less than sgd 30,btohqsg
ok la nowadays I also never drink Liao,btohqsg
I limit weekly at most once,btohqsg
They’re quite affordable won’t break the bank,btohqsg
you sure not? Very questionable leh haha,btohqsg
Last week only friday i drank,btohqsg
Wow u add ur list.. i read till tamoya only...tamoya is gd,btohqsg
Haha ya cuz I remembered there’s a few more affordable ones just couldn’t remember the names 😅,btohqsg
Limit ma if not keep gain weight,btohqsg
And i now doing more cardio,btohqsg
Does paik's jajangmyeon taste like authentic Korean jajangmyeon?,btohqsg
I foresee got 10+ bottles of wine,btohqsg
Hmmmm in a way I guess I’d say there’s more veggies and meat than you’d expect and large portions for the price paid… I spent about $10+,btohqsg
The broth here is almost identical to the one in Korea,btohqsg
Ok. Will go try it out. Very hard to find authentic taste Korean food,btohqsg
Same. Haha. Parents walking with their child,btohqsg
246 can get in ACS(I) ah,btohqsg
My meal also messed up lol,btohqsg
beef noodle and Mr bean soy done Liao,btohqsg
What are those gummies for ?,btohqsg
Really eat Liao good for body ah,btohqsg
For many purposes ie for sleeping  for hair etc,btohqsg
Lost 1 pool game to my intern,btohqsg
I wonder what goes in these gummies that give them the colour.,btohqsg
oh oki  I mean so far does it work ? If anyone tried for sometime,btohqsg
AF got some challenges going on,btohqsg
just found out recently that I think some red natural coloring comes from some insect 🙈,btohqsg
Got skipping and today got mountain climb,btohqsg
They were just discussing it this morning. I did not read though,btohqsg
Winner can win a pair of travel tix,btohqsg
I cannot jump lololol my leg still injured 😢 i other website see see you semo,btohqsg
apparently it’s some dried insect then they grind it down to powder become dye lol,btohqsg
Me thinking to walk to my doc clinic to buy med and then walk back…,btohqsg
Maybe do 30 mins some strength workout,btohqsg
Unichi hair gummy many ppl reviews gd,btohqsg
Where you see ? I couldn’t find it online,btohqsg
Eat Liao become hairy ? 🌝,btohqsg
Next time no food  really have to eat them,btohqsg
It’s ok I shall rip earlier,btohqsg
Hair boost…i cannot curse myself…so it will produce more hair isit?,btohqsg
ok I think tonight not a good day to club  woke up at 6am then now gym dun think I can last till 3am lol,btohqsg
you think i will still walk tomorrow ? 🤣 I be lying ded in bed,btohqsg
I hide in mountain too long Liao not good,btohqsg
is it like cig replacement ?,btohqsg
For moisturising de if not wrong,btohqsg
I saw from my gym ig,btohqsg
I have skincare products with this ingredient,btohqsg
Best is i can find combi,btohqsg
I am already taking ceramides supplements,btohqsg
i dun really like the taste,btohqsg
Guess only hair gummy is gd.. grape   guava taste,btohqsg
my nose hairs are growing at an alarming speed,btohqsg
Ok i think i buy ceramides supplements,btohqsg
nb my friend ah boy 19 years old he shoulder press heavier than me Liao 🙈 32.5kg damn it,btohqsg
then one dude beside me using 50kg dumbbell,btohqsg
Wah today u on pie diet ah?,btohqsg
He got good genes his body structure very nice,btohqsg
but his body proportion very nice Liao,btohqsg
But then how u know he is 19?,btohqsg
his frame also smaller so the height just right for him,btohqsg
Imo. For eczema  it's better to use soapless showering gel than jiak or bua ceramides,btohqsg
Wa. You also damn strong. 30kg.,btohqsg
What's your pb for dead lift?,btohqsg
my leg injured so now probably dropped le,btohqsg
145kg? I do 100kgs next few days jelly,btohqsg
Your pb for deadlift is 100kg???Strongwoman.,btohqsg
I am fat but my thighs not flabby type,btohqsg
I not powerlifter so I usually just 4 sets 8 reps then every 2 mths go up 5-10kg see see,btohqsg
so far 130kg can do 4set 5-6 reps,btohqsg
145 only 1 set 3 rep max,btohqsg
Guys usually stronger ie carry more weight,btohqsg
I just wanna strengthen my back,btohqsg
but girls can go anything 90kg and above is considered impressive Liao,btohqsg
I think this name even better than last time,btohqsg
Now i old liao…stamina not as good as before,btohqsg
i think u better stop taking ur mom's meds,btohqsg
I also hahahahah I rest two week then last week resume my whole face white sia after finishing my sets,btohqsg
So now i am doing more static workouts  more walks  hiit at times,btohqsg
my friend say your ancestor waving at you across Liao,btohqsg
for me I’m greedy haahah gonna push till I feel cannot Liao first,btohqsg
My frd who is a fitness instructor told me as we grow old  we cannot be doing strenuous workouts everyday…so diet plays a more important role.,btohqsg
Tonight i am going to cook dinner,btohqsg
Last time i also like that. Do back to back classes 2-3 a day,btohqsg
Got exercise or gym can already,btohqsg
oh I mean push in long term  nowadays I trying to cut short my sessions Liao,btohqsg
Anything more is just too tiring,btohqsg
yea 2 is very good Liao,btohqsg
Ya anything more than 2 hours is not helping,btohqsg
Unless you 20 years old hahahah,btohqsg
Then you can just go 5-6 hours no one cares hahahaha,btohqsg
1.5 hrs upper body / chest,btohqsg
U need to let ur muscles rest and recover,btohqsg
I hate this is true  I'm no where as flexible as I used to be  even tho mentally  I feel the same as the school kids when I see them on MRT.,btohqsg
I used to do 4-5 hours lol,btohqsg
But then one more to condition my body ba,btohqsg
My body now used to torture Liao hahahahahaa,btohqsg
I take protein   mass gainer and CREATINE,btohqsg
oh recently got take the pre workout cause free when I buy protein,btohqsg
I calculated now got sale 40% off actually okok,btohqsg
U know glucosamine cannot take long term?,btohqsg
So 60 serving about 90 bucks,btohqsg
Once ur body used to it  that’s it,btohqsg
that one is for joint thingy right,btohqsg
doc told me hor actually that thing depends on body de some people eat Liao no use one some eat Liao got use,btohqsg
Collagen is actually the one who will help with the joints,btohqsg
so expensive to stay healthy right,btohqsg
U need vitamin and minerals also. Forgot which one.,btohqsg
Bobian. I just spent $100+ on supplements,btohqsg
Vit c and cranberry for girls,btohqsg
I just eat fruits vegi and meat !,btohqsg
Recently kept appearing on my socials,btohqsg
I am taking this…the yam smell and taste so good,btohqsg
Yes too much proteins will cause kidney stones,btohqsg
I try my best to tar 4l water a day,btohqsg
that is the best supplement !,btohqsg
4l for me just right la,btohqsg
It's not expensive to be healthy. Supplements are non essential to healthy living if you are eating right and have a healthy lifestyle.@iugoddessis the best example. He is not on supplement and he is looking like Mr Universe.,btohqsg
she eat also dun tell you 🙈,btohqsg
No la where got mr universe,btohqsg
U don’t forget our water is also processed,btohqsg
Supplements was designed for imbalance diet and people with digestion and absorption issues such as elderly and IBS.,btohqsg
we all here elderly Liao 😢,btohqsg
Haha... Just sad to see capitalism and marketing perverse the original intentions of supplements.,btohqsg
but ok la I also only take if bobian,btohqsg
I am lazy to argue. Lol,btohqsg
Like i seldom eat orange and vit c stuffs so i will take vit c tablet,btohqsg
Then I have trouble eating a lot so protein and mass gainer,btohqsg
I want bigger meat meat so I take CREATINE,btohqsg
How many oranges u can eat in a day? Sugar lvl will shoot up,btohqsg
Oh no. Please don't argue. It's ok if you like your supplements and they are making you feel great.I am merely stating the original intentions of supplements.,btohqsg
I am taking it for the purest intention,btohqsg
I taking the recogen.. gd for joints,btohqsg
I probably need take something too XD,btohqsg
Need to take the type 2 then is gd i think,btohqsg
Getting too used to sore and pain in gym Liao lol,btohqsg
No pain no sore I feel my life not right,btohqsg
U remind me…i cut the fruits up but i forgot to tell my bf to take n eat from fridge,btohqsg
You reminds me to go do some pull ups and dips.Anyone here can do muscle up?,btohqsg
I can do but still need assist band 😢,btohqsg
I eat orange almost every wkdays.,btohqsg
My bf tell me to do pushups everyday,btohqsg
I struggle to stuff more food in me 😢,btohqsg
I only buy code 4012 oranges,btohqsg
Lol i struggle to put less in my mouth.,btohqsg
Told u liao i v choosy,btohqsg
If u cannot sleep at night  try peel orange…citrus helps with sleep,btohqsg
Restock lbb at pop mart 😂,btohqsg
When you do pull up. Do you do the full range motion (touch chest) or till neck above bar (NS version),btohqsg
I do assisted pull up for now,btohqsg
I love sour ! Bitter ! ♥️,btohqsg
With the bands or on the machine?,btohqsg
I do the wa how to say huh  wait I find,btohqsg
I do the I kiap my shoulder blade push down so my body will tilt backwards kind,btohqsg
I go as high as I can until I slowly cannot go as high then drop,btohqsg
But I trying out new one I use weights then I jump and hold there as long as I can then slowly come down and repeat,btohqsg
I think those lat pull down and such will help build strength do pull up also,btohqsg
pull up is my weak point I struggling also 😢,btohqsg
Recently i do assisted pull up and lat putdown,btohqsg
Oh. Do you mean you are doing negative pull up?,btohqsg
Yeah me too. Used to be able to do 10+ (NS version) But I stop working out for 1 year due to stuff. Now I can only do 8-10 normal pull up.Will take a long while to go back to 10+.,btohqsg
Last time i do 10+ pull ups too,btohqsg
Over the years become 0 fighter,btohqsg
My friend can do 20 to 30+. I don't even know how,btohqsg
Smaller size and light weight can do a lot,btohqsg
I wonder can buy supplements on amazon cheaper or not,btohqsg
Does your generation NS still need pull up? I think they cut it out of ippt some time back.,btohqsg
With a bit of training can pass easily,btohqsg
Ya lor. Kns. But it's to your benefit still,btohqsg
I never had to take ippt after i ord,btohqsg
I legit got very bad injury from ns,btohqsg
Good thing is no need ippt. Bad thing is no free money,btohqsg
I stopped exercising cos of this,btohqsg
The doc recommended me to stop exercising,btohqsg
Then better go easy on those heavy lifting and squats,btohqsg
But i dun feel any pain on my back,btohqsg
Just 2 years to look like that? You actually has good genes,btohqsg
On off i got stop a while,btohqsg
Cos got some period when i was very sick,btohqsg
Hahahaha glad I made it too 🤣,btohqsg
At most i stop 1 month,btohqsg
My aim now is to reduce weight,btohqsg
If i never drink now probably i quite lean liao,btohqsg
Cos i dun eat a lot one,btohqsg
Used to be a big eater but i cut down a lot,btohqsg
That’s why I started gym lol,btohqsg
Nowadays rice i also dun eat finish,btohqsg
Is just that now my upper body is satisfactory,btohqsg
So now i focus more on cardio all that,btohqsg
Wa still got this so good,btohqsg
Got the machine at my gym,btohqsg
Every month i take the reading,btohqsg
for me I just see visually hahah  I just need shoulder bigger and back thicker then I can just focus tonning Liao,btohqsg
ok la best gauge is mirror !,btohqsg
I only happy with my arms,btohqsg
I long time never do leg press,btohqsg
every leg day I cry mother cry father rolling on the floor suffering,btohqsg
After losing weight then i do back my leg press all that,btohqsg
I now more of skinny fat,btohqsg
The plate dropped on my toe that time,btohqsg
all these machines are good for progress tracking only.your body composition done with bioelectrical impedance is easily affected by daily routines like amount of water you drink,btohqsg
Best is dun eat or drink anything before u take,btohqsg
Ya but iherb must hit $60,btohqsg
Even Dexa and MRI has their issues ,btohqsg
U got use shopback? Think 1 to 2 days back got massive cashback,btohqsg
I did some gym back in 2022. I fractured a rib unknowingly while benching.during routine screening  saw a 1cm shadow in my lung. i thought GG liao.did a MRI  heng it was fractured rib. The whole health scare cost me about 1k,btohqsg
birthday month. dont like this. 😔,btohqsg
no la. business owner. unemployed myself when i want. employ again when i want again,btohqsg
ya. this year fractured the same rib again during a bicycle accident. so pause everything for 3 months to let it heal.,btohqsg
haiya. birthday month also wanna grill me,btohqsg
Is there anything u can do to prevent fracture?,btohqsg
go gai gai now. after nov / dec hell restart,btohqsg
Arbo? U want to fracture where else?,btohqsg
So shiok. Still can gai gai,btohqsg
healed fractures are never back to 100% original state. Best idea is not fracture it in the first place.otherwise strengthen the muscle around the bone is a good idea to prevent future injury.,btohqsg
recovered a month or 2 already. initially  even breathing will feel painful,btohqsg
Ya i understand that. Becoz of my kneecaps hurt and i know my legs are not strong  that why i did alot of leg strengthening. Esp muscles around my kneecaps. Sometimes it will have inflammation  it hurts to walk. That why now i am careful.,btohqsg
Now so hot to even walk out. Thought walking out to my doc…guess i wait for a while more,btohqsg
For knee  think dont do too much climb stairs? Wear n tear easily..My knee need to do keyhole surgery maybe next year..Provided my dvt have recover..,btohqsg
Climb stairs is ok but going down is killer,btohqsg
My colleague did kneecap surgery…she got hospitalised leave for 3 mths,btohqsg
Scare to go so long de leave,btohqsg
I feel u  like my shoulders recently then recovered but not fully,btohqsg
I got also some family history thingy  that why now all the more i am into taking care of health etc.,btohqsg
Ya that’s why better to start early to take care of health,btohqsg
I also dun regret started working out,btohqsg
At least won’t feel so lethargic,btohqsg
Some days i dragged myself to workout but after that i am so glad i did,btohqsg
Now i cannot live without perspiring,btohqsg
I watched some clips from ronaldo  he said he sometimes dislike going gym but he said he still have to go or do workouts haha,btohqsg
My last work out was in year 2021 or 2022  then i sprained my ankle.. i stop for sometime 😅,btohqsg
But sometimes due to my skin flare up  i couldn’t workout as i don’t want to trigger it further by perspiring,btohqsg
I regret working out 🤣 cause I became addicted Liao,btohqsg
you tear your ligament? P  L  M  or A?,btohqsg
Haha i also a bit addicted,btohqsg
I see dumb bells i happy,btohqsg
I tell myself just 30 mins,btohqsg
next time got gf go where ?,btohqsg
That’s why at age of 39 he still so fit,btohqsg
I join a group.. all fitness ppl there de,btohqsg
less than a mth ganna dumped Liao,btohqsg
I got join a fitness group too,btohqsg
Oh? Where where send me send me,btohqsg
Go workout tgt. My house got gym corner. Even my bf go gym  I encouraged him to go,btohqsg
I go find eat chicken breast de people hahahahaha,btohqsg
Haha the best time to go gym is after breakup!,btohqsg
Quite true.. and after work. Like ur boss say u.. go work out.. treat the target as ur boss n hit 🤣,btohqsg
Ya not happy ah  go gym!,btohqsg
I see nsc see till Sian Liao,btohqsg
sorry. the knee ligaments. LCL  ACL  PCL and MCL,btohqsg
They treat us like money trees,btohqsg
Irritating. Last time i don’t believe in diet will affect eczema but as i grow old  it does,btohqsg
I still dont get it 😅,btohqsg
Got discussions on diet/ workouts/ sports apparels for ladies,btohqsg
the knee surgery is for a torn ligament?,btohqsg
oh dear. this one is serious pain,btohqsg
That why i cut down on byproducts. Even bread is my fave. I also cut down.,btohqsg
byproducts. sounds like you are eating discarded organs from animal processing plants. 😂,btohqsg
Time to start our own fitness group Liao wahahahahhaaha,btohqsg
This is also long term issue right? Life time issue,btohqsg
that’s why I sick till Sian Liao hahahah inside can’t do anything ma so I gonna train my outside until cannot train Liao ! Revenge 🤣,btohqsg
I have a friend who is in cycling outdoor and spinning at home…has a heart issue which half of it is swollen  he has to take med until the end of his life. The doc said luckily he workout  if not he will die earlier,btohqsg
that’s why train train train ! wahahahaha,btohqsg
I have not seen him in person before,btohqsg
But you see his stomach before 🤣,btohqsg
Hahaha i ask him coz i know,btohqsg
One of the fitness instructors got his six pack not from gym but from surfing,btohqsg
When u slim down the 6 pack will appear,btohqsg
Ya just the fat conceal it,btohqsg
I want to be fit carebear,btohqsg
U can bulk until like roman reigns physique,btohqsg
I want small small waist Korean kind,btohqsg
Bros  I am 80+  how to and how fast I can lose till 65?,btohqsg
U mean niang niang qiang type,btohqsg
I’m actually close Liao lol but I dun like  waist too thick,btohqsg
I did lose till 70+ early this year,btohqsg
Cos starting is easy to lose weight  then ur weight will become stagnant,btohqsg
U clean ur head first  got urine…,btohqsg
Below that u need a lot of effort,btohqsg
You can do it bro. 💪,btohqsg
I dun advise fast lol unless really for something important,btohqsg
Yup one shot take one year supply de,btohqsg
True but also not true.How many packs depend on your gene. Some has 8  some 6  some 4 some none.Some Symmetrical  some asymmetrical,btohqsg
Yes but also i gain back some weight,btohqsg
Oh  I went blood sugar test and  I in pre-diabetic phase apparently. Doc never say I pre diabetic but implied to be so. That's why,btohqsg
Alot of people don’t believe my weight de,btohqsg
This one very hard to go away,btohqsg
Coz i am tall n look slimmer when i was weighing less,btohqsg
I wonder if those fat freeze will help or not,btohqsg
Wa then i need to go liao,btohqsg
I want to do after losing some weight,btohqsg
I keep seeing the fat freeze ads,btohqsg
Later ur ig will show up again 🤣,btohqsg
That why i gained back some weights,btohqsg
Either the collagen drinks or the fat freeze,btohqsg
Metabolism changed when u reach menopause,btohqsg
Ah but best slowly ease into it cause you need give your body time to adapt and adjust,btohqsg
My taobao keep suggesting some weight loss herbal product treatment. 35yuan only.,btohqsg
My friends keep saying i skinny but i am not leh,btohqsg
Bro. Take your time. You are not in a competition.Healthy and safely losing weight is about 0.5 to 1 kg per week bro. But more accurately should be in % body mass. Which is about 0.5% per week,btohqsg
Go for walks  do something u like…swimming or cycling,btohqsg
Anymore is losing alot of muscle instead,btohqsg
True as we grow old we need to retain muscles more,btohqsg
No carbs or low carbs will do?,btohqsg
I like friends who are into cycling or spinning…lol,btohqsg
Need to cut dwn.. dec many eating outings 🤣,btohqsg
It’s ok la as long as you own self happy can le  I also to the point honestly I dunno I small or big Liao hahahaha,btohqsg
My next 3 Fridays are packed,btohqsg
My last cycling session was back in may😅,btohqsg
