text,group
64 abit high .. If you trust the company you might consider to do a average down .. 😂,btohqsg
When master posted MT long term chart is down $1  why all still continue to buy?????Ask urself.It doesn’t mean it will go in a straight line down to $1  it will definitely have some bull traps and bear traps  toilet flush etc to get it down slowly.Its greed in you (and me) that we think  ‘oh correction is done  lets enter now’... So now when its really dipping to $1  how many actually turned away and worried to buy again? All are psychological effects.,btohqsg
When MT bull run don't see anyone complaining,btohqsg
Cut loss Often for past 2 weeks .. cut $1.48 to $1.42. Cut $1.31 to $1.25. Cut $1.26 to $1.18. Lost almost $2k,btohqsg
Yes .. when up and down all complain 😂😂😂,btohqsg
We also issuing buy calls.Just pure discussion ma,btohqsg
At least u didn’t lose $3k,btohqsg
If u didnt cut loss from 148 loss will be alot more,btohqsg
Before that I also cut from 1.93 to $1.79,btohqsg
Set SL set TP in between don't see,btohqsg
Drop to $1.50 and below then I buy abit,btohqsg
I’ve removed CY... we are all mature adults and should know when we keyed the submit button.  Do not blame anyone and always do your own due diligence... we are here to discuss and help one another to understand more for our trades and investment.We need to be positive and learn from our mistakes.Enjoy your evening and weekend...Admin,btohqsg
Wa buyong stocks is like some 200iq gambling sia,btohqsg
BBs dont want to play fair game. We only left with hindsight lol,btohqsg
I have 40000 shares avg $1.85,btohqsg
When u SL  price went deeper. U tell urself ‘heng I cut ah...’When u SL  price kena pump back. U tell urself ‘F  why i sell. Omg!’Again  psychological play. Stick to 1 vision  why u buy. Stick to it.,btohqsg
Anyway you must make your decision to hold or to cut loss,btohqsg
Sorry  after eating Mala xiang guo  i suddenly a lot of gas to release. Haha.,btohqsg
STA I lose $3 k I think . Cut at $1.51,btohqsg
He see admin he prata his words lol,btohqsg
Ya lor . If follow the call . Lose money . Just LL,btohqsg
Morning eat bread  no wonder today tio bao. Pay 十三幺 very expensive.,btohqsg
Weekend need to sleep more .. Come next week another war.. stay sane keep yourself healthy.. no health no wealth,btohqsg
I never follow this chat . Sometimes I come in. And I happen to see this sort,btohqsg
Cannot le. If my feel tells me the share going to sink . I will just cut .,btohqsg
Reits doing well this week anyone vested?,btohqsg
Lose money is part and parcel of the game,btohqsg
I've branched some into reits to hedge,btohqsg
Overall medtec I net win so cannot complain much,btohqsg
Net win also got its swings,btohqsg
Im in mit keppel dc and frasers logistics,btohqsg
Lendlease mostly. And a little cmt,btohqsg
Stable can look at Keppel infra trust also,btohqsg
My lendlease go big or go bome,btohqsg
Sell hse sell kidney all in,btohqsg
Ya I got $1100. Can cover abit if MT loss lol,btohqsg
Half in 😂😂 vested at 0.645,btohqsg
I heard resistance is around 735,btohqsg
See if u want to tp arnd there,btohqsg
Thank for the information .. maybe I q 0.73 to sell,btohqsg
Look like need to and wait it stable enter again mayb now have to eat plain roti liao,btohqsg
I mean me eat plain roti,btohqsg
not rubbing to mt holders but the monthly chart looks abit scary,btohqsg
anyone have proper entry price after the next cloud support at 95?,btohqsg
Today kek sim never get MT 101,btohqsg
Does anyone know why my friend cant join this grp chat.,btohqsg
After downloading Telegram ....the search heading cannot find SGX Penny stock discussion,btohqsg
Hopefully didn’t get la later many hate me,btohqsg
Bijoy John in my Facebook share list .. lol .. he mentioned to me last week vicplas will drop to 0.35 confirm ..,btohqsg
Last week VP is sitting on 50 cent above ..,btohqsg
I was like what a crazy fellow .. wahhaahaha,btohqsg
Today he sms me again on the Facebook link .. he got 0.350 today at VP !!,btohqsg
Ask him next week MT how much,btohqsg
He a god or genius ? He know will drop to that price,btohqsg
Share this out ..bijoy John !!!!,btohqsg
Any advice on VP... Should cut or hold?,btohqsg
If your trust the company then hold it ..,btohqsg
If not go buy a freezer first 😂,btohqsg
Honestly I'm shaken.. Clueless what to do now..hence seeking expert here to advice,btohqsg
buy on panic selling my fav haha,btohqsg
There is not expert lar .. do your homework and trust the company.. that it ..,btohqsg
What is your average price position?,btohqsg
0.575..i average a few time already ..last 2 day almost down 0.10..,btohqsg
How many lot you holding at ?,btohqsg
You average a few time still at 0.575 ? 😂😂 You must be bought around 6 series to 7 serie right ?,btohqsg
I dun see what's so funny at people's pain...offer advice if u can...ask so much n offer nothing,btohqsg
Yes I did.. And big holding in my portfolio,btohqsg
VP 32 support level....just pray hard don't break....,btohqsg
How to offer advise? I not an expert .. maybe you can share with us ..,btohqsg
I always thought to hold till the result next week. . But looking at the rate the price going down.. I'm really shaken,btohqsg
if lost greater than 20%  u can consider cut lost.,btohqsg
I am holding at my position at 0.405 .. I am waiting for next week result,btohqsg
I know how you feel  I am also blur now.,btohqsg
Reits if dunno what to buy can consider nikko am xj reit and lion-phillip s reit,btohqsg
I cut MT at 22% loss. Now feel no burden,btohqsg
Yeah.. Clueless why the price drop so badly these 2 day. If its above 0.4 I'm still OK.. But what happen these 2 days is intimidating,btohqsg
U got any razer? Looks stabilised at 1.7,btohqsg
Not trying to induce fear anything can happen in the stock market,btohqsg
Nobody know y it drop so much .. just like MT .,btohqsg
it break 52  tried to hold at 42 support level (couple of weeks back was resistance level)  break again and looking at 32...feel lost.....dyodd,btohqsg
VP can just go to 0.1 or 0.6 in one week time,btohqsg
You got to find a balance,btohqsg
End of the day it's still your money,btohqsg
When VP from 0.1 all the way up to 0.7 .. y no one ask y it go up so high ? 😂😂,btohqsg
But was drown by the bullish lots,btohqsg
Iszit ? When down eveyone ask y down .. 😂,btohqsg
He told me 1 week ago when VP sitting on 50 above,btohqsg
Bro alan I know you are vested and feeling bullish,btohqsg
He say VP confirm go down 0.35,btohqsg
But offer a neutral advice if possible,btohqsg
I don dare to offer any advise .. I only can say do homework and trust the company .. that all . 😂,btohqsg
Stand by freezer already .. wahhaahaha,btohqsg
Just SL on my Medtecs also,btohqsg
When you buy ask yourself why you buy in the first place,btohqsg
Then maybe you can get the answer to hold or to cut,btohqsg
Now alr like this. One more vaccine news and your medicals go longkang,btohqsg
We buy because of AH HENG !! 😂😂,btohqsg
Not trying to be overly optimistic already in this type of conditions,btohqsg
We should invite ah Heng come in here ..,btohqsg
Won't know what will happen next,btohqsg
Get temasek or gic to buy a stake lor,btohqsg
Replies to SGX queries dated 18 Sep 2020_Medtecs.pdf,btohqsg
Can’t understand the euphoria in VicplasClearly majority who boughtSee Pm to be posted on Instagram and prixe start to move. Don’t care what  just the next COVID theme and chase. Made good money along the wayWorse if late to the party now carrying baby and asking why and howIn search of reasons to hold because is too painful to cutOr rather the fear of cutting At low is the key reason for not cutting. Cannot stomach so much loss because is never prepared for it.All the talks about take care of downside and let the upside take care of itself. People do oppositeLook at upside and let downside take care of u instead,btohqsg
Biolidics is a better bet than Vicplas. At least they own the rights and productVicplas is manufacturer who has no IP and minimal bargaining powerThe hype about arrow. Loss making and in distress if not at times like this people will sell dirt cheap? Sellers also not dumbNot expected to contribute to results this year. They got 3 months factored into results but to no availTurnaround is not guaranteed as well tooAnd piping is a cash burn just how much.,btohqsg
Any idea will VP go up 0.42,btohqsg
Prehaps if we think with a clear head. -VP is a high risk “ investment” in the first place. A few cents penny stocks which was speculated to as high as 0.74 without a great earnings report. If it drop to 0.2X  it’s a possibility bcoz it’s still triple the price of pre-pandemic. So insisting on your faith of holding it out is consider a higher risk gamble. If it goes your way should BB decide to reverse their plan to up the price again  it’s purely bcoz of wat they wan & not wat the company result is worth.,btohqsg
Go there u won’t cut la u prob buy somemore since it so called hit support 345 and rebound. Going back 70!!!,btohqsg
MT is also a penny stocks starting as low as 0.03 pre-pandemic. But 100X profit in its last report does add significant value to its shares. If we feel the company has established itself greatly & the cmin 1-2 years results will be as good  investing your faith in it is more worth the “gamble.,btohqsg
