text,group
lols this week cannot see market haiz until thurs,btohqsg
I think pck will ask you go study soon Liao,btohqsg
I thought pck never study one,btohqsg
Why trump still don't give up,btohqsg
I have a degree in business lOL,btohqsg
Pcb is the one who studied,btohqsg
But pck earn more than pcb,btohqsg
Life is not about who is smarter,btohqsg
Life is about who can earn more,btohqsg
Street smart vs book smart lah,btohqsg
Got money what you say will turn you smart also,btohqsg
The secret lab boss also bo ta chek...also rich man now,btohqsg
Jack ma say shit can eat,btohqsg
Jack ma dunno hide where or got captured by ccp?,btohqsg
To work his staff like cows mah,btohqsg
then find way to retire them,btohqsg
So the goal is to become a boss?,btohqsg
Same la all customers are my boss also,btohqsg
That's why gem is a boss,btohqsg
BTC suddenly cui again even more,btohqsg
nope i nvr buy at all,btohqsg
The last I look one week returns still green leh,btohqsg
Don't kick me ah just sharing only,btohqsg
Wait till 20 can buy in,btohqsg
Ok la don't talk cryto here liao,btohqsg
have ah? i'm interested to learn leh,btohqsg
Last time people buy sell on group chat one,btohqsg
i dont know today announcement good or bad one,btohqsg
Not sure bro.I left like 2-3 years ago hahah,btohqsg
Should be one super active one la,btohqsg
People play all the alt coins,btohqsg
hard to tell sia so far i only know got BTC and ETH,btohqsg
the rest of the alt coin hardly hear before,btohqsg
Means you very late to the party Liao,btohqsg
Last time neo xrp so popular one,btohqsg
Xrp make many people rich also,btohqsg
Means your entry is 32500 area when rsi go to oversold. Let u high abit and let u smell almost 30kBall shrink,btohqsg
Even furion heard of dogecoin leh,btohqsg
lols this one i know is coined by elon musk one,btohqsg
Anyway you go youtube you will know lol,btohqsg
But no doubt he richest now,btohqsg
Man on the street hear before means jialat,btohqsg
Watch and time to short very soon,btohqsg
usually can double check  they react together,btohqsg
Artivision already trading  outside the triangle for the 3rd day. MACD still turning up. Lately cheap pennies being played up. I think it's time to move.,btohqsg
I want everyone to give me  🎁.,btohqsg
Great idea! I  will think about it. Lol,btohqsg
But why u post here to sell,btohqsg
Dk if furion trolling or rlly wanna buy,btohqsg
Type so long wait till Sian. Removed,btohqsg
Sell 1 banana here also removed,btohqsg
Or ask people help water plants,btohqsg
Everyday rain still need people water your plants,btohqsg
Why u so Heng go everywhere got bladder problem people,btohqsg
Bring more rubber band out next time give them,btohqsg
Put back in glass continue drink since maybe can’t tell difference,btohqsg
Lol furion kick the guy now he selling at huat😂,btohqsg
They will welcome him with open arms,btohqsg
Glad he found a suitable home,btohqsg
At least I give him some airtime,btohqsg
Wah wah who selling what 😂😂,btohqsg
Ya got smell can trade better,btohqsg
You sleep with his pillow can think how he think,btohqsg
U see Liao later vomit blood,btohqsg
Comes with mattress or not. Furion and the Pea,btohqsg
NotebookI think can buy thisNabeh SL,btohqsg
Furion is penny stock group influencer leh,btohqsg
Then I think his 2k leh,btohqsg
Sleep Liao can trade like him then got people buy,btohqsg
Taking orders for furion pillowFurion run to ikea and order 50 sets of pillow,btohqsg
Most importantly is can get back 10x the cost,btohqsg
Ok la goodnight joke for all,btohqsg
Apply hair wax then sleep then got enough odour,btohqsg
You rub your underbody on the pillow Lor. Promote as improve trading skills by inhaling,btohqsg
Smell Liao got counter name float out,btohqsg
I sell my com la who want,btohqsg
Bidding price start with $200? Ok I take the Alienware,btohqsg
I want sell my old one see anyone want buy at Alienware price so I can upgrade,btohqsg
Well if alien no takers  I can clear for you at $200. ;),btohqsg
Which type? Accessories or fengshui ones,btohqsg
Raw crystals  gems  energy tools  accessories  fengshui also have,btohqsg
U mine btc at nightU mine crystals in the day Ah,btohqsg
Haha 😂 no la.I do a lot of things ma :),btohqsg
Who want buy crystal can pm her.,btohqsg
Any lobang for alien ware laptop at $200?,btohqsg
I only want furion flavoured 😝,btohqsg
Pm her won’t get kick hor?😆,btohqsg
Good morning Hustlepeople !QOTD‘Never let your emotions overpower your intelligence. ‘– DrakeMy favoured counters for this period.(Posted last Wednesday and they have moved)- Vicplas ($0.250)  PanUnited ($0.285)  Thomson Medical ($0.050)  Biolidics ($0.30)  Halcyon ($0.320)Now  good to focus on the micros.Below started is Safe price to get imo   but should need to hold- ArionEnt ($0.010)  Artivision ($0.011) HS Optimus ($0.006)PS: Always remember to have a cut loss in place. This will be the big difference between a small loss and a big loss that can wipe you out.,btohqsg
Ntegrator will retrace today? I thinking of shorting cus the yeea s always the same one day up few day down then stagnant for months. Any thought thanks,btohqsg
Only this ways can I over my Ntegrator loses,btohqsg
As your mind have worried   u may sell half or more 1st if u still wish to hold,btohqsg
Risky move. I won’t make this trade. They broke out of the main resistance 10. Should rest . 10-11 for a while and if hold   more upside.It might even continue to move up. Depends on overall micro sentiments.I have tp so only wish all holders the best .,btohqsg
How come counters furion buy always got halt one?,btohqsg
Maybe u don't mentioned MT then it will chiong,btohqsg
Or maybe you can just dont comment since no substance,btohqsg
Dont worry  MT break down i will out of MT,btohqsg
You can continue to hold and pray,btohqsg
artivision daystill at w4but now is more ready to move up,btohqsg
Artivision is a buy at $0.011. ‘Compressed spring’ theory. 1 price and should be able to get if Q there and if they continue to range. Believe many have loaded already.$0.012 can only be taken down by BBs.Good luck to us.☎️ for Artivision BBs to show power💪🏼.,btohqsg
Yeah that's all I recalledMaybe yinda?,btohqsg
Yinda surely placement here and thereHalt happily,btohqsg
I saying what furion buy got halt lol,btohqsg
Maybe furion buy in anticipation of news,btohqsg
Usually acquirer's share px will drop,btohqsg
Every time my stock halt I shout takeover!Never happens,btohqsg
Arti at 60  not a buy call,btohqsg
Why you never buy hi p,btohqsg
12 Jan 2021Asian stocks looked set for a muted start Tuesday after U.S. stocks fell for the first time in five sessions with equity prices near all-time highs.The dollar strengthened against all its major peers.A slide in shares of technology giants weighed on the broader market Monday as investors grew wary of the potential for heightened regulation tied to the market’s most enduring winners.The riot  planned and discussed on social media  is expected to spur Congressional efforts to regulate big tech.Meanwhile  cyclical sectors such as financials and energy continued to edge higher Monday despite the broader market’s declines  a sign that those bets persisted.NIO jumped 6.4%  to $62.70  a record  after the electric-vehicle maker unveiled its fourth production model at its annual “NIO Day” Saturday.Eli Lilly shares jumped 11.7%  to $185.94  a high  after it said an experimental Alzheimer’s drug helped patients in a small trial.Federal Reserve officials see strong economic rebound  fanning talk of taper.SGX total securities market value climbs 21% y-o-y in December to $24.4 bilSGX RegCo considers consultation on  special purpose acquisition companies (Spacs)  given the current popularity of such a listing structure.OCBC launches solar panel consumer loan for landed property homeowners.  Each homeowner can borrow up to S$30 000 with a tenure of between one and five years to allow for greater flexibility on the repayment period.AEM offers to buy CEI at $1.15 per share or a mix of cash and new AEM shares.CapitaLand Retail China Trust divests entire interest in Wuhan entity which holds CapitaMall Minzhongleyuan for $52.6 milSIA considers offering first-ever dollar bonds to bolster liquidity.SIA says its total passenger capacity is expected to be at around 25% pre-Covid-19 levels in end-March 2021.Olam International opens SGD debt markets in 2021 with S$250 m subordinated perpetual securities with a distribution rate of 5.375% for the first five and a half years.The Ascott added a record of over 14 200 units across 71 properties globally for 2020 despite COVID-19.  Achieves 80% YoY growth in China with over 9 400 units secured in the country for 2020.Leader Environmental completed the acquisition of 100% of the shares in the capital of Bituo Environmental Technologies (Tianjin) Co.  Ltd  an environmental technology company specialising in municipal sludge treatment with nine patents covering different technologies and processes.This brief summary is not for circulation without consent.(Disclaimer: the above are subject to errors and omissions  pls refer to actual announcement for accurate details),btohqsg
Where did your number come from,btohqsg
Oil WTI holding strong above 52USD. SMM and Rex today,btohqsg
Up 1 pip i also happy,btohqsg
Okay bro. $0.011 if can get ok. My lots here too. Along the way up will sell OTOT,btohqsg
Yea micros must buy at base so 1 pip also win good,btohqsg
Ya otherwise contra players will be forced out tom at a loss,btohqsg
See what price Artivision open today will be the indication. they are fighting now 11 or 12,btohqsg
Have A Good Day everyone .,btohqsg
ARTIvision IF CAN HOLD GOOD. PREPARE TO HOLD TILL END OF THE MONTH,btohqsg
Anyone still in Asiatic? Price cannot move,btohqsg
BB of imperium crown where are u? Please come in 🙏🙏🙏,btohqsg
LOAD MT ! TODAY BREAK 110 CONVICINGLY,btohqsg
Nutryfarm pick durian.It n fruit related business.👍,btohqsg
LOAD MT! TW MT LIMIT UP 10%!,btohqsg
Long time since I hear limit up tw,btohqsg
MT someone one shot 100 lots,btohqsg
Sgx  good news bad news no different,btohqsg
Okay thanks. I just wondering if got catalyst to limit up,btohqsg
Which we hope it dont happen,btohqsg
waaa leader env dk why still can move ...,btohqsg
Polaris mange to get at 5 please rocket to 10 Chiong ah,btohqsg
Mostly collecting at 109 since yesterday,btohqsg
Polaris gogo soon 6 will get snatch up,btohqsg
Moya walls are thinner  got chance to conquer 80,btohqsg
HSO  Shen Yao and Arion Lai pls. Paging bb.,btohqsg
If break up should be able to reach 1.25 to 1.3,btohqsg
Bought some V2Y $0.051. 😁 DYODD,btohqsg
MT TW limit up? Expect MT to fly,btohqsg
Hope so  but sgx seldom folo tw,btohqsg
SgYuancan i get alset chart pls. Thank you,btohqsg
Place holding coming soon. Follow V2Y,btohqsg
Adventus  anyone get it  I'm jeep liao ,btohqsg
Go go go adventures A series,btohqsg
earlier i got some for fun 200 lots 0.020,btohqsg
Asian Healthcare does looks ready. Looks like BBs have lined the Q. Lets see. Good luck to us who are vested.,btohqsg
today got bites into Artivision 12 Q. interesting. Lets see,btohqsg
Nice! Looking real good. Above all the MA  macd up.,btohqsg
Same but I jeep for earn hard earn copi money,btohqsg
Dialing for Artivision BBs  Please do us a good deed. Got a feeling  you guys gonna perform today.,btohqsg
Bought some IPS 0.085. Good luck DYODD. Price looks maintained after it broke out from downtrend line.,btohqsg
Arti one mouth eat 12 pls. Eat 3k lot not enough,btohqsg
Gloves rally Malaysia lockdown by Agong 👍,btohqsg
Flash News: Malaysia Declares State of Emergency(Bloomberg) -- Malaysia’s king declared a state of emergency in the Southeast Asian nation  in a move that could allow the embattled government to delay elections as it tackles the worsening coronavirus pandemic. “His Royal Majesty has given consent for the declaration ofemergency to be carried out as a proactive measure to contain the Covid-19 pandemic ” said the palace in a statement on Tuesday.The move comes amid infighting within Malaysia’s largest ruling party  the United Malays National Organisation  on whether or not to hold a snap election by March. UMNO isexpected to make a final decision on the matter during its general assembly on Jan. 31.Muhyiddin has maintained that an election should only be held after the coronavirus is under control. Signs point to the pandemic worsening: daily infections climbed to a record for twostraight days last week  pushing the health system to breaking point.,btohqsg
Msia lockdown MT still not moving,btohqsg
There are buyers in COSCO 305.,btohqsg
Alset today look better after yesterday correction,btohqsg
Vicplas retraced and now sitting at Support level. Added some $0.285. Believe they should move up after resting.,btohqsg
Jt bb first one run  not a good sign  kns,btohqsg
You earn till blur 😆😆😆 congrats,btohqsg
Who so daring eat arti 12,btohqsg
should be BBs or some real crazy or daring retailers..,btohqsg
Paging the place BB. One mouth 41.,btohqsg
Is there a Polaris play? Been holding 5 since nov  what’s ur tp?,btohqsg
Telsa should be bye bye liao,btohqsg
Is ISDN ready for next leg up?,btohqsg
LOL this isdn BB push too fast liao,btohqsg
yea whats up with them. getting impatient 😡,btohqsg
So they insert the tube into their nose?,btohqsg
Not his new company. More like people misread his tweet and go buy this stock,btohqsg
Slow lehCan't you see I am implying furion is a gorilla,btohqsg
So he meant the messaging app signal,btohqsg
He's not lah. He's more like TRex,btohqsg
Maybe Jack Ma came to sg,btohqsg
mouth come out a name all chiong to buy,btohqsg
dont need extradition treaty to bring him back,btohqsg
maybe deal is near for japfa,btohqsg
Haha got effect. Last time post about ETC and Hiap Tong   immediate buy up,btohqsg
GEM can add etc to the list,btohqsg
Which did u use to short ah...the platform n type of short,btohqsg
Buy MT must have patience and strong heart ❤,btohqsg
Isdn: Have a feeling bb wants to break 61 and build base there for $1,btohqsg
Your tp like than bank tp for isdn,btohqsg
If i don't understand what is TD  I prob should not try. Though it's tempting to short tsla😂Stick to sgx,btohqsg
This is you and Auntie Sky ah@luckyboy91,btohqsg
Match me with mich jie jie better leh,btohqsg
go buy some crystals gold diamond and zabalang first,btohqsg
Waiting for her to help me do palm reading,btohqsg
Mich is taken lah... U also know de,btohqsg
But due to covid no close contact,btohqsg
Clear weak holder .January best month for stock .Jan effect .Invest,btohqsg
The past couple of weeks have been great for the markets. Overall Market feels kind of weak now. Need to be more selective and nimble. Be careful guys.,btohqsg
q 205  but nobody wants to sell me...😞,btohqsg
Rem to have SL in place too!,btohqsg
HPH for Long Term  contra players please dont play ar.,btohqsg
Wah 22 drop to 9 cents also very spectacular,btohqsg
V2y.  Looking for a run up too,btohqsg
every smart investor will buy and get the tax free Diviends,btohqsg
Wah will it up 10% in USD? 😆😆😆,btohqsg
Looks like running huge up soon anytime,btohqsg
0.22 they also want to clear today? 😳😳😳,btohqsg
quality holders all the way to 0.40 USD first goal then 0.66 USD,btohqsg
Do keep Vividthree ($0.161) and Asian Healthcare ($0.200) in your watchlist. Looks like they might get some action in the coming weeks. DYODD and those in the money should OTOT. Overall market getting tougher already. Need to protect your hard earned money always 👍,btohqsg
Bought some Vicplas 280. Coz it sometimes moves with idsn. Haha. Pray,btohqsg
Any idea what is the target price for Asian health care ? 🤔🤔,btohqsg
Added back more Vicplas $0.280. I believe this new R/S should hold.,btohqsg
Maybe next time King Kong also wear masks  MT up! 😝,btohqsg
Cosco one mouth 30.5 all gone,btohqsg
What goes down will go up what goes up will come down.Read their company profile.👍,btohqsg
For Asian Healthcare  the play will get interesting after 0.20. See what BBs want to do. expecting more play this couple weeks. Same for vv3,btohqsg
MT back to 108 109. 😆,btohqsg
Pray afternoon medical stocks rally 😆,btohqsg
For those who believe in Cosco  should know that HPH is so much profitable position,btohqsg
MT & UMS sama pattern  all medical cheong MT still sleeping  all tech stock cheong UMS oso cant move,btohqsg
i have alot more to share but i dont know how to upload properly,btohqsg
Panunited will flush. can $0.305 if can collect during the flush should be good.ron leeyou tp yesterday yea,btohqsg
Still waiting here patiently to say this about Artivision.,btohqsg
AHC 200/205 now. Wow Dax! 😆,btohqsg
more people looking at this one now. the chart looking better i reckon. it gets alive 200 and above. i got some 190 last week. am tempted to take some profit. .,btohqsg
Cha Cha so long at 22,btohqsg
Wow big buy up LB 23,btohqsg
Slowly coming back up after shaking off weak hands I think,btohqsg
Wall form at 24 and 25 for lb,btohqsg
Sell wall reduced from 10m to now 7m,btohqsg
i sold down 60 lots $0.20 to test and tp some. the buying counter party is ifast and cimb,btohqsg
Yes bro. I buy 111 small small position try. Haha,btohqsg
Sorry I am not pro enough to interpret the significance. Can tell me pls? Thanks,btohqsg
Which wave are we in? Not wc?,btohqsg
Oh  thanks. So gd chance up? 😆,btohqsg
just provide some info. for me  i also dont bother about who is buying.,btohqsg
We sold isdn too early 😂 sianz max haha,btohqsg
Buy again same here I sold at 5 series now squeeze and buy again 6 series,btohqsg
Yalo I think more than 10% lo,btohqsg
Oh u too ah.. I sold at 53,btohqsg
Wah u chasing ah.. Dun think wanna chase leh,btohqsg
ya i sold at 57  tot already overbought and will buy the dip  in the end  kena pwnz,btohqsg
Bro ifast might be me🤣I bought 50 lots thru fsm one at 0.2 which they might indicate as ifast😂... NOT sure tho💪,btohqsg
this is good. wonder why it did not trigger its baby bro VV3.,btohqsg
Small small only just try bro.... But please dyodd...,btohqsg
Haha no dip I think.. No chance for this runaway train 🙊,btohqsg
Yea.. Good luck I think u will huat more 👍🚀,btohqsg
Sun power... Good run now NO power... 👀,btohqsg
This is a pure rotational game by the BB... Like musical  chairs,btohqsg
HPH usd is played by MS  BB,btohqsg
Wow 500lots bought at 21.5! Power,btohqsg
Bb playing lb sell queue again.,btohqsg
Sell queue 20m at 0.020. 🤣,btohqsg
Haha  I was just about to say where got. 😆,btohqsg
I too late to get 22. Thinking 23 now.,btohqsg
They started buying up 23  hope it prevails 🙏🙏🙏,btohqsg
Been watching these few days. Just don’t know will it be today.,btohqsg
Lol dbs vics Cs lousy....waiting time so long,btohqsg
What do you need to ask?,btohqsg
Problem now my funds stuck and in Asia micro. 🤣,btohqsg
Maybe it's a sign I shouldn't chase?,btohqsg
Or maybe they go jiak lunch le,btohqsg
You mean other religions not disciplined?,btohqsg
Yes. You Christian Right? Must hv self control leh. 🙏🙏,btohqsg
You mean other religions no self control?,btohqsg
I am just writing to him  why you need to twist it leh? Haiz,btohqsg
Ok la religion sensitive issue but just curious why you mention christian ma,btohqsg
This kind of sensitive issues I won't joke one,btohqsg
Yea   respect all religion and no discussion in religion too thanks.,btohqsg
I assume 5/1 is T06/1 also can be new T0,btohqsg
Big volume days can assume so,btohqsg
MT t2 today. Maybe need rest 1-2 more days,btohqsg
Sunpower huge dividend coming up but dunno when.. all waiting,btohqsg
Yup that's right they sold part of their business,btohqsg
The dividend per share looks crazy high  but dunno how it will actually pan out,btohqsg
Something like 20c if NOT wrong... I guess after dividend share price will drop by same amount,btohqsg
Think soon. Now 107-8 support just wait for after t4,btohqsg
Cant wrap my head around it lol,btohqsg
The amt of dividend per share Relative to the current share price,btohqsg
Don’t expect the yield to sustain,btohqsg
One off and recurring div is valued differently,btohqsg
U sell your house and take money celebrate and feel richDo u have a house to sell every yearIf not then will u splurge like if you have same inflow every year,btohqsg
Sianz the 3 musketeer no movements.... Ums AEM French Chicken(frencken) or maybe like the gurus will say consolidation 👽👽👽,btohqsg
Add value a scrapped right issue,btohqsg
vicplas daylong lower wickgood signw4 280 must ne supportedthen w5 come,btohqsg
Can I check something.If my CDP have 5000 shares.I buy another 8000 shares 2 days ago.Can I sell contra 13000 shares?Or need to sell separately?Sell contra 8000 shares and normal sell 5000 shares?,btohqsg
You can sell total in one trade,btohqsg
Do I need to click “sell contra” ?,btohqsg
I just sell under cash leh. I don’t know your platform,btohqsg
Can I check something? If I bought same stock 2 time on same day. The trading fees is calculate per trading or lump sum for dbs vickers?,btohqsg
My platform is ocbc I just sell under cash account they will take from my contra n not enough from my cdp,btohqsg
Just click Contra Sell  the buy limit may not restore which requires you to call and inform your brokers at times.,btohqsg
If same type then lump sum,btohqsg
Cfm with u if buy stock on monday need pay up by friday evening is it?,btohqsg
Someone keep pressing down SMM. Wonder what's cooking,btohqsg
Vicplas coming back strongly. Hope can cross 30,btohqsg
Just checked with broker:If my CDP have 5000 shares.I buy another 8000 shares 2 days ago.I can execute “contra sell” for 10000 shares. System will sell 8000 shares then balance draw from cdp account.,btohqsg
This one I also just confirm with my broker.Amalgation for same type transaction for a day.,btohqsg
haha is all about limitDanny Lee,btohqsg
Sell Vs Sell ContraSell will not restore your Limit for BuySell Contra will restore your limit for buy.,btohqsg
I think sell and sell contra will double charge commission.. not v sure,btohqsg
Thanks bro!I’ve been wondering for damn long but lazy to check. 🙏🏼🙏🏼,btohqsg
just do one time can liao  no such thing as double charge,btohqsg
Sbs nice leh. The chart very sweee,btohqsg
Bro you sold Asian health care off ? 😂😂,btohqsg
"The key word ""same type"". same day same stock same payment type is 1x commission. same day same stock different payment modes (Cash/CPF/SRS) then comm is charged for each payment modee.g. buy 10000 shares Sinktel using Cash  then buy another 5000 Sinktel using CPF on the same day. comm is charged 2x",btohqsg
Why. U 1.11 den chase ah?,btohqsg
How you know what price I buy,btohqsg
MT MUST CLEAR 110 IF NOT NOT SAFE!,btohqsg
We know we know. Coming since yesterday already  relax don’t need caps,btohqsg
steady labuyer waiting ppl to unload finish,btohqsg
SMM power one mouth eat up .164,btohqsg
Go go go. Big boys inside,btohqsg
I very long buy MT one time let me huat leh,btohqsg
Lifebrandz 23 sell queue got 10mil. I think you all seldom sell 10mil. Later 23 should clear.... Let's see...,btohqsg
If ISDN break high VP will follow bor,btohqsg
SMM .166 one mouth cleared .165 again,btohqsg
Give that guy MT 1.11 that he wants!!,btohqsg
If buy 105  already earned something haha,btohqsg
Hope UG can break $0.70 this week,btohqsg
Come MT eat slowly 10k 20k,btohqsg
they hv business in singapore and SEA.,btohqsg
Bite upsized to 50k  next bite 100k?,btohqsg
Lai do it for me can,btohqsg
ISDN about to charge up again? No more selling at 63.5c,btohqsg
ISDN & UMS go go go!!!,btohqsg
Isdn LB mT Rex all superb today,btohqsg
Even there is selling it’s well absorbent,btohqsg
I only can say why my samko so weak hahaha,btohqsg
But still cheer for u all,btohqsg
Avarga never bring samko up meh,btohqsg
Dialing for LB  VP  HSO  ARTIViSION  ArionEnt BBs. Let’s go 🙏🏻🙏🏻🙏🏻,btohqsg
Lifebrandz looks like it’s coming . $0.023 have buyers. Can get $0.023 for this period should be quite safe. DYODD.If run  OTOT can take profits too.,btohqsg
Add value to Chiong Liao rocket to 30,btohqsg
LB rocket will be superb  throw anything also absorb,btohqsg
wow.. cleared 2 n 3 😱,btohqsg
This one need to hold I think. 🤣,btohqsg
2 possible get just now ah,btohqsg
If buy 100 lot ok la $300 only lol,btohqsg
Ya hahaha. Still can afford. 🤣,btohqsg
Ya dats why I dare to buy. 😂,btohqsg
But the wall at 4. 😱,btohqsg
Added some this morning at 85,btohqsg
Get at 2 then can earn ba,btohqsg
JT and Cement BB buy q top up start work liao💪,btohqsg
If 3 likely need hold one,btohqsg
sui another one mouth jt 87,btohqsg
87 going to one mouth again?,btohqsg
Bot some JT  go pass 9 this time?,btohqsg
Congratz cover loss for ur alset,btohqsg
