text,group
think last time i saw it,btohqsg
You listen to her voice can stand ?,btohqsg
Good . I think Jerry bro cannot stand when she listen her voice,btohqsg
this one fast hand fast leg,btohqsg
Of not ask Eva give you 1bottle,btohqsg
US so many .. You do your own study ah,btohqsg
老母鸡？ good for tonic soup Ah,btohqsg
Ohh okok  I thought u shorted vix lol 😂 I was wondering got such etf or stock,btohqsg
Vix short ah....I not so big balls,btohqsg
My balls shrink when I see vix futures,btohqsg
She go Myanmar Yangon one !!,btohqsg
Confirm yoma and ix going up,btohqsg
all the bbfa so fast follow here ah,btohqsg
later her followers from 100+ become 5k+,btohqsg
Walau this kind...she confirm chio and rich when she younger,btohqsg
when she younger looks buey pai,btohqsg
bros  pardon my noobness  how do we know if a result will be out for any stock? i recall see a calendar thingy... on investingnote? TIA.,btohqsg
lai all the bbfa go dig,btohqsg
Not yet .. married can divorce want leh,btohqsg
Knn this place become another edmw,btohqsg
You still can stand can Liao,btohqsg
Who still can stand .. can stand a chance too,btohqsg
UOL Group posts 97% drop in FY2020 net profithttps://ift.tt/3bMvULwFebruary 26  2021 at 05:55PM,btohqsg
All confirm still can stand .. only stand how long only,btohqsg
Wonder who added me on FB...So she's the one 😂😂😂😂,btohqsg
Y lose Chor ? Which counter ?,btohqsg
Insta is not open. It’s stalking haha,btohqsg
If In doubt whether the pics are allowed can pm me to get through,btohqsg
means you get to see all the pictures first,btohqsg
go eat china food  drink china beer,btohqsg
i refuse to cut on a down day!,btohqsg
Ya... i think will drop to 7 series... bb let it go  let it go tgt lor,btohqsg
can keep dropping non stop meh,btohqsg
Sub Penny earn 17.5Mil on q4 still got selldown,btohqsg
Next week try again and huat ar,btohqsg
But I don't expect the punishment though.. They did delivered,btohqsg
Sub Penny got this kind of performance still kanna badly,btohqsg
the last time not like this though,btohqsg
the last one give you one good one,btohqsg
Bb also wont touch jt let it slowly die,btohqsg
Until nobody mention then collect again lor,btohqsg
How come Jerry haven’t quit yet since JT died,btohqsg
Bad sentiment la... all SL ... dam it!,btohqsg
you ask to ask how then you say how i know,btohqsg
U hope no news out lol,btohqsg
U askDoesn’t mean I got answer,btohqsg
I back up you .. no worry.. 有我在,btohqsg
Need real institutional buyer for JT,btohqsg
Is a casualty of oil. Know long ago,btohqsg
They benefit from low oil in raw materials methanol,btohqsg
