text,group
Haven't seen this guy on TV long time ah... But maybe cos I no time watch tv,btohqsg
ecco dibyenduhas been banned! Reason:CAS ban.,btohqsg
Then i no time watching tv after CB...,btohqsg
Knn.. CB was the gd times....i love CB ah...,btohqsg
I get to sleep  get to cook  get to watch mkt....,btohqsg
Sg TP GTA chase.. hardly seen ah,btohqsg
If sg try this.. then mediacorp still got hope,btohqsg
U come up with a MChan ah😂,btohqsg
COVID 24 on it way 🤣,btohqsg
But the pic. The car like sure gone...,btohqsg
Charging ev . Half way kanna fire  how .. lolz,btohqsg
This is a problem . Coming soon,btohqsg
Then zhabor panic.. ask u if tio how...,btohqsg
Father say . No my problem how ?,btohqsg
When the new EV charging points built in ur carpark start to function dun park too near to the cars charging there lol,btohqsg
So much money.. wats a mil😂,btohqsg
Boxter.. no wonder red roof so fast gone...,btohqsg
718 . Burn till 7788 Liao,btohqsg
like fire cracker if u see the video,btohqsg
"AI could replace 80% of jobs in next few years: AGI guru""Pretty much every job involving paperwork should be automatable "" says US-Brazilian researcher Ben Goertzel.https://bt.sg/5H7q",btohqsg
Just throw away and buy new want la,btohqsg
Oh not worth to repair ah? Mine is lojel brand,btohqsg
Just throw . Buy new want better,btohqsg
200 . Easy la . Monday you short 1 counter can cover Liao,btohqsg
Just a small issues of luggage you repairs for what,btohqsg
Y you want to f me . I scared pian,btohqsg
I know lugage i short 1 counter can cover. But ah. Sentimental value,btohqsg
Not meh ? 200 alot ? You still have to bring the luggage down and take back .. transport fee all this wasted ..,btohqsg
See 1 short and cover .. sentimental . Then keep it don use loh .. keep forever ..,btohqsg
Knn .. a luggage talk unit like want to keep for life .. don use it just keep .,btohqsg
Saw this too .. but shag,btohqsg
News say electric car .. maybe golf club car inside ?,btohqsg
i dun read ST many many yrs liao,btohqsg
looks like there is a golf cart burn down frame beside it,btohqsg
0207 my office number buy some try try,btohqsg
last yr n tis yr open 3x liao leh,btohqsg
Like this hard leh.. unless u got same model wheel,btohqsg
That y I ask her to throw away better .,btohqsg
Hw fire even get so big sia,btohqsg
Crowd for Blackpink concertSingapore Sports Hub🚇Nearest MRT station: Stadium,btohqsg
Johnleecome here can see all the pink xmm,btohqsg
2nd hand tic sellin hot cakes lol,btohqsg
I have .. you want ?,btohqsg
U selling ticket too ? Lolzz,btohqsg
You don f me can Liao .. finger me ok can ..,btohqsg
My bf and i at bugis now,btohqsg
I wait for 5 min .. my take over coming soon .,btohqsg
Want me to take q number for you,btohqsg
Woman Claimed a Cup of Iced Water Cost $1.40 in Amoy Street Food CentreShe even posted an image of the stall.👉https://goodyfeed.com/ice-water-amoy-street/,btohqsg
You reach Liao buay .. I wait till flower all drop Liao,btohqsg
