text,group
I holding a few k lots in custodian acct since you called some months back .. can?,btohqsg
Tiger pledge their shares for margin?,btohqsg
Company cannot pledge own shares for margin. But many directors do pledge company shares for own margin.,btohqsg
Supported yesterday. Now I can only wait. 🙏🏼🙏🏼🙏🏼,btohqsg
Me too. I have bought some as well.,btohqsg
Haha mine in tiger. Nvm la. I too many micros. Loll,btohqsg
Hope micros all come together 🙏🏻 play micros mostly need to have holding power . Do note yea,btohqsg
Can also sis  as long as not trading lots is fine. As long as bought up,btohqsg
Can Standchart accounts participate in this too?,btohqsg
Recently people were wondering about tiger/moomoo if the are safe to use,btohqsg
According to this site  your holdings are safe with the custodian,btohqsg
Master DaxMay I know why must in CDP?,btohqsg
As long as bought up shares is fine,btohqsg
Bought up is fine bro . Pai Seh,btohqsg
Johnleeyou try this before Bo ?,btohqsg
I have kena once fews yr back ..End up my case loss.. fed up,btohqsg
You kanna ? Bang the wall?,btohqsg
Yup.. I reverse wanna go in the slot.. this unlce go in my slot bang my car back..,btohqsg
Same as this video ? You reverse ? Than another car go in ?,btohqsg
Move over 1 st day of new yr.. the 4 of them come out the car scolded me..,btohqsg
But this unlce reverse fast then me. Cos the car go off.. ask me wait.. but the car owner don’t do waitress,btohqsg
Is the morale of the story... Don't ever depend on government for anything important...?,btohqsg
You never whack him ? 😝,btohqsg
Cheriethanks for letting me know this lobang! Quite fun,btohqsg
The haunted house was good to let out any accumulated stress in this covid times,btohqsg
I see master Yuan chart. PROGEN still can up.,btohqsg
Bro this 5 commission free trade .. meaning buy Liao and sell for 1 stock is considered 1 trade ?,btohqsg
Buy is 1 trade   sell is 1 trade,btohqsg
Especially if you are doing a big trade...,btohqsg
20k sgd.. fee would be about 40 dollars...,btohqsg
How u get it? What promo?,btohqsg
@InMoiHeartShannon  may I know which vaccine your mum took?,btohqsg
My neighbour took 3rd jab before 6 months....,btohqsg
No lah  ok leh. But I'm thinking if after 6 mths still got antibodies  maybe want to drag 7-8 months then take 3rd jab,btohqsg
Else later they say 6 months later 4th jab... the sooner we take  the earlier the next one,btohqsg
I heard Moderna antibodies last longer  so I have some friends took Pfizer previously  going for Moderna as booster,btohqsg
Now 30 years old and above can walk in for booster jab,btohqsg
McLarenRaffles city convention hall using Sinovac now,btohqsg
Next month my second jap six months liao,btohqsg
Are you going to take booster?,btohqsg
Donno how I get also .. auto received 😂,btohqsg
Maybe u big customer  so got free trades,btohqsg
No leh .. I small small only . 😔😔,btohqsg
You small small is big to us,btohqsg
I thought so too  sooner or later become yearly affair to jab,btohqsg
Wait you take Liao . Your 6 pack become more fats how ?,btohqsg
My two jabs no feeling no side effects lol,btohqsg
I also tell my mum take her time slowly go,btohqsg
Small leh . Really .. small Nia,btohqsg
So. The vaccine no use Liao . Must have side effects then got use ..lolz,btohqsg
Yes  yes  try take lesser jab,btohqsg
They inject grape water on you maybe 😂,btohqsg
If like that  all the man dare not go liao,btohqsg
Desmond the pack almost no more Liao 😂,btohqsg
Last night I wanted to paynow u in my dream  cannot find your hp number,btohqsg
Yes lolBecause recently I ate a lot hehe,btohqsg
Never mind . Pay now me now . Still have 40 min before my bday end,btohqsg
How's about u  tummy still there?,btohqsg
Yes . I am building it high up 😂,btohqsg
No hp number how to paynow,btohqsg
Your skin so smooth  use what skincare product ah?,btohqsg
But on gov side  they keeping track based on last vac ? If too long  status become unvac ?,btohqsg
Get from Desmond ..ask him paynow me also,btohqsg
Just drag 1 or 2 months at most,btohqsg
My skin where got smooth ?,btohqsg
You give me lah  why ask here ask there,btohqsg
I didn’t save Maclaren number…because I was so sad when the bird died…,btohqsg
If he wants  he will give me... He doesn't want to give me lah,btohqsg
Who want to pay now me ? Can pay NOW !!!!!! 🥰,btohqsg
I was scared telegrams you to call me at times …I forgot to save yr number…,btohqsg
Remembered  I text you many times because I was scared and sad…,btohqsg
Knn .. check your bird deaths day ..the record history on your call 😂,btohqsg
I met Maclaren at his shop handsome young man,btohqsg
Don say so much . Pay now my my bday present 😂,btohqsg
You need paynow Desmond first  because his bd before you,btohqsg
Over Liao . Wait for next year . . Now me still not yet pass 🥰,btohqsg
I don't believe in ang pow. I want to share the joy with you  go celebrate with you but you rejected,btohqsg
So many thing to do .. on this Monday 😭,btohqsg
I so many times want to meet you for kopi  you always busy coincidently,btohqsg
Wah Lau eh .. usually at shop I hard to go out want ..  usually at shop dine in . Cos usually have customer come in 1 hours or 30 min time .. then something they late . Then I jam Liao 😔,btohqsg
Now no need  I see your face already...,btohqsg
So .. see my face LiaoTonight can dream and pay now me ?,btohqsg
You happy can Liao 😂 ..,btohqsg
Plus now I cannot dine in also,btohqsg
Save more money first to avoid all this place 😂,btohqsg
Save money or not is not important  just stay safe ...,btohqsg
John  have you send McLaren his bd greetings?,btohqsg
Y no need .. can lar,btohqsg
Lol. Only boss can .. 😂,btohqsg
You photo also eating ice cream...lol,btohqsg
But it up to the boss lar. Boss can keep their unvaccinated stuff too,btohqsg
Don't want lah  I want birthday boy happy!,btohqsg
Bday or not  everyday happy can already,btohqsg
Good night  go for your beauty sleep,btohqsg
Is this considered positive or negative?,btohqsg
Why need to set up private group to discuss some penny stock ? This present chat group no good meh...unless you have insider info of that stock only member can see...😁,btohqsg
Exclusive Release :21st Editionof In Conversation with Pika WorldSpill the Beans:🛒Selling our Stocks Positions 🕹The Yield Curve 💵Corporate Results 🚚Politics in Equity Market 🎉All is Well 💰Our Forecast.Pika World wishes you a joyous weekend!Cheers Pika Nat.,btohqsg
Focused group.Too much chatter here  hard to focus.Over there we just discuss and share information of HS Optimus and keep each other abreast of latest news/ findings / research . Nothing else.,btohqsg
And I am trying to count minority chips and who have been absorbing Wong Ben Koon open market selling of 355 mil shares in the past year.So far so good.I believe we are in very good and safe hands. But play micros need to buy up.$0.004 is the price to get.Those who get and wants to join can text your holdings toThomas99. He will send the invite link,btohqsg
👍 try get some $0.004. I really believe will double / multi bag .Timing is good because looks like micros coming soon 🔜.As long can buy up  $0.004 very safe IMO,btohqsg
Facebook becomes Meta.Below link to understand more on what Metaverse is all about.This is very new or many but likley be the future we are heading intohttps://www.npr.org/2021/10/28/1050280500/what-metaverse-is-and-how-it-will-work,btohqsg
https://youtu.be/gElfIo6uw4gGood video to understand the Metaverse,btohqsg
A lot of people complaining about the rule. Even want to sue for discrimination...,btohqsg
Might work overseas. Doubt they will win in singapore lol,btohqsg
😂😂😂 not expecting them to carry out this threat. Just typical sgreans complaining,btohqsg
Scanned through some of the recently played micros pennies(Note: I term micros as any pennies that are trading below $0.020)- Above all monthly chart and can tell that they all broke out of a certain downtrend line (short / longer term)This was led by Tritech great run. I do not believe in coincidence. Things that happen in market is not coincidence.Hence  let’s anticipate a micro Penny game to come.Anticipate right means big money into our bank account.DYODD and do some research to find some Micro counters to hold this period.My take is that Nov2021 Will be the month of the Micro Pennies. I hope to look back in Dec21 and say damn right yea! But even if it don’t come  it doesn’t hurt to be wrong as well. Just react accordingly to the market guys.,btohqsg
Thanks for sharing during weekend 🙏🙏🙏,btohqsg
Yea  nothing to do now bro. Yesterday family day today rest at home 🏡Hope micros party come then shiok already,btohqsg
Haha. I bought CSC @0.013. Good to hold? There is no ew chart sharing for this stock.,btohqsg
Watching a few of the names here. But they dun want to come down to my ask... 😔 Scare fomo and lose Chor... 😂😂😂,btohqsg
Yea micros need to buy up. Cannot contra. Unless you very heng . Timing damn zhun. Otherwise make sure have holding power,btohqsg
Nvm la.. just checking bcos saw CSC in the post.,btohqsg
I just looked through those micros this week got some volume. Not like a recommendation.I think HSO $0.004 only safest. Can hold should not lose this one . But DYODD,btohqsg
The only risk is whether Wong Ben Koon is still selling but then I estimated his chips to be 80m to 150m and actually he can be absorbedI don’t think BBs will be afraid of his selling already .,btohqsg
I see. I bought this before when called KLW. In 0.003 out 0.004 earned a bit.,btohqsg
Very difficult to get $0.003 . That day was one off.,btohqsg
This person made a mistake . That’s why we could get,btohqsg
Such mistakes hard to come by,btohqsg
Ya. Last year December is the penny king play. Buy what counter win what counter. Buy high also win.,btohqsg
Hey bro  have promoted you as ‘the order’ here in this group. Thanks for your help to consolidate shareholdings the hso closed group !Vamos HSO capitano!,btohqsg
Agree with this. BBs are in micro pennies.,btohqsg
Yup I think they setting up the stage for micros pennies,btohqsg
Sorry for the seller .. I hop some 3 .. .. buy him kopi when I TP,btohqsg
Overall he made $29k from this counter over the 4 years. So not too bad .,btohqsg
Hi anyone got telegram link for US stock? Can pm me  TIA,btohqsg
This Squid Game-themed staycation lets you meet the creepy doll  play games & dress up like a character from the Netflix hitThe ultimate winner gets 1 million Grab Rewards points.🦑https://tdy.sg/3mm8vaa@todayonlinesg,btohqsg
No effect … this counter is sleeping quite sometimes  once it cross 75 very chances will go above 0.10 .,btohqsg
Suggest .pls don ask here..because your clearly commentprivate pm u.. ē scam still shared here..There r too many US grps rm.. 🙆🏻almost everyday deleting automatic added to e scam grp😂🤣,btohqsg
I play US markets too. Got many around. Just do a search will show,btohqsg
Will PM.. there's an affiliated US group.. somewhat. Most of the members there are in here as well,btohqsg
Yup  minimal effect this news but I think still better than no catalyst. First resistance 69 now,btohqsg
https://t.me/joinchat/d0iEN4SDAhdlM2JlThis is our us group chat  Mystic boss is also in the chat. 👍🏻,btohqsg
Looks like Going to rest for a little .,btohqsg
China's factory activity shrinks for 2nd month in sign of economic woes aheadOctober 31  2021 2:01 PMBEIJING (REUTERS) - China's factory activity contracted more than expected in October to shrink for a second month  hurt by persistently high raw material prices and softer domestic demand  pointing to more economic disquiet in the final quarter of 2021.Read more:https://bit.ly/3jUJC3B,btohqsg
Click to help me win $20https://s.lazada.sg/s.Zr2vI,btohqsg
"Raffles Education's operations in India under ""potential investigation""  ID Gan steps downhttps://t.co/DXB7CXStaQOctober 31  2021 at 04:53PM",btohqsg
Kindly don’t promote before checking with admins,btohqsg
Lai this big BB support SGX !!! 38 HUAT AR !!,btohqsg
Hey all As mentioned  those who have HS Optimus bought up shares  do pmThomas99to show your holdings before being invited to the HSO group.Thanks 🙏🏻 and appreciates. Based on the count so far  it seems that we might be able to gather 10% of minority votes  to call EGM to try to oust / get a board seat rep.Let’s see how it goes.,btohqsg
Got. Far East hospitality back to prexovid,btohqsg
Far East hospitality. Wow   returned back to precovid prices.,btohqsg
Ascot got a bit more room... 20 cents or so,btohqsg
CDL Htrust hit support and rebounded to resistance on weekly,btohqsg
CDL hospitality still got a long way,btohqsg
But Nov is not known to be a good green month... 🤞🏻,btohqsg
if we’ve bought under brokerage _ Tiger  iFSM  MoMoo  etc…not sure how’s shareholding being “counted”   as it’s under “custodian”  Unlike those directly linked to CDP.,btohqsg
just my opinion.   Anybody with clearer understanding  Kindly advise.  Thanks.,btohqsg
From my understanding with POEMS  they will PM you to ask for your votes,btohqsg
Hope they restructure into my picks,btohqsg
Caution ⛔️ on. Raffles Edu.I think possible suspension counter.If Oei already out  should run away with him. The next halt is suspension I reckon.,btohqsg
I do rmb seeing Affin withdraw the summons. And thought Raffles Edu have settled with Affin,btohqsg
Today! I m also order pizza. haha,btohqsg
Is it a trend to order pizza nowadays?,btohqsg
I had order this .. not bad..,btohqsg
AFFIN bank case is a history already,btohqsg
Yup... raffles edu already settled with them...,btohqsg
Now OHL is a minority shareholder. Basically a toothless tiger....,btohqsg
But I will not write OHL off completely  as he may accumulate back his shares at lower levels....,btohqsg
Based on latest filing in SGX.,btohqsg
nope. He said he does not own any more RE share now,btohqsg
Basic rule so much uncertainty then step aside la,btohqsg
Hahaha starhub and Singtel both sux for end user,btohqsg
DBS gave new TP for Starhub..,btohqsg
Sunpower this counter in my blacklist since day one.I never want to touch this counter even though it being dropped a lot recently,btohqsg
Operating cash flow similar to Hyflux,btohqsg
usually utiltiies company have... tight cash flow,btohqsg
they depend more on the ability to finance..,btohqsg
well   hopefully they can continue to finance themselves,btohqsg
I maybe wrong because my investment hardly make few hundreds,btohqsg
It's a valid point.. markets reaction however...,btohqsg
Some precious metals news out of China.https://mobile.twitter.com/oriental_ghost/status/1454076438907289607,btohqsg
Singtelgd👍 appears hidden divergence fr. Sept near 2.31then raise to highs 2.59.. unfortunately recent appear bearish regular divergence and last wk closing 2.50 ugly.. suggest temp. avoid😅!,btohqsg
I don’t like to touch telco counters too much competition.And we can get free chats and free calls from Social media,btohqsg
Ya.. me🙆🏻 too.. avoid Sinktel! But opportunity arise always can try😅,btohqsg
If $2 can try .Price now sorry…,btohqsg
Ya.. feel blessed for those tried near $2 end Oct '20..,btohqsg
Always is price move then analyst report,btohqsg
Bro Kent  I know u will not trust 马后炮 analysts report wan lah😂🤣,btohqsg
Those follow analysts report r 后知后觉 者,btohqsg
👍.. same thking after I🙆🏻 learning so many lessons by 马后炮 analysts report😂,btohqsg
Analysts?most of them not even invest in stock markets.Most of them paid to write,btohqsg
Yes  we hv to respect their rice bowl,btohqsg
Analysts downgraded Keppel reits to $1 .I am ready to scoop $30k or more lol,btohqsg
Really? Surprised. Confirmed dngrade or u see wrongly is upgrade?,btohqsg
Come la $1I scoop $50k  I promise,btohqsg
Friday closing high vol. with big gap-up flying missile and appear 探顶神针,btohqsg
This keppel reit to by maybank?,btohqsg
haha.. wait 80c better.. unless u tell me tat u scoop SPH near $1 last yr😬😜,btohqsg
DBS tp for keppel now is 1.4,btohqsg
Where the 1 dollar REIT report...,btohqsg
Come I will scoop $50k if $1I will screenshot,btohqsg
Ya.. bro Desmond joking with us lah.. me🙆🏻 no vest.. because holding ah gong KepCorp🛳🏭,btohqsg
What to do~ two analyst give two different view,btohqsg
Datacentre stil very hot  in demand sector,btohqsg
I am waiting if Keppel reits $1.I put 50k,btohqsg
Keppel DC 1 dollar I throw my life saving in also,btohqsg
No la !Can’t be  if $1 then another $100k,btohqsg
Kep-DC already turned to a dntrend stk,btohqsg
For swing trading can.. investment avoid.. IMO,btohqsg
There is a new IPO DC REIT coming if not wrong,btohqsg
Dividend yields less than 4%… I don’t really focus,btohqsg
Knn why invest ETFBecause you don’t know reits,btohqsg
I don’t care laI know what best reits,btohqsg
Knn .. no wonder your 6 pack blur Liao .. cannot see 😝,btohqsg
No more six pac only meat lol,btohqsg
Eat too much . Eyes also tired .. see thing also wrongly 😂,btohqsg
Got lah.. fake rebound 🪃 🤞 50.. but ugly closing last wk.. gd to temp. avoid,btohqsg
Knn reits you must ask me first,btohqsg
Multiple rounds... But each round less,btohqsg
Ascott was 4.44% base on current price and will increase bk >5% - 7% compared to Fraser HT only +2% yield,btohqsg
Indeed.. Ascott would be a better choice wrt dividends,btohqsg
I don’t want to share reits hereYou decided your own,btohqsg
P5 difficult la too heavy float difficult to push as Sinjia and Sunrise,btohqsg
I see Tritech got action but I am watching.,btohqsg
Abundance I don’t think got chance because they sold profitable company that I don’t know why they sold profitable company,btohqsg
Abundance profit margin before tax very small only 2%They are distributer and not manufacture,btohqsg
https://links.sgx.com/FileOpen/2021%2011%2001%20Press%20Release%20-%20HydraX%20.ashx?App=Announcement&FileID=688977Hatten land unhalt with Crypto announcement…,btohqsg
https://links.sgx.com/FileOpen/JVA%20Sihanouk.ashx?App=Announcement&FileID=688978Great News for Hong Lai Huat. Bottomed pick right this one at $0.096. Today  it will gap up. Last friday PA says it all. Good luck Holders!,btohqsg
yup will gap up  holders who got $0.096 with me all will win. Do OTOT,btohqsg
Wah Huat ah hatten land. Today should gap up after unhalt,btohqsg
All stocks in SGX related to crypto will chiong,btohqsg
Nice! Hope it gaps up too. Huat ah!,btohqsg
Shares placement at 0.06 which is 0.001 higher than last closing price before trading halt. Unlike some other shares offer huge discount to last traded price  which caused the stock to plunge after unhalt,btohqsg
Hopefully hatten land can become the next Sinjia land,btohqsg
Hatten land management really revamp the whole business model. Now going full on into crypto,btohqsg
Initially I thought just rental for crypto mining,btohqsg
Now develop and operate crypto exchange but not sure if it will be successful though,btohqsg
Hopefully hatten land can help to pull his fellow “land” brother along,btohqsg
Today is Hatten day? Huat ah.,btohqsg
order keep not getting fillled since 64,btohqsg
wonder who buying such huge volume,btohqsg
This is old news already.. on 26 Oct ☹️,btohqsg
waiting for market open  hatten very fishy,btohqsg
when free can share? thanks bro.,btohqsg
Hatten later sell on news maybe,btohqsg
Haha sgx is anything can happen one,btohqsg
yeap donno keep going up  placement share is 0.06 right,btohqsg
well if u guys wan chase then go ahead  good luck haha,btohqsg
So cannot give opinion on this,btohqsg
Hatten like break 71 free style,btohqsg
See first lah. It was pressed down everyday a week  even on Friday just before halt. May be BB pressed and collected?,btohqsg
SPH and SPH reit chiong 👏👏A lot of asset in SPH inc Qoo10  ifast  m1  data centre  etc,btohqsg
Will it continue to drop till 50?,btohqsg
CSC brewing is on the way,btohqsg
Ya LB 4 safe  pickup wait for 6-7,btohqsg
i try RH 0.19  not moving,btohqsg
SAM kor helped to mouth my MERMAID?,btohqsg
Hard to say bro . Doubt so but current glove sentiment not good,btohqsg
HSO  10 000 lots sell down. Anyone gotten? can advise who is the counter party? Want to see whether is Wong,btohqsg
Hgh finally up   last time follow call and put inside freezer for half year already 👌,btohqsg
Sorry about last time. they faked break out. got caught too and cut,btohqsg
I take the risk on this stock with low liquid,btohqsg
Jyjy.. i also waiting it come out from wate,btohqsg
OKH...slow and steady buy @ 21.,btohqsg
Penny BB not woke up yet?,btohqsg
hlh also no wake up yet,btohqsg
phew lucky didnt chase hatten haha,btohqsg
get at placement price safest for hatten,btohqsg
fraser htrust.. got people demand 0.485,btohqsg
will be really happy for you if you manage to huat,btohqsg
All thanks to@MysticDaxpower foresight and detailed research bros,btohqsg
Wong please sit back seat for now,btohqsg
Dunno will kana burnt or not,btohqsg
Sis Cherie  feelAEMgap-up opening & BO 4.20$ again not 🤥 this round.. thk is not cheating us again ba😅..🤣,btohqsg
Yea. about time the best micro penny in SGX get it on the go.,btohqsg
$0.004 is the safe price yo. anyways buy need to make sure can hold,btohqsg
Hso no more 4 liao. I sold half of my shen yao tot to buy hso but seem like its goin to run 😔,btohqsg
Think I made wrong move for hatten😅,btohqsg
The selling for hatten is strong,btohqsg
ya strange alot of ppl so hype of hatten this morning,btohqsg
Up 15% lah. Sure got profit taking.,btohqsg
truemaybe later afternoon actionThose who took profit may play hatten again haha,btohqsg
/supermicro penny get readyMonkey comeInvite you all join microwave cook,btohqsg
omg what happen to JT  where all the JT supporters go,btohqsg
Haha anyway I small player nia la,btohqsg
Next week results out. Hopefully will have some buy up before announcement,btohqsg
long very little i guess  most ppl contra,btohqsg
That's true... The contra is hai si ren,btohqsg
haha... Bro  u will b rewarded I thk (🤫  because me🙆🏻 follow u🤣),btohqsg
play small ok luh..Cant be like BB keep buying millions of shares  don have that much to commit haha,btohqsg
Time for other counters that are left behind.. go go,btohqsg
01-11-2021 10:17:09 0.00400 5 000 000 PHILLIPAdded HS Optimus. DYODD.Wong sold at least 30 000 lots today at $0.004. maybe some at $0.005 too.Soon he shall be zeroed i believe. $0.004 good price to collect from him.,btohqsg
Added more HS Optimus $0.004. I believe this price almost risk free and the time has come for retailers to absorb Wong's selling. I assume right now he have only 50 000 to 120 000 lots left.If buy need to hold out.My view is this one is a double/multi-bagger counter.Join at your own risk too.DYODD,btohqsg
67 looks like very strong support for hatten,btohqsg
I thought the gap up will be closed but hidden buyers keep coming in at 67,btohqsg
U say like this Shortist sure attack 67,btohqsg
Why shortist keep attacking glove counters. Even though covid becomes endemic but profits still very strong  unlike some loss making companies but flying up like crazy,btohqsg
Thot all contra sell finish le,btohqsg
I may be totally wrong  but I heard COVID is negotiating with WHO for a Xmas ceasefire. Should be why shortists are putting their bets on gloves counters,btohqsg
shipping and logistic - GKE YZJ to benefit with year end buying spee,btohqsg
Ya must clear 121 then can move,btohqsg
up a bit then kena press down,btohqsg
metalco good to accumulate some at 61/62 for next run to 70,btohqsg
Oxpay Fin getting better $0.320 seems support now. Slow and steady,btohqsg
wouldnt say short to 60 but can q to buy at 60 haha,btohqsg
ppl cashing out  getting ready 11.11 sale,btohqsg
riverstone got desperate buyersaverage down? haha,btohqsg
Who say net pac will move,btohqsg
The Place seems like a good chance to catch.,btohqsg
where got so many shortist  players just cannot TAHAN     sell and cut loss !!,btohqsg
Test add some Asiamedic $0.018. Seems stable. DYODD.,btohqsg
Anyone seeing China everbright. Good news and haven’t move.,btohqsg
yea  need it to move for SIIC/Moya/Sanli to move too,btohqsg
Weird de. I waiting for it to break out then buy sia,btohqsg
Hatten🪙 chase abit BO 68..reduce position if S 65 breakdn..,btohqsg
Ya.. thk am e most toh near 65 for shortist TP.. pm ki😅,btohqsg
i don think is shortist ba  ppl just cashing out,btohqsg
I think ppl cash out morning le la,btohqsg
so as long price drop confirm shortist? lol,btohqsg
Retailers can one mouth down so power meh,btohqsg
ya... 🇸🇬 kee.. except 🇭🇰HSI didi toh,btohqsg
Traders 💧🤤 if can bid bk or avg up 65..,btohqsg
Haha sis. Ur emoji too powerful. I catch no 🏀,btohqsg
One word.. today gap-up is a reversal signal 🚥.. tbc closing (unless shortists tanxin),btohqsg
Will recover? Or  gone case liao? 😓,btohqsg
🍗McDonald’s🍗➡️ 1-For-1 Chicken McCrispy® (2pc) Extra Value Meal📆 1 - 11 Nov💃 Redeem via McD App/ McDelivery📍 Selected outlets👉 More info:bit.ly/3mnaMBH@goodlobang,btohqsg
Kent Cheong Kok Yungjiak simi ? ban mian ?,btohqsg
chicken mccrispy cannot eat too much  max. 2 pcs  more will feel sickening  cos' too oily,btohqsg
AirAsia X shares sink as much as 21% amid going concern doubtNovember 01  2021 11:00 AMThe long-haul budget carrier was categorised as a financially distressed firm  giving it a ear to recast its finances or risk losing its Malaysian listing.Read more:https://bit.ly/3pVEyQb,btohqsg
I can eat 4 before 🤮,btohqsg
maybe only me ba  old liao  stomach cannot take it 😅,btohqsg
Can be trained and adjusted  as long as you have that iron in you!!!,btohqsg
The iron is dead and gone,btohqsg
Calcium also quite strong and hard! As long as not Calcium Carbonate...,btohqsg
