text,group
Broker's take: Phillip upgrades Sheng Siong to 'buy' on record Q3 gross marginshttps://ift.tt/3pVjLwoNovember 01  2021 at 12:19PM,btohqsg
We need bossku back! Its obvious bossku is the key to MY prosperity!,btohqsg
And our ever Low profile's Jho,btohqsg
Why he keeps eyebrowing and not eating the super ring? 🤤,btohqsg
Everbright Water wins multiple water projects in Jiangsu and Shandonghttps://t.co/yTeQJvEoAYNovember 01  2021 at 11:58AM,btohqsg
@wantomeegot some coverage. See whether any one buy trigger it,btohqsg
I not vested yet. Haha I chase later,btohqsg
If later fast and furious can slap ownself Liao,btohqsg
today Top 2nd volume but yet. the entire SJ forum have no talking .means not many retailers are in this HSO.So who exactly absorbed Wong open market selling .,btohqsg
Not one HS Optimus thread was bumped up in SJ too.,btohqsg
but after today  i believe we should not see HS Optimus at $0.003/$0.004. I believe it will maintain $0.004/$0.005.Therefore  $0.004 is the price to collect if can hold. If cannot hold   no one should dabble,btohqsg
yea  slowly  micros no need to chase. need to camp at good price.,btohqsg
Have been queuing for it but cannot get at 04,btohqsg
Wong still have 50 - 120m based on estimate,btohqsg
i got a feeling thaibev 730 will break today.,btohqsg
I got mix feeling for hatten,btohqsg
Got feeling rex going to cheong,btohqsg
I just queue and don’t look at it already,btohqsg
Most Q toto har.. didi ki hor..,btohqsg
got to be patient bro. got chance i feel since wong sold today.,btohqsg
Your lot is 100s or 1000s,btohqsg
Selling over liao.. Now is time for BB to push. 🤣,btohqsg
On top walls very thick not scare,btohqsg
Me joking lah  bro. Mai kia..,btohqsg
E chart issit go 76 short again,btohqsg
"Singapore is working towards opening up while keeping the human cost of Covid-19 low  which means reopening will take ""a little bit longer  a few months""  said PM Lee.https://str.sg/3peX",btohqsg
BB woke up and hoot shortists.,btohqsg
yea i think going to rest . big cloud above,btohqsg
Hatten let’s go above 70 la,btohqsg
Hatten got walls sia.. Seems real.,btohqsg
Sinjia😳 did I see wrongly  so fast,btohqsg
You price 52?  Maybe have to wait cny period hoot Abalone,btohqsg
What’s with the 8m married deal,btohqsg
Yes suddenly big volume sell down .. donno what wrong,btohqsg
Oceanus ...so many 1lot 1 lot buy up,btohqsg
Boldtek seems like have one last leg,btohqsg
Wow oceanus who kept buy 100 haha,btohqsg
At least wont get delist news. Haha,btohqsg
watch the place - support at 100  swinging back up soon,btohqsg
Boldtek got profits can take in the next spike,btohqsg
Oceanus going to delist won't go up de,btohqsg
the place may do a sinjia repeat,btohqsg
Sure? Can Chiong to what price?,btohqsg
the place 1st pitstop 112 then 120,btohqsg
the place is coming for showtime,btohqsg
Is it? I thought still OK.,btohqsg
From where to derive this ya?,btohqsg
I bought this morning at 68 sold at 68.. lol,btohqsg
I see cannot break 70 also sell. Sian 1/2,btohqsg
not easy. market feels like weakening,btohqsg
I'm rather optimistic about it. Despite strong selling  hatten has managed the maintain at 68-ish. Hence their rejection to low prices is high and is indicative of rise.. just my view,btohqsg
Golden and GeO are more interesting for next few days,btohqsg
Agree. Can still keep if close 68/69.,btohqsg
Oceanus🦪.. gd opportunity for those wish to 🅿️ short term 37/38,btohqsg
I encountered the strong throw this morning till 66 in just 2 min from 69/70 to 66/67.. so I decided to set my selling point at 68 again. Who knows just within 30 sec it sold off,btohqsg
Thk am already PnD..pm PnP our Hatten🪙,btohqsg
King Wan never see daylight… everyday drop n drop,btohqsg
Don't like that lah. The day will come..,btohqsg
Drop with very small volume.. Mai kia.,btohqsg
Nice merc day high  maybe gap up tomorrow,btohqsg
Lol. 5.07 pm still can get matched price,btohqsg
U ownself boss  don't need worry,btohqsg
SGX to partner with Shanghai Stock Exchange subsidiary to bring securities market data to Chinese investorsRead:https://link.theedgesingapore.com/UaV5wMEgmJKzXjJB9Download our app:edgesg.link/appdl,btohqsg
Positive for SGX market. With effect from today 1st Nov 2021. Give it some time  hopefully we have more players in SGX.,btohqsg
KLW still no drop queue 4 pips still no get despatch early queuing...,btohqsg
PropNex terminates master franchise agreement in Vietnam but will maintain single franchise therehttps://ift.tt/3bv99MeNovember 01  2021 at 05:53PM,btohqsg
Lol then the SGX system starts flagging the increased price volatility w trade w cautions queries etc 😂😂,btohqsg
Hahaha... I can see that happening,btohqsg
haha  i hope it really does bring more game to SGX market. Will be interesting to watch whether any crazy play ups and if they will bother much about our market even.,btohqsg
Tomorrow see if possible to get hattan at 69,btohqsg
1H revenue drop but profit increase.3Q revenue up but profit decline.YoY.….,btohqsg
Let’s see how the market responds tomorrow,btohqsg
Got raw material increase price also,btohqsg
Ask them come list in sgx,btohqsg
Space taken up by this 2 ... Profit all drop alot,btohqsg
Those mid and small FNB all jialet,btohqsg
Morning big boss mentioned Liao 😂,btohqsg
This is pm lee say want,btohqsg
Means that the healthcare situation very jialat,btohqsg
For them to go back on their word and pride,btohqsg
So oyk just follow the same sentence .. boss say Liao .. so I worked must follow 😭,btohqsg
Wow 10.9b rmb in debt investments  rich,btohqsg
See la   who ask them never invest in healthcare,btohqsg
They are more of an investment company than shipping,btohqsg
Also alot of nurse and doctor quit Liao,btohqsg
Haha... That's true. Never give us 10% dividend,btohqsg
They keep increase bed and icu bed . All nurses and doctor also run,btohqsg
Singapore must learn it's lesson the painful way,btohqsg
English article for potato like me,btohqsg
Yup! Now advertising at Malaysian.. Singapore need more Dr. My nephew apply also.. haha,btohqsg
Ask him ask for more pay ah,btohqsg
Yes . Malaysia come . Can take back RM 10k above,btohqsg
But si bei xiong the work,btohqsg
My customer 1 person do  3 person work now,btohqsg
I think basic is SGD3500.. my nephew try first.. not sure able to get or not..,btohqsg
Doctor so low the pay ?,btohqsg
Ask him no 4.5k no come,btohqsg
My friend doctor 29 earning about 4.5-5k leh,btohqsg
wa zun bo.. tat time say impurity delay,btohqsg
Coz he just get the Mo 3 moths.. not sure able to get or not.. experience 3yr.,btohqsg
3 years experience a lot more leh,btohqsg
No  now he is in Kuching hospital,btohqsg
You ask someone 3 year experience take 3.5k,btohqsg
He fresh grad.. I ask him try first see how..,btohqsg
Sg fresh grad get 4.5k + cpf,btohqsg
that's on the positive side... but there's also this possibility for them to jeopardize the market and bring their famous pump and dump culture here. don know if i make sense.,btohqsg
And then they give Malaysia who want to work in sg 3.5k??,btohqsg
Go those crypto scams lor....put in a few hundreds  get back 5 digits sum,btohqsg
Hope his portfolio can help him.. get in.. he said in Kuching get a lot experience from the hospital.. try n see..,btohqsg
Yup! He now only 4.5k RM,btohqsg
and will only favour them further as is on sgx stocks.,btohqsg
Better than never move at all,btohqsg
Malaysian is like that.. so now try Sg first.. then apply NZ too,btohqsg
Just take a look Debts investment 26% in real estate,btohqsg
is a double edge sword  may not be for the weak hearted,btohqsg
And real estate ...drop a lot lately,btohqsg
Japanese - JapAmerican - YankeeHong Kong - HongkeeAussie - AssBritain - Bitch,btohqsg
Take that as a big opportunity to make big bucks too. Anticipate is the key here,btohqsg
noted bro. or can we outsmart them?,btohqsg
☔ Don't put away that umbrella - more rainy days are expected in the first half of November  with thundery showers forecast on most afternoons  the Met Service says.https://cna.asia/3w8832n,btohqsg
And even in IT   the discrepancy is big,btohqsg
I heard many start pay already 4-5k,btohqsg
And got big companies like Google offering 7-8k,btohqsg
And doctor tuition fee so high,btohqsg
Singapore really don't value their doctors,btohqsg
IT will plateau at around 7-10k,btohqsg
