text,group
last time i ate was $6,btohqsg
same as King of Fried rice,btohqsg
Wow  if pass by that area must try out.,btohqsg
Lol I got my 2 dollars from them  but then when I had to register for shit I stopped.,btohqsg
Funny. These scammers so far give me 20 over dollars for doing those 1minute tasks.,btohqsg
I do many times for the first time lo haha,btohqsg
Meaning u scammed the scammers....haha power 💪💪,btohqsg
Ya lo they just pay me the minimal amount for first time then I ghosted them,btohqsg
This is eat until Sian .. haha .. almost those old stall uncle and auntie know me when I go .. even now .. I stay BLK 22 havelock road .. I grown up from there 😂😂😂😂😂,btohqsg
No lar .. average about 25 to 35 now unlink case,btohqsg
this guy never die b4 lol,btohqsg
On my way to hoot durian !,btohqsg
Are you inviting us to go over now?,btohqsg
u ask them pack seeds in box or dabao whole fruit,btohqsg
My customer working here .. get a kg only 14 dollars from him 😂😂😂,btohqsg
This one $14/kg is damn cheap,btohqsg
My customer working here .. he gave me discount 😂😂,btohqsg
$14/kg is below cost. Johor A now cost 14.5 and Pahang A 16.5,btohqsg
Yea .. he told me .. cos boss not around .. 😂😂😂,btohqsg
alamak never sell him T shirt,btohqsg
Wow cheap man. If I go got discount haha 😂,btohqsg
Kns. His boss know sure cry,btohqsg
From my place travel there far.. if good taste I don’t mind..,btohqsg
This one johor msw. Doesn’t suit you,btohqsg
U see u know liao ah? Really expert,btohqsg
You will complain watery if you eat this.,btohqsg
U know my taste ah bro🙏,btohqsg
Greatest trader... Just 10x return? Disappointing...,btohqsg
Indeed greatest bullshit trader of all time,btohqsg
Be careful guys   we got an influx recently,btohqsg
Looks like they are mostly bots,btohqsg
Anyone here into RPi? I got hooked last year... Kept buying these little babies... 🤣,btohqsg
I have 3 RPi4 and 1 RPi3,btohqsg
I lent my old rpi3 to my friend and never got it back...,btohqsg
Hosting my own cloud and webserver,btohqsg
That's really nice 👍 keep up the learning,btohqsg
With some olive oil and vinegar,btohqsg
Realised last minute my balsamic vinegar expired. Left with extra virgin olive oil,btohqsg
Expired still can eat ah.. extra aged only,btohqsg
I eat a lot of expired stuff...,btohqsg
Looks like the bread I ate in Israel,btohqsg
But dairy cream I don't dare eat expired,btohqsg
Power.. isreal also got go to,btohqsg
Haha... Might have to do the taste check..,btohqsg
Ya. You amazed m overwhelmed me by your knowledge 😱,btohqsg
Better get new one. Later see doctor more ex,btohqsg
Yes lah. Keep stunning me 😂😂😂 even your era IT also know  walau,btohqsg
Mine era FORTRAN you know or not? Lol,btohqsg
Sam  u know how to bake too?,btohqsg
Yes he does! Really good husband candidate,btohqsg
OO I only know concept but didn't have any hand on,btohqsg
I also gave back liow lol,btohqsg
The closest I did was powerbuilder,btohqsg
Got try before.. but not my cup of tea.,btohqsg
Power fortran.. still very popular in scientific communities,btohqsg
Python replacing it bit by bit,btohqsg
Heard it's math modules were superior,btohqsg
Really some of the best programmers come out of engineering,btohqsg
You know so much  why are you .. ,btohqsg
And Singapore has limited opportunities as always,btohqsg
Knowledge not enough  must have opportunity to show,btohqsg
Maybe his current company doesn’t appreciate him enough he shd move out,btohqsg
scarcity is only when the environment is constrained ..like SG,btohqsg
Some boss feel threatened will suppress,btohqsg
if ur co have 10x of u   compare to 1x of u around. play a big part,btohqsg
indeed.. don't dare to stand out too much in office,btohqsg
I still think your boss does not value you enough. If he does no need fight,btohqsg
for a Boss to fight  his bottom line must be threatened with my absence,btohqsg
Banks often work on a replaceable model,btohqsg
Big companies very complicated. The best may not be promoted,btohqsg
indeed.. HR business is serious stuff..,btohqsg
Will move out soon. Just finishing up some more time .. don't want to appear as a job hopper,btohqsg
In conclusion: must be at the right place at the right time with the right people,btohqsg
Yes  a good boss is very important,btohqsg
In a way  paying  back my dues to my current Boss. He willingly took me in,btohqsg
But old spinster maybe nice to Sam,btohqsg
when i didn't have banking experince,btohqsg
Data analytics is the in thing now,btohqsg
hmm.. what is  old sinister ?,btohqsg
How many jobs u have so far,btohqsg
Current job is my 3rd one,btohqsg
Yes  can't job hop too much,btohqsg
I did start up for my first job,btohqsg
Innovation is a keyword for lack of procedures,btohqsg
My old friend in banking told me this afternoon she also going to quit after she finish up some tasks,btohqsg
They power. I very fast cannot tahan already,btohqsg
She can retire any time lah,btohqsg
Mai gong wu gong bo liao,btohqsg
Knn .. come out at this hours,btohqsg
You got one month to attack the market..,btohqsg
I see many depressed ppl on chat.. Maybe coz of the pandemic,btohqsg
Be careful wait they take parang chase you,btohqsg
Trading/investing is a lonely journey.. Go with your gut feeling and research,btohqsg
I support 1 lot by 1 mouth 😃,btohqsg
End of August then we flex,btohqsg
This one month eye open bigger,btohqsg
Ya August is exciting month...got chance to huat big if buy correct counters,btohqsg
Last year make a mistake liao.. Hope this year strategy change abit,btohqsg
But don't always think of job hopping..must sell your soul one then think of reward later,btohqsg
sometimes some places will throw the soul away after they are done with it,btohqsg
each soul must have a backup plan,btohqsg
This one only u work for the company then can feel it.. Others just giving general comments,btohqsg
KUO. Cement 28 support. Bounced off previous 28 point. 40 first target,btohqsg
It's easy to say unhappy just leave the job,btohqsg
The other company hiring u also waiting for u to fill the sai,btohqsg
Cement haven’t broke down. Ew still valid as haven touch 27,btohqsg
If 28 holds then next wave around 34/5,btohqsg
So many waiting for KUO.. I skip this one,btohqsg
Got plentiful stuck liao.. Got up then good also.. No up just put to rot,btohqsg
I will skip as well  dangerous one,btohqsg
I check some news on war at Tajikistan border.. Taliban thingy,btohqsg
Ya Aug hv a lot to play,btohqsg
Play cement I rather play JT,btohqsg
Should be still strong uptrend but I avoid.. Add cement rather add SY,btohqsg
SY one pip more chor.. Cement want earn one pip also hard,btohqsg
Chance of stuck higher than the chance to run few pips,btohqsg
Ya SY worth to punt...check out master yuan's chart,btohqsg
Put to rot.. Not playing.. Don't feel good too,btohqsg
JT I feel is good still. Can hold around 84 will have next wave,btohqsg
Crude oil on uptrend.. Got limited growth.. If u keep for dividend still OK.. Don't expect those insane run like last year,btohqsg
OPEC open their mouth.. shag already,btohqsg
10cents should be still able to hit when result period,btohqsg
Guys  I just learn one thingMost investors broke when they try to prove they are right and Mr Market is wrong,btohqsg
Share price dropped drastically.. 99% of the time is yum gong,btohqsg
Even MR KUO good profit and prospect but the drop cannot be ignore,btohqsg
"""subtly"" trying to say. why the hell are you still looking at cement.",btohqsg
and that he believes it will go down more,btohqsg
i am here just to profit 1 or 2 pips for cement,btohqsg
94 drop to 28..don't think so good let traders multibag la.. So many eyeing on it,btohqsg
Ok anyway tmr just load hph 😂😂,btohqsg
Price is what Mr Market willing to pay,btohqsg
MR kuo conviction is still have.. But the price hammered until fishy,btohqsg
Don't know internally got what issue,btohqsg
Better Mai kay kiang go average,btohqsg
Think got cash flow issue.. The payment for new plant is delayed,btohqsg
Can keep a close lookout for HLH.,btohqsg
Starting to see some movement in older pennies. Can try to bottom scoop as well instead of chasing when shoot up. Such as recent ones abundance and AnAn,btohqsg
I think prefer SY over ocean,btohqsg
Stuckist a lot too.. Want to push really need the same bb,btohqsg
PE ratio too high got punish by market,btohqsg
means they have intentions liao. The investors all put in money for IPO before launch,btohqsg
ya happy with what i have now liao,btohqsg
SY is a good toto pick,btohqsg
Not sure will still kenna play up,btohqsg
Ocean still not out of watchlist yet after so many months of application,btohqsg
Tomorrow I call and check for you,btohqsg
This one not speculative anymore.. Growing towards strong FA.. Quite worthwhile to punt,btohqsg
If ant IPO Liao Alibaba fly to the moon 🥰,btohqsg
End of August.. I think last day,btohqsg
I am waiting for it .. 🥰🥰,btohqsg
After so many rounds of follow thru penny counters I learn something,btohqsg
You learn how to eat MSW,btohqsg
I learn to lose more money😢😢,btohqsg
Alibaba dlc worth a gamble 😭😂,btohqsg
What u buy must keep secret?,btohqsg
I learn to lose Chor !,btohqsg
You follow the shouting here 99% u lose chor one la,btohqsg
SY got FA not toto leh haha,btohqsg
If got 6 then add again... I also stewdent.. Quite poor,btohqsg
Morning mouth that hph 225...angry liao,btohqsg
Bro  I wanted toBut l learn recentlyAvoid buying even it is good company when market sentiment is bad …,btohqsg
I learnt many things recently because I loss money lol,btohqsg
Ali dlc is a high risk counter which have a expired date on it .. but when up or down it 5 time,btohqsg
Float 10Mil usd.. Need to open bank then can mouth,btohqsg
Hmm.. Result after trading.. We just gambling for good result.. Can be bad also,btohqsg
I bought on Friday liao leh...still jiak ah😅,btohqsg
220 really queue for fun sia..,btohqsg
Singapore property boomingPasir Ris new condo  $2k psf 85% sold first day launch,btohqsg
Tmr got 225 I eat lor.. If start 230 then sua liao,btohqsg
Abit wasted.. If bo tio port covid got chance hit 32cents,btohqsg
And I tot that price at pasir ris is crazy....knn,btohqsg
I nv check news ma.. Weekend then do research,btohqsg
If may n June bo affect maybe better than 2017,btohqsg
All ports hit record throughput around the world,btohqsg
U song lor... Sold at 475,btohqsg
I stupid stupid just hold lol,btohqsg
so better buy hph usd over sgd ?,btohqsg
Yes most of us bought usd,btohqsg
I most probably hold till 2023 DMfi list...heehee,btohqsg
Former sti component not for contra,btohqsg
OK la.. Can eat cai peng,btohqsg
hph results may come out end of day,btohqsg
Ya.. Holding too.. Not bad ma.. Y sell,btohqsg
Monde nissin also on the rise,btohqsg
Yes it's eod for previous releases,btohqsg
Contra golden energy still make sense.. Hph no movement de,btohqsg
My sixth sense says got six cent hkd,btohqsg
knn price can lose to sanli,btohqsg
sanli move up just to kena sell from ssh,btohqsg
Crude oil price keep go up.. Inventory low.. Impact jt profit,btohqsg
Still a good counter with strong profit but investors forward looking,btohqsg
Bo growth story then don't expect to go up,btohqsg
Sanli manipulated laI almost press buy button when it was 0.084 but I stubborn I don’t believe lol,btohqsg
This quarter should be another record.. Should Cross over 20Mil sgd net profit.. But doesn't mean stock price will go up,btohqsg
one thing i learn is.. manipulated also got money to earn..,btohqsg
Yantian hiccup really a blow.. But maybe also good chance to add.. Already back to normal running at full cap,btohqsg
Confirmed If we park at Low price before manipulator lure you,btohqsg
U big leg don't eat all hor,btohqsg
Ai Mai AI Mai how to huat,btohqsg
Click ask liao then don't buy,btohqsg
Mailai..later never move then they sell then we kena capitulation,btohqsg
I think I learn ..must manipulate than can earn,btohqsg
Indeed... Must play those low float or got board room fight,btohqsg
Before June hiccup also nv run...,btohqsg
That time park swee swee at 240-245 liao,btohqsg
Then the news come down bb press down again,btohqsg
Desmondgolden energy can buy or not... profit guidance,btohqsg
That do be life... Have to see market maker..,btohqsg
Ya... Those real sellers will not queue to sell.. Display the market depth for u meh,btohqsg
I don’t knowBut the current price PE so highCan they make it,btohqsg
So real buyers will not queue to buy also,btohqsg
If I see got chance to rally I will eat the ask,btohqsg
Can see u are the decisive type,btohqsg
If u trading u hv to be decisive lor.. If u buy to camp for few mths then can queue at lower price,btohqsg
Stock usually rally when we ai Mai ai mai,btohqsg
Thinking of that one pip abit chor.. Don't want to spend that extra pip to buy,btohqsg
Should hv 225 right.. Last closing seems bad,btohqsg
I have one secret counter to buy tomorrowPossibility shots up,btohqsg
This is the situation now hahaha,btohqsg
Hehe.. Holders got advantage.. Run up also nvm.. Got mother shares ma,btohqsg
I can save my meal for month,btohqsg
Haha.. That is y 99% of the traders lose money,btohqsg
Only true investors profit from long run,btohqsg
Ya. Be chao camper is the best.. Like I4 this kind.. Always multibag,btohqsg
But he really good.. But he too humble,btohqsg
You got high fever anot ? Pasir ris new launch psf $2k ? You sure Bo ?,btohqsg
He can smell the smoke from far,btohqsg
Lan sai 3C energy he also can multibag,btohqsg
Show me the proof .. lolzzz. U got see wrongly anot .. haha,btohqsg
Dunno which idiot will pay 2k for 99 LH at pasir ris,btohqsg
Bro .. for pasir ris PSF 2k? I don believe,btohqsg
Ya and it's easier to identify 10bad stocks than one good stock,btohqsg
Don’t count meI don’t have lol,btohqsg
Chances to find one good counter is rare,btohqsg
HSO business furnitureKoda price shot up so high now,btohqsg
There's opportunity cost in looking at charts all day,btohqsg
😍😍good mindset.. But sometimes human want easy way out.. Some might get lucky but most will suffer,btohqsg
Still hard to believed 🤔🤔 I check with my friend first,btohqsg
So true...surprised why u asked wats PE..lol,btohqsg
Knn  you don’t believe me  no MSW,btohqsg
Knn I sure don believe you .. haha .. that y now I am checking with my agent friend now .. what is going on ..,btohqsg
Gxgx.. Isdn  Nano n frencken all to the moon one,btohqsg
Kimly very local  not much surprise,btohqsg
Only those we buy still under deep water,btohqsg
He cat lar .. knn wait for his MSW wait until my pants wet Liao,btohqsg
Lumber price low more profit or high more profit,btohqsg
Anyone here got this 四大天王 sure moon,btohqsg
I can only message till 12 midnightI got to sleep,btohqsg
Low Lumber price attract more building activities,btohqsg
Hope avarga can see 40cents next mth,btohqsg
Like that my house at bugis area can sell 2500 PSF now 🤔🤔🤔,btohqsg
Envy u.. Rich ppl Flex really different.. Unintentionally,btohqsg
He don't have to flex also can feel it,btohqsg
Cos Paris ris can sell this price .. y town area cannot sell ? 😭,btohqsg
Knn .. I lose chor no people know 😭,btohqsg
If second house sell really is huat,btohqsg
I flex MSW and food only,btohqsg
Drive merc AMG.. Live penthouse.. Everyday eat top grade durian.. Kb no money,btohqsg
Before government come up with cooling measure,btohqsg
Merc AMG rent per day 45 dollars ..,btohqsg
I where got live penthouses .. HDB Nia .,btohqsg
Hope this lifetime got chance to match your wealth status,btohqsg
I know quite impossible but really want to feel when I flex,btohqsg
I work like a dog no people know .. lose Chor no people know .. 😭 I cry behind no one know too,btohqsg
Knn  Singaporean buy Pasir Ris condo $2K psf  85% sold  99 years leaseToo many rich in Singapore,btohqsg
Must hv money to lose chor also ma,btohqsg
We peasant don't even have the capital to lose chor,btohqsg
Knn recently loss ChorBook to see psychology doctor,btohqsg
Unless ur c class is C43/C63 ?,btohqsg
Wow C63 .. V8 engine . My dream dream car . 🥰🥰🥰🥰,btohqsg
Ur merc is C  E class right? The pic is A class,btohqsg
Then can feel the lose chorness,btohqsg
I got to sleep nowTomorrow bet hard,btohqsg
Yes c .. rent c or a around 45 to 60 range,btohqsg
Must work hard to be like them.. Their lose chor is really peanut,btohqsg
Work hard also != Become rich,btohqsg
No wonder the Chinese want to 平躺,btohqsg
I also feel like that soon,btohqsg
At least can stay above poverty,btohqsg
To be rich like them is close to impossible,btohqsg
Rich...have how much then consider rich?,btohqsg
Invest in this shape .. when slim down your get a good returned 😋😋,btohqsg
Censored where ? Which part  ?,btohqsg
KnnOne carton sardine $5Can opener $6,btohqsg
wtf zzz thinkin of food ?,btohqsg
U can use knife to make opening,btohqsg
Adam khoo you follow him few year .. u become millionaire,btohqsg
Let me guess how he got rich at 26... Inheritance at 26,btohqsg
He is my seniors in secondary school 😂,btohqsg
Ppl who are rich all do business one leh  buy stock flip houses,btohqsg
But one japanese trader got 200m below 30  also,btohqsg
Doug Gibsonhas been banned! Reason:CAS ban.,btohqsg
This week can watch Chasen closely.,btohqsg
HSO at 0.4cts is diamond hands  0.6cts paper hands,btohqsg
Wow premarket oceans post this. Hinting ah..,btohqsg
Fuyu already 30cents. Come on GSS super lagging,btohqsg
Hoot Golden Energy $0.395 on matching. DYODDhttps://t.co/D8h48tG0D6,btohqsg
Raffles medical good to buy now?,btohqsg
It seem like I anti climate ...... All shouting this up that up....haha,btohqsg
GSS Nav is 11 cents. Come on super lagging. Fuyu flying to 0.305,btohqsg
1 million queue.. so fast exhausted lol,btohqsg
Cannot imagine   2k psf for Pasir ris ?,btohqsg
BTC chiong yah...sudden chiong to 39k dn back a bit,btohqsg
Good bonus  market up  crypto profit,btohqsg
STI blue chips affected by HSI plunge\\,btohqsg
Nb we had a gd start this morning...nb,btohqsg
Bcoz of the private education crackdown?,btohqsg
internet company also badly affected .....,btohqsg
not for short term o ne,btohqsg
price will stuck for 1 month at least,btohqsg
in terms of pure TA... not really,btohqsg
Seems stuck around the range for few days liao,btohqsg
been an isdn stalker. only can buy at the next 75c,btohqsg
buy sg side sell pse side,btohqsg
Sgx 1 pip up nia ...😢,btohqsg
I still hoping it drop more haha,btohqsg
ISDN neither here nor there now  look at 705 range first,btohqsg
Later got ppl do tat wahahaha,btohqsg
Jerrygo ask philipines come sgx buy,btohqsg
india stock market really very strong,btohqsg
strongest compared to taiwan and pse,btohqsg
sgx only strong at morning side,btohqsg
Lai choose one.. Jeep Hph or dm?,btohqsg
Cannot be 6mths nv move at all ma,btohqsg
I que at 435 now hopefully get some more,btohqsg
Don’t worry lahhhhhh~Peasant cum#losechoruncle here not panicking yet..Relaxxxxxxx~Will come one!! 😎🙏🏼,btohqsg
Avarga is treasure.. I put swee swee and frame up one,btohqsg
Treasure is buried deep down n nv move one...,btohqsg
Antique then... Wait for 知音人to buy,btohqsg
I’m hoping to see manyyyy mouths later today! 😬🤞🏼,btohqsg
Bo bian.. must average down abit.. lol,btohqsg
So long never see boss Jerry say this!!😎😍,btohqsg
Ghost month comingBb jiak n hoot liao,btohqsg
So many? U huat liao.. each counter earn 100k u got 5 mil ady😆,btohqsg
Lol.. Ya knn I typing then the queue disappeared,btohqsg
one shot ding dong here and there,btohqsg
Hmm.. Prediction will go back to 225 as usual,btohqsg
the mouth up of 225 less ovlume,btohqsg
Not sure.. These few months same hand buy sell?,btohqsg
I all in JT.. JT rocket I got chance lie on the beach.. JT down I clean table till 90yo,btohqsg
Ya.. Conviction leh.. Arbo my profile pic is JT,btohqsg
The sentiment can suddenly U turn one,btohqsg
Was so hype on cement n jt.. End up tio flush,btohqsg
Pls dont put dm or hph,btohqsg
Cannot put.. Hph n DM heavy,btohqsg
Sunpower and china sunsine days are gone??? Any potential,btohqsg
These are penny.  So i ask here,btohqsg
isdn buy only at 75 dyodd,btohqsg
Handsome or not nvm  stock up can liao,btohqsg
Rex  fresh reversal today  contra pressure dry up  uptrend supported by 20MA and channel  EP 210  SL 200  tgt 235 then 265,btohqsg
the other view i have is also  mini dip to 71 for a spring up :),btohqsg
today RH leading  smm also green  rex pullback 5 days already  good chance,btohqsg
today indices plunge  oil also not so strong  maybe go slow first  stay light,btohqsg
usually heavy float stocks.. move.. quite independently,btohqsg
Added more Chasen $0.072. Hope they don't disappoint. The bounce looks fresh and should have some room. DYODD. I see it going to 8 series but please OTOT EP/TP/SL. Thanks,btohqsg
Hopefully  i think there is program to go up. Not sure  Pray*,btohqsg
"Sweeee may she ""rocket crazily"" arhhh 🤭",btohqsg
HSO Wong came out to sell again. Based on preliminary calculations  he should have 160 - 190 mil shares. Which is worth about $700k only. This one matter of time will be played,btohqsg
Where’s the Reddit power haha . How many u buy ?,btohqsg
Request to Mr. sgYuan  any chart available for SingMyanmar?,btohqsg
Waiting for u to mouth 4 and stack the buy queue scare off sellers,btohqsg
SG Mid-Day Top Volume Leader BoardOIO led the gainers up 9.1%  rebounded from month low  tracking bitcoin rally; Raffles Med higher after IH21 earnings more than double to $39.4 Y/Y; Golden Energy higher after guiding significant improvement of 1H21 earnings; Hanwell broke month high; Lion-OCBC HSTech led the losers down 4.9% after China's latest crackdown on tutoring firmsMore here!,btohqsg
Hot money flow out from hk,btohqsg
wow la golden energy BB like to trap players !!,btohqsg
Looks like got buyers $0.385-$0.390. Pray,btohqsg
this counter cannot chase !! patience win !!,btohqsg
Ok I decided to give some love and attention to my pan hong during my lunch break. Lol 🤣🤣🤣,btohqsg
Before you chase  ask yourself are you prepared to carry babies?And what’s your SL level when you buy,btohqsg
Thank you  Mr. Yuan.It's moving now.,btohqsg
#RHPetrogasThe weeklyt chartin time to celebrate national day? does seem so....,btohqsg
Ntegrator subzero freeze need volcanic heat to de froze it 😂😂😂😂,btohqsg
Interra resource 42 hooe can go up ,btohqsg
FJ Benjamin is time for go up soon ☺️,btohqsg
each buy one - 2k lots to finish his selling faster LOL,btohqsg
I have already. Added 2k lots today HsO.,btohqsg
keep dropping      what china gov doing is crazy !!,btohqsg
Yeah  you guys can seriously consider to Absorbe Wong's Selling of HSO alongside the BBs. $0.004 hard to lose if can hold.,btohqsg
Is there any Hk stock chat?,btohqsg
Singapore’s manufacturing output grew at a faster pace of 27.5 per cent in June from the same period last year  boosted by the electronics  biomedical and chemicals clusters  official data showed on Monday (Aug 26). Come on GSS. Lagging below NAV,btohqsg
will you and Ray form a focus grp like abd?,btohqsg
Will do when $0.004 is more stable  otherwise many will wait and get too tired one. Once Single seller Wong stops  means Its Time!,btohqsg
Peter lim stuck or run RoadTm n fj stunt?!,btohqsg
very little done at 3 .. about time,btohqsg
I am stuck AMOS too. Painful.,btohqsg
I give up liaoPhilip a n b teamPass left n rightDon't want play with them liao,btohqsg
We need profit alertIf don't have need storyHeavy metal  look like story book come out soon,btohqsg
My friend holding Amos at 0.018 . 1700 lot . Painfully too 😭😭,btohqsg
