text,group
HSTECH hit 518 per Master Yuan's chart  what's next ?,btohqsg
Our alert ðŸ‘†ðŸ¿.. shall TP at HH lorðŸ¤£HKðŸ‡­ðŸ‡°Land ðŸ’”break-dn channel dn toward S S zone USD3.07 - 3.10USDä¸¤ç‚¹ç¡®è®¤ ä¸‰ç‚¹éªŒè¯!,btohqsg
Wait for 3 week then come bk,btohqsg
Now all go CNY shopping  cut cut hair buy CNY clothing lah,btohqsg
Give 20% discount for chat members  rmbr bring CDC coupons ar,btohqsg
rem. to cut cost bk to 60s or 1970 pack an angbaoðŸ§§ $2.. it's okay to save cost to $1.20.. ðŸ¤£,btohqsg
CNY always spent at sentosa casino,btohqsg
She sure tOh three of uðŸ¤£,btohqsg
aiyo  continue PnD.. HSIðŸ‡­ðŸ‡° tOh to -1.1% liao.. why not yet ðŸ’”break-dn 15K? ðŸ¤£,btohqsg
I always collect 4 figures çº¢åŒ…ðŸ˜‚,btohqsg
Need panic sell then can rebound,btohqsg
Bring JA go salon cut hair and massage Tiger,btohqsg
Wu meh ? His house got swimming pool .I can wear my red swimming trunks go swim ðŸ˜,btohqsg
private swimmingðŸ‘™ pools..BroðŸ¯ can naked short.. ðŸ¤£,btohqsg
å¼€çŽ©ç¬‘çš„ã€‚ã€‚actually I don't know how to swim,btohqsg
BroðŸ¯ wish closer liao..AEM kena ðŸ’” break-dn $3..$2.93 -3.6%,btohqsg
pls. hor.. fibonacci 1.236% at 2.38$ only 4ref. nia.. AEM TA dailyðŸ“‰,btohqsg
past 05Ds Big & Huge PA vol. SIC,btohqsg
influence by Bro John..BIG so HuGeðŸ¤£,btohqsg
really hated to see a stk didi appears Gap Theory.. especially so many jump-dn gap-dn opening,btohqsg
Forget about AEM in e past cheong ki to >5$.. will it follow temasick behind bkside ðŸ“½ï¸ fr. >6.50$ dumpâ›½dn to near 60c ðŸ”œ?Retailers forgot tat AEM was only a micro-penny stk price <5c.. can it dump dn to <$1 near future?,btohqsg
Sold genting morning 99 later see can buy 98,btohqsg
Today should be a good day to collect on the cheap,btohqsg
Yes agree.. Except yzj.. Diam diam kee,btohqsg
Oh.. Bro DaxðŸ¤  bk fr. Outstation.. cheong ahðŸ¤£,btohqsg
Bro Dax  this yr got give red pac to members bo ðŸ˜‚,btohqsg
I thkðŸ’­ sure hv angbaoðŸ§§ fr. Bro DaxðŸ¤  because he save a lot past 03Ds when he disappear ðŸ«¥ in our SgX mktðŸ¤£,btohqsg
chasen everyday di di lo    can buy ?,btohqsg
Aiya  nap ðŸ’¤ðŸ˜´ times no screaming pls.. oh no  hanging clothes wetðŸ¤£,btohqsg
bot kep dc reit 1.76 finally and sold yzj 1.64  dont care  switch,btohqsg
i lost money  cry no tears  luckily only bot 400share,btohqsg
jardin c&c 29.52  due liao  should i take profit or pick up? haiyo  cannot decide   any expect in jardin c& c?,btohqsg
almost 1 dollar profit liao  should i take,btohqsg
Can buy a kopi-o with fairprice app..ðŸ˜‚,btohqsg
Rain come Tampines  now very heavy,btohqsg
Ya lor.. Imagine is snow not rain ðŸ˜‚,btohqsg
If sg suddenly snow think alot ppl å†·æ­»,btohqsg
I tot go China see snow but æ€•è¢«å†»æ­»ðŸ˜…,btohqsg
OMG.. SGX so many sellers huh?,btohqsg
So cute hor.. All always JA  JA.. Scarely she is just a fat obasanðŸ¤£,btohqsg
Thot JoJo said he is a boy ?,btohqsg
oh  J is a boy  JA is a girl  Johnlee is a hum sup old man ?,btohqsg
Feb alot of result out.Abalone 0.007.Now china there so  cui. Yumgong liao,btohqsg
John oso quite young around MC age,btohqsg
Smi follow US side go holland,btohqsg
ðŸ’”break-dn meanSMIðŸª™ S S 2.5c.. ðŸ˜œðŸ™ˆ,btohqsg
tiger  after massage where the two of u go makan?,btohqsg
All don't worried  just let this market melt,btohqsg
ä¸è¦è¯¯ä¼šï¼Œ not w JA.. A group of us,btohqsg
ya.. melt in your mouthðŸ‘„not in your handðŸ¤².. ðŸ¤£,btohqsg
