text,group
I think black out all vrn better,btohqsg
Erm here is only jdm or mixture ah?,btohqsg
Actually want to poll also can,btohqsg
Long poll to list all car brand,btohqsg
Ownself add in ahOUR OFFICIAL IG!!!Instagram.com/officialteamscdBIG BOSS@ODCSSCHIO BU ADMINInstagram.com/fuwafuwakoupAHLIAN ADMINinstagram.com/athenathefd2DOORBOY 🚪Instagram.com/drop_gear01PHOTOGRAPHERS 📸Instagram.com/AdwinshootsInstagram.com/_tdgshoots_Instagram.com/car_spotters09Instagram.com/xun.visualsinstagram.com/clickshift.photoMEMBERS ❤️Instagram.com/thatsuskoupInstagram.com/tonytannnnnnnnnInstagram.com/yarisedanInstagram.com/iabbear_Instagram.com/m.w.qiangInstagram.com/boostedglx_Instagram.com/fd1m__Instagram.com/inferno_f10Instagram.com/brendiprolo_34Instagram.com/velosterdiarysgInstagram.com/honda_jdm_gkInstagram.com/jxsxph.sInstagram.com/ProjectPengwynInstagram.com/demon_vezzieInstagram.com/zimmy.bobInstagram.com/whitehorse_sginstagram.com/clickshift.photoinstagram.com/boxxvanInstagram.com/denzel.winstagram.com/16yearolddidiInstagram.com/blueglcInstagram.com/howilson_Instagram.com/bluefitzz,btohqsg
My friend is looking for a car photographer to shoot 3 cars in Mid Apr on a Sunday afternoon.Selected photographer will get to shootGhibliWraithFlying SpurPM your rates & link to your portfolio if any.,btohqsg
Ownself add in ahOUR OFFICIAL IG!!!Instagram.com/officialteamscdBIG BOSS@ODCSSCHIO BU ADMINInstagram.com/fuwafuwakoupAHLIAN ADMINinstagram.com/athenathefd2DOORBOY 🚪Instagram.com/drop_gear01PHOTOGRAPHERS 📸Instagram.com/AdwinshootsInstagram.com/_tdgshoots_Instagram.com/car_spotters09Instagram.com/xun.visualsinstagram.com/clickshift.photoMEMBERS ❤️Instagram.com/thatsuskoupInstagram.com/tonytannnnnnnnnInstagram.com/yarisedanInstagram.com/iabbear_Instagram.com/m.w.qiangInstagram.com/boostedglx_Instagram.com/fd1m__Instagram.com/inferno_f10Instagram.com/brendiprolo_34Instagram.com/velosterdiarysgInstagram.com/honda_jdm_gkInstagram.com/jxsxph.sInstagram.com/ProjectPengwynInstagram.com/demon_vezzieInstagram.com/zimmy.bobInstagram.com/whitehorse_sginstagram.com/clickshift.photoinstagram.com/boxxvanInstagram.com/denzel.winstagram.com/16yearolddidiInstagram.com/blueglcInstagram.com/howilson_Instagram.com/bluefitzzInstagram.com/babygabbymk7,btohqsg
Need check with big boss he approve then can 👍🏽,btohqsg
WOAHH THE ENTIRES OF THE TEAMSCD TIKTOK VIDEO ARE OVERWHELMING,btohqsg
Ownself add in ahOUR OFFICIAL IG!!!Instagram.com/officialteamscdBIG BOSS@ODCSSCHIO BU ADMINInstagram.com/fuwafuwakoupAHLIAN ADMINinstagram.com/athenathefd2DOORBOY 🚪Instagram.com/drop_gear01PHOTOGRAPHERS 📸Instagram.com/AdwinshootsInstagram.com/_tdgshoots_Instagram.com/car_spotters09Instagram.com/xun.visualsinstagram.com/clickshift.photoMEMBERS ❤️Instagram.com/thatsuskoupInstagram.com/tonytannnnnnnnnInstagram.com/yarisedanInstagram.com/iabbear_Instagram.com/boostedglx_Instagram.com/fd1m__Instagram.com/inferno_f10Instagram.com/brendiprolo_34Instagram.com/velosterdiarysgInstagram.com/honda_jdm_gkInstagram.com/jxsxph.sInstagram.com/ProjectPengwynInstagram.com/demon_vezzieInstagram.com/zimmy.bobInstagram.com/whitehorse_sginstagram.com/clickshift.photoinstagram.com/boxxvanInstagram.com/denzel.winstagram.com/16yearolddidiInstagram.com/blueglcInstagram.com/howilson_Instagram.com/bluefitzzInstagram.com/babygabbymk7Instagram.com/itzgrayy_,btohqsg
one of the best.. i just cant get it away.. best with ice cold beer,btohqsg
Hi guys  anywhere in bukit panjang mscp got jet wash machine?,btohqsg
after 10pm no more jet wash i think,btohqsg
Wash + rims + Vacuum. $15.50,btohqsg
we need like 5 more people lol,btohqsg
Is like a live taobao snack store,btohqsg
English name is starlett i think,btohqsg
Mai hahahaha boring   nothing to buy there for me,btohqsg
I rather go don don 😂,btohqsg
ice cold bottle of this after hotpot very shiok.,btohqsg
slow la bro hahaha civic only,btohqsg
Hahah that’s what they all say 🤣 and then open vtec say byeeeeeee,btohqsg
this can win jiajia herbal tea alr,btohqsg
Guys  I planning to do a short tiktok video for our#TeamSCDusing this sound.If you guys are interested please PM me your best portrait orientation photo of your car.definitely need a ton of them. the more the merrier!!!,btohqsg
What you mean hunting ??? 😱,btohqsg
everyone sent their photo damn power,btohqsg
Hahah want let me smell your exhaust only right 🥲,btohqsg
Hahaha I later my car see yours..for sure breakdown,btohqsg
Must definitely feature this chio car leh,btohqsg
Yours the most famous chio car how to challenge you boss,btohqsg
Later i help him take HGAGAHA,btohqsg
Mine also slow but no additional features on it,btohqsg
If u come u can see my fallen bumper,btohqsg
Oh it happened yst. I forgot to say,btohqsg
I was too upset abt it,btohqsg
But is okay  the person that caused it gonna change it for me LMAO,btohqsg
Its now supporting with tape. LMAO,btohqsg
And also a single bumper clip,btohqsg
Really heng i install the damn clip sia,btohqsg
so the clip not working for you ah,btohqsg
But fella that kipnapped me yst bang kerb.,btohqsg
Heng the clip saved it a lil bit,btohqsg
Yea he gonna change a new one for me,btohqsg
mugen much more expensive than fd2r,btohqsg
can send your car photo?? I making a tiktok video about#TeamSCD,btohqsg
portrait orientation would be the best,btohqsg
my partner doorgirl is back in action 😂,btohqsg
my assistant also very power 👍🏻👍🏻,btohqsg
our@hayleescdmade a ig of our group. and posted a few of our members cars,btohqsg
Haha no one knew when doorgirl went missing but yes got new updates on pinned messages,btohqsg
